author,title,description,url,urlToImage,publishedAt,content,source.id,source.name
Michael Crider,One of my favorite gaming keyboards is on sale for a measly $45,"You can find a good mechanical keyboard. You can find a cheap mechanical keyboard. You can even find a good, cheap, mechanical keyboard. But finding one from a major gaming PC brand, with the solid software support to match, is a tall order. Today you can man…",https://www.pcworld.com/article/2780408/get-my-editors-choice-gaming-keyboard-for-45.html,https://www.pcworld.com/wp-content/uploads/2025/05/DSC07620.jpg?quality=50&strip=all&w=1024,2025-05-13T17:46:51Z,"Skip to contentType your search and hit enter
When you purchase through links in our articles, we may earn a small commission. This doesn't affect our editorial independence
.
You can find a good … [+2016 chars]",,PCWorld
Steven Paul,"2026 BMW X7 Pricing, Specs, and What’s New","The 2026 BMW X7 offers little in the way of meaningful change, although it is the final year of the first-generation BMW X7. BMW makes Parking Assistant Professional standard on the model, but no meaningful...
First published by https://www.bmwblog.com",https://www.bmwblog.com/2025/05/13/2026-bmw-x7-pricing-specs/,https://cdn.bmwblog.com/wp-content/uploads/2023/10/BMW-X7-M60i-Frozen-Pure-Grey-10.jpg,2025-05-13T17:46:26Z,"The 2026 BMW X7 offers little in the way of meaningful change, although it is the final year of the first-generation BMW X7. BMW makes Parking Assistant Professional standard on the model, but no mea… [+5616 chars]",,BMWBLOG
Laura McQuarrie,Multi-Layered Sour Candies - Toxic Waste Zapz Deliver a Mouth-Puckering Experience (TrendHunter.com),"(TrendHunter.com) At the 2025 Sweets & Snacks Expo, TikTok-viral brand Toxic Waste launched Toxic Waste Zapz, a new kind of candy with a hard outer shell and a chewy middle filled with sour flavor. These...",https://www.trendhunter.com/trends/toxic-waste-zapz,https://cdn.trendhunterstatic.com/thumbs/570/toxic-waste-zapz.jpeg,2025-05-13T17:45:04Z,"At the 2025 Sweets &amp; Snacks Expo, TikTok-viral brand Toxic Waste launched Toxic Waste Zapz, a new kind of candy with a hard outer shell and a chewy middle filled with sour flavor. These boundary-… [+603 chars]",,Trendhunter.com
Ben Schoon,"Google adding UWB for Android trackers ‘this month,’ luggage and airline integration coming too","One of the biggest downsides of Android’s Find My Device network – now called the “Find Hub” – was a lack of UWB (ultra-wideband) support for easily finding nearby trackers. Now, that’s finally about to be available, and Google is also teasing luggage and air…",http://9to5google.com/2025/05/13/google-android-tracker-uwb-find-hub-airline-luggage-integration/,https://i0.wp.com/9to5google.com/wp-content/uploads/sites/4/2024/08/Moto-Tag-hands-on-6.jpg?resize=1200%2C628&quality=82&strip=all&ssl=1,2025-05-13T17:45:00Z,"One of the biggest downsides of Android’s Find My Device network now called the “Find Hub” was a lack of UWB (ultra-wideband) support for easily finding nearby trackers. Now, that’s finally about to … [+1714 chars]",,9to5google.com
pr@cmswire.com (Scott Clark),"Customer Loyalty Starts With Consistency, Ends With Advocacy","Customer journeys and emotional experiences turn satisfied customers into outspoken brand promoters.
Continue reading...",https://www.cmswire.com/customer-experience/customer-loyalty-starts-with-consistency-ends-with-advocacy/,https://www.cmswire.com/-/media/93d72fd32c4e4e509a9976e233274940.ashx,2025-05-13T17:44:46Z,"Customer loyalty isnt just earned through rewards programs or sales-driven perksits built through consistent, emotionally resonant experiences that meet customers where they are. As expectations rise… [+16411 chars]",,CMSWire
Melissa Curtin,Top Stays in Palm Springs for Every Type of Traveler,"Steeped in mid-century modern architecture, Palm Springs is an easy escape (just two hours from Los Angeles), as a destination to decompress and rejuvenate and a design mecca for aficionados...
The post Top Stays in Palm Springs for Every Type of Traveler app…",https://johnnyjet.com/top-stays-in-palm-springs-for-every-type-of-traveler/,https://johnnyjet.com/wp-content/uploads/2025/05/villa-royale-1.jpg,2025-05-13T17:42:38Z,"Steeped in mid-century modern architecture, Palm Springs is an easy escape (just two hours from Los Angeles), as a destination to decompress and rejuvenate and a design mecca for aficionados of all t… [+8594 chars]",,Johnnyjet.com
Oliver Haslam,You Can Now Use Apple Pay To Buy Games On Your PS5,"You can now use Apple Pay to buy games on your PS5. Here are all the details on this.
The post You Can Now Use Apple Pay To Buy Games On Your PS5 first appeared on Redmond Pie.",https://www.redmondpie.com/you-can-now-use-apple-pay-to-buy-games-on-your-ps5/,https://cdn.redmondpie.com/wp-content/uploads/2020/10/ps5-1200-02.jpg,2025-05-13T17:36:53Z,"Owners of the PlayStation 5 can now use Apple Pay to buy games and in-app content for the first time. The purchases can be made via the PlayStation Store.
The new support adds Apple Pay as an option… [+1305 chars]",,redmondpie.com
Austin Blake,Gemini AI Coming to Android Auto and Google Built-In Cars,"Google is adding more smarts to the driving experience with the introduction of Gemini AI to Android Auto and cars with Google built-in, as announced at today’s The Android Show: I/O Edition. The feature will start rolling out to Android Auto-supported vehicl…",https://www.iphoneincanada.ca/2025/05/13/gemini-ai-android-auto-google-cars/,https://cdn.iphoneincanada.ca/wp-content/uploads/2017/09/iic-logo-1.svg,2025-05-13T17:34:45Z,"Google is adding more smarts to the driving experience with the introduction of Gemini AI to Android Auto and cars with Google built-in, as announced at today’s The Android Show: I/O Edition.
The fe… [+1272 chars]",,iPhone in Canada
avillasboas@insider.com (Antonio Villas-Boas),"Samsung Galaxy S25 Edge first look: Everything you need to know about the sleek, ultra-thin phone","The Samsung Galaxy S25 Edge has a super-slim, lightweight design, but it lacks the dedicated zoom lens and battery life of its Galaxy S25 siblings.",https://www.businessinsider.com/guides/tech/samsung-galaxy-s25-edge-price-release-date-features-specs,https://i.insider.com/68236fbc3fe8d3928365b436?width=1200&format=jpeg,2025-05-13T17:31:32Z,"Samsung announced the Galaxy S25 Edge on May 12 a brand new member of the Galaxy S25 family, and the thinnest Galaxy S model to date.
The Galaxy S25 Edge heralds a new thin-phone category, which, in… [+9527 chars]",business-insider,Business Insider
Ben Schoon,Google says 1 billion RCS messages are sent daily in the US following iPhone adoption,"After a years-long wait, Apple finally added RCS messaging support to the iPhone last year, and that’s resulted in over 1 billion RCS messages being sent every day in the US alone between both Android and iOS devices.



 more…",http://9to5google.com/2025/05/13/google-rcs-messages-billion-daily-us/,https://i0.wp.com/9to5google.com/wp-content/uploads/sites/4/2024/10/Typing-indicators-in-RCS.jpg?resize=1200%2C628&quality=82&strip=all&ssl=1,2025-05-13T17:30:00Z,"After a years-long wait, Apple finally added RCS messaging support to the iPhone last year, and that’s resulted in over 1 billion RCS messages being sent every day in the US alone between both Androi… [+1386 chars]",,9to5google.com
Adnan Farooqui,Cheeky Galaxy S25 Edge ads have Samsung making fun of Apple again,"Samsung has a long history of being cheeky in its ads, poking fun at Apple and what it views to be the shortcomings of the iPhone against its devices. The company hasn't did that as much as it used to do before, but it's back with a bang for the Galaxy S25 Ed…",https://www.sammobile.com/news/samsung-galaxy-s25-edge-lacks-microsd-slot/,https://www.sammobile.com/wp-content/uploads/2025/05/Galaxy-S25-Edge-hands-on-16-1200x675.jpg,2025-05-13T17:29:54Z,"Samsung has a long history of being cheeky in its ads, poking fun at Apple and what it views to be the shortcomings of the iPhone against its devices. The company hasn't did that as much as it used t… [+1314 chars]",,SamMobile
fdemott@businessinsider.com (Filip De Mott),Nvidia jumps back above $3 trillion valuation after announcing chip deal with Saudi Arabia,Nvidia topped a $3 trillion valuation for the first time since February. A fresh AI partnership with Saudi Arabia was boosting the stock on Tuesday.,https://www.businessinsider.com/nvidia-stock-price-3-trillion-valuation-ai-saudi-arabia-trump-2025-5,https://i.insider.com/68237160c6ad288d1480cab7?width=1200&format=jpeg,2025-05-13T17:28:15Z,"The move: Nvidia stock jumped as much as 6.4% to hit an intraday high of $130.99 per share on Monday, The rally pushed to stock to a market cap of $3.16 trillion, the highest valuation for the chip t… [+1128 chars]",business-insider,Business Insider
Aditya Tiwari,Apple launches 'Sound Therapy' music collection for deeper relaxation,"Apple has launched a new audio wellness collection, Sound Therapy, to help you relax, focus, and sleep. Read more...",https://www.neowin.net/news/apple-launches-sound-therapy-music-collection-for-deeper-relaxation/,https://cdn.neowin.com/news/images/uploaded/2025/05/1747154120_apple_music_sound_therapy_story.jpg,2025-05-13T17:26:01Z,"If you are one of those who tune in to Apple Music Sleep for your daily dose of relaxation, the Cupertino giant has launched something new you might want to try. Apple has teamed up with Universal Mu… [+1877 chars]",,Neowin
John Quintet,Google Shifts ‘Find My Device’ to ‘Find Hub’ With Satellite Tracking,"Google is expanding its Find My Device system on Android into something bigger: Find Hub. The new feature aims to help users track not just phones and tablets, but also luggage, skis, Bluetooth tags, and even friends and family. Find Hub will work with an inc…",https://www.iphoneincanada.ca/2025/05/13/google-shifts-find-my-device-to-find-hub-with-satellite-tracking/,https://cdn.iphoneincanada.ca/wp-content/uploads/2017/09/iic-logo-1.svg,2025-05-13T17:25:38Z,"Google is expanding its Find My Device system on Android into something bigger: Find Hub. The new feature aims to help users track not just phones and tablets, but also luggage, skis, Bluetooth tags,… [+1125 chars]",,iPhone in Canada
Oliver Haslam,Apple Pre-Announces New iOS 19 Accessibility Features Ahead Of June’s WWDC,"Apple has pre-announced new iOS 19 accessibility features ahead of June's WWDC. Here is everything you need to know about this.
The post Apple Pre-Announces New iOS 19 Accessibility Features Ahead Of June’s WWDC first appeared on Redmond Pie.",https://www.redmondpie.com/apple-pre-announces-new-ios-19-accessibility-features-ahead-of-junes-wwdc/,https://cdn.redmondpie.com/wp-content/uploads/2025/05/image_2025-05-13_220523483.png,2025-05-13T17:23:32Z,"Apple has announced new accessibility features that will be released to the public later this year. The features will be added to the fall software updates for the iPhone, Mac, and more.
Apple has l… [+2036 chars]",,redmondpie.com
Mark Tyson,"AI agents can be manipulated into giving away your crypto, according to Princeton researchers",Letting an AI agent run your finances could be hazardous to your wealth.,https://www.tomshardware.com/tech-industry/cryptocurrency/ai-agents-can-be-manipulated-into-giving-away-your-crypto-according-to-princeton-researchers,https://cdn.mos.cms.futurecdn.net/gNYoHeSzjeAtyMtP9zbet9.jpg,2025-05-13T17:23:15Z,Researchers from Princeton University warn of AI agents with “underexplored security risks” in a recently published paper. Dubbed 'Real AI Agents with Fake Memories: Fatal Context Manipulation Attack… [+3010 chars],,Tom's Hardware UK
Kyle Kucharski,The MacBook Air M4 is on sale for $850 - a very competitive price for one of the best laptops of 2025,"The M4 MacBook Air refines the ultraportable experience with more memory, better support for external monitors, and the lowest price yet.",https://www.zdnet.com/article/the-macbook-air-m4-is-on-sale-for-850-a-very-competitive-price-for-one-of-the-best-laptops-of-2025/,https://www.zdnet.com/a/img/resize/395019cb379c831cd2701357594f363095b3cc16/2025/03/12/cf46d3fa-18b7-4c4f-973f-e74db9c7d6c3/img-0551.jpg?auto=webp&fit=crop&height=675&width=1200,2025-05-13T17:22:00Z,"The MacBook Air M4 (13-inch) is on sale at Amazon for $850 right now. That's 15% off Apple's newest ultraportable with its most powerful family of chips to date.  
Before Apple announced the MacBook… [+9407 chars]",,ZDNet
Kishalaya Kundu,Apple will use AI and user data in iOS 19 to extend iPhone battery life,"Apple will likely announce iOS 19 at its Worldwide Developers Conference in June, but details about the update have already leaked. A new report claims the next-gen software will include an AI-powered battery management tool that uses data from users' iPhones…",https://www.techspot.com/news/107899-apple-use-ai-user-data-ios-19-extend.html,https://www.techspot.com/images2/news/bigimage/2025/05/2025-05-13-image-6.jpg,2025-05-13T17:21:00Z,"Why it matters: Apple is overhauling its software with a new look and intelligent features. The next iPhone update will include an AI-powered battery tool and a sleek, unified design across iPhone, i… [+2050 chars]",,TechSpot
Jen Juneau,"Robert De Niro, Girlfriend Tiffany Chen Step Out at Cannes Film Festival: Photos","Robert De Niro was joined by girlfriend Tiffany Chen at the Cannes Film Festival, where they held hands during a photocall for his Honorary Palme d'Or.",https://people.com/robert-de-niro-tiffany-chen-cannes-film-festival-photos-honorary-palme-dor-11733879,https://people.com/thmb/AlIUtc6V9bzYXeCiMaDmpuscfGc=/1500x0/filters:no_upscale():max_bytes(150000):strip_icc():focal(767x247:769x249)/Robert-De-Niro-Tiffany-Chen-Cannes-051325-1149b311d34141d6b4ef1e84723977d9.jpg,2025-05-13T17:20:36Z,"<ul><li>Robert De Niro had girlfriend Tiffany Chen by his side as the 78th Cannes Film Festival kicked off in Cannes, France, on Tuesday, May 13</li><li>The couple posed together as they attended a p… [+2638 chars]",,PEOPLE
Ruth Crilly,"Oura Ring Review: FFS, Hasn't The Novelty Worn Off Yet?","Oura Ring 4 Review: Two Month Update from model and author Ruth Crilly. Pros and cons of this piece of wearable tech, including fertility tracking.",https://www.amodelrecommends.com/p/oura-ring-review-ffs-hasnt-the-novelty,"https://substackcdn.com/image/fetch/w_1200,h_600,c_fill,f_jpg,q_auto:good,fl_progressive:steep,g_auto/https%3A%2F%2Fsubstack-post-media.s3.amazonaws.com%2Fpublic%2Fimages%2F5e1aa179-175c-49d5-a84b-e8d7de433c4e_1540x1080.jpeg",2025-05-13T17:18:35Z,"Ah, wearable tech. Youve been missing my posts on this particular subject, havent you? Admit it! For a few weeks back there I went all in on the wearable tech subject, doing rash things like buying t… [+6391 chars]",,Amodelrecommends.com
Christian Zibreg,"Apple Music launches “Sound Therapy” wellness playlists, enhancing popular songs with sound waves or white noise","The “Sound Therapy” Apple Music playlists comprise popular songs enhanced with sound waves or white noise to help you focus, relax and sleep.",https://www.idownloadblog.com/2025/05/13/apple-music-sound-therapy-wellness-playlists-focus-relax-sleep/,https://media.idownloadblog.com/wp-content/uploads/2025/05/Apple-Music-Sound-Therapy-Welness-Playlists-Focus-Relax-Sleep.jpg,2025-05-13T17:17:52Z,"The new Sound Therapy playlists on Apple Music bring popular songs enhanced with sound waves or white noise to help you focus, relax and sleep.
Apple Music’s new wellness audio section. Image: Apple… [+3780 chars]",,Idownloadblog.com
Bloomberg News,Google Unveils Major Android Redesign Ahead of iPhone Overhaul,"Google unveiled the biggest update to its Android mobile operating system in years, weeks before its biggest competitor in the space, Apple Inc., is expected to give a preview of its overhauled iPhone software.",https://financialpost.com/pmn/business-pmn/google-unveils-major-android-redesign-ahead-of-iphone-overhaul,https://smartcdn.gprod.postmedia.digital/financialpost/wp-content/uploads/2025/05/googles-material-3-expressive-android-update.jpg,2025-05-13T17:17:05Z,"(Bloomberg) Google unveiled the biggest update to its Android mobile operating system in years, weeks before its biggest competitor in the space, Apple Inc., is expected to give a preview of its over… [+5388 chars]",financial-post,Financial Post
Johnny Jet,Guests Sue Luxor Hotel in Las Vegas After Alleged Bed Bug Attacks and EMT Visit,"I’ve never stayed at the Luxor Hotel and Casino and after hearing this news, I’m thankful. Three guests are suing the Las Vegas hotel, claiming they were “massacred” by bed bugs...
The post Guests Sue Luxor Hotel in Las Vegas After Alleged Bed Bug Attacks and…",https://johnnyjet.com/guests-sue-luxor-hotel-in-las-vegas-after-alleged-bed-bug-attacks-and-emt-visit/,https://johnnyjet.com/wp-content/uploads/2025/05/Luxor-Hotel-and-Casino-in-Las-Vegas-1.jpg,2025-05-13T17:15:54Z,"I’ve never stayed at the Luxor Hotel and Casino and after hearing this news, I’m thankful. Three guests are suing the Las Vegas hotel, claiming they were massacred by bed bugs during their stay last … [+3257 chars]",,Johnnyjet.com
Lorenzo Marquez,Amazon 2025 Upfront Red Carpet Rundown,"The stars came out to pitch their latest products at the Amazon upfronts and the looks ranged from “not enough” to “a bit much.”     Elizabeth Banks This is unobjectionable, but we can’t shake the feeling that it comes off very stale. We can’t wait for knee-l…",https://tomandlorenzo.com/2025/05/amazon-2025-upfront-red-carpet-rundown/,https://tomandlorenzo.com/wp-content/uploads/2025/05/Amazon-2025-Upfront-Red-Carpet-Rundown-TLO-0.jpg,2025-05-13T17:15:41Z,"Archives: 
Select
 May 2025 
 April 2025 
 March 2025 
 February 2025 
 January 2025 
 December 2024 
 November 2024 
 October 2024 
 September 2024 
 August 2024 
 July 2024 
 June 2024… [+3827 chars]",,tomandlorenzo.com
feedfeeder,"Apple announces new accessibility features, including future support for brain implants - TechCrunch","Apple announces new accessibility features, including future support for brain implantsTechCrunch Apple unveils powerful accessibility features coming later this yearApple Exclusive | Apple to Support Brain-Implant Control of Its DevicesWSJ Apple will let the…",https://slashdot.org/firehose.pl?op=view&amp;id=177488051,,2025-05-13T17:12:39Z,The Fine Print: The following comments are owned by whoever posted them. We are not responsible for them in any way.,,Slashdot.org
Juli Clover,tvOS 18.5 Adds Synchronized Dolby Atmos Playback for AirPlay and Bluetooth Speakers,"The tvOS 18.5 update that Apple seeded to developers yesterday adds support for synchronizing Dolby Atmos playback to speakers over AirPlay or Bluetooth, according to Apple's release notes for the update.





The feature could help address some persistent sy…",https://www.macrumors.com/2025/05/13/tvos-18-5-dolby-atmos-synchronization/,https://images.macrumors.com/t/KrNLjmGnptCUVBzzHI3bfULhtY4=/2500x/article-new/2022/10/Apple-TV-2022-Feature-Blue.jpg,2025-05-13T17:12:28Z,"The tvOS 18.5 update that Apple seeded to developers yesterday adds support for synchronizing Dolby Atmos playback to speakers over AirPlay or Bluetooth, according to Apple's release notes for the up… [+954 chars]",,MacRumors
Primary Author: Laura Ratliff,"Apparently, you can find New York's cleanest public restroom here","Upscale vending machines, sleek design and not a gross stall in sight",https://www.timeout.com/newyork/news/apparently-you-can-find-new-yorks-cleanest-public-restroom-here-051325,https://media.timeout.com/images/106274181/image.jpg,2025-05-13T17:10:59Z,"If you think all New York public bathrooms are gross, grimy or guarded behind a $5 latte, think again. A new national report just revealed the best public restroom in the Empire State—and it’s got mo… [+1798 chars]",,Time Out
Jordan Hart,You shouldn't delete this email if you want a slice of Apple's $95 million Siri settlement,Potential claimants in Apple's $95 million Siri settlement should check their email for details on claiming their share.,https://www.businessinsider.com/hey-siri-settlement-administrator-is-sending-letters-to-apple-users-2025-5,https://i.insider.com/68234ca968a292900801238d?width=1200&format=jpeg,2025-05-13T17:08:10Z,"Potential claimants for Apple's Siri settlement may have received an email on how to file a claim.Sebastien Bozon/AFP via Getty Images
<ul><li>Check your email for a letter about claiming a portion … [+2399 chars]",business-insider,Business Insider
Oliver Haslam,Let This Robot Clean Your Pool And Save $500 While You Still Can,"If you're fortunate enough to have a pool in your backyard, you'll already know how much of a pain it is trying to keep that thing clean. Nobody wants to have to deal with getting leaves and other detritus out of their pool, and that's why having this cool Be…",https://www.redmondpie.com/let-this-robot-clean-your-pool-and-save-500-while-you-still-can/,https://cdn.redmondpie.com/wp-content/uploads/2025/05/beatbot-pool-cleaner-1.jpg,2025-05-13T17:08:09Z,"If you’re fortunate enough to have a pool in your backyard, you’ll already know how much of a pain it is trying to keep that thing clean. Nobody wants to have to deal with getting leaves and other de… [+1483 chars]",,redmondpie.com
Laura McQuarrie,Whiskey-Flavored Sausages - Jack Daniel's Dinner Sausages Feature the Mellow Flavor of Whiskey (TrendHunter.com),(TrendHunter.com) Jack Daniel's Dinner Sausages are artisan-crafted links that blend the mellow flavor of Jack Daniel's Tennessee Whiskey with bold flavors and chef-crafted spice blends. Hardwood smoked for a rich...,https://www.trendhunter.com/trends/jack-daniels-dinner-sausages,https://cdn.trendhunterstatic.com/thumbs/570/jack-daniels-dinner-sausages.jpeg,2025-05-13T17:08:03Z,Jack Daniel's Dinner Sausages are artisan-crafted links that blend the mellow flavor of Jack Daniel's Tennessee Whiskey with bold flavors and chef-crafted spice blends. Hardwood smoked for a rich fla… [+586 chars],,Trendhunter.com
,"NBCUniversal’s 2025 Upfront Showcases Expansive Entertainment, Sports and News Offerings","NBCUniversal’s 2025 Upfront Showcases Expansive Entertainment, Sports and News Offeringsnbcuniversal.com",https://www.nbcuniversal.com/article/nbcuniversal-presents-2025-upfront-content-slate-,https://cdn2.nbcuni.com/NBCUniversal/2025-05/Legendary%20February-2.png?VersionId=JpoWFcMiAQkEk.vcUd47SvYG53WW8xmz,2025-05-13T17:07:13Z,"NBCUniversals content defines culture across every genre, screen, and format. In 2025 and 2026, that impact is amplified by a powerhouse lineup of cultural moments, with NBCUniversal accounting for m… [+8011 chars]",,Nbcuniversal.com
Pres. Donald Trump,Video: Donald Trump and the Semiconductor Crisis. The Strategic Role of Taiwan’s TSMC,"This article consists in a overview of the semiconductor crisis which commenced in 2020, followed by a review of Taiwan’s powerful semiconductor manufacturing conglomerate (TSMC) who is involved in production in Taiwan, the PRC and as well as the U.S.



……",https://www.globalresearch.ca/president-trump-makes-investment-announcement/5886731,https://www.globalresearch.ca/wp-content/uploads/2025/05/trump-investment-speech-1024x569.png,2025-05-13T17:06:39Z,"This article consists in a overview of the semiconductor crisis which commenced in 2020, followed by a review of Taiwan’s powerful semiconductor manufacturing conglomerate (TSMC) who is involved in p… [+32405 chars]",,Globalresearch.ca
Sarah Perez,Google announces 1B+ RCS messages sent in the U.S. daily,"During the Android Show leading up to Google I/O, Google on Tuesday offered a brief update on the adoption of the RCS (Rich Communication Services) protocol, an upgrade to SMS that offers high-resolution photos and videos, typing indicators, read receipts, im…",https://techcrunch.com/2025/05/13/google-announces-1b-rcs-messages-sent-in-the-u-s-daily/,"https://techcrunch.com/wp-content/uploads/2023/01/denny-muller-HfWA-Axq6Ek-unsplash.jpg?resize=1200,800",2025-05-13T17:06:01Z,"During the Android Show leading up to Google I/O, Google on Tuesday offered a brief update on the adoption of the RCS (Rich Communication Services) protocol, an upgrade to SMS that offers high-resolu… [+1503 chars]",techcrunch,TechCrunch
Jason Cross,Apple teams up with Universal Music Group to add Sound Therapy to Apple Music,"Macworld







May 15 is Global Accessibility Awareness Day, and Apple always uses the occasion to highlight some of the new accessibility features coming to iPhones and Macs. This year, Apple’s got another announcement to share: three new Sound Therapy pla…",https://www.macworld.com/article/2780607/apple-teams-up-with-universal-music-group-to-add-sound-therapy-to-apple-music.html,https://www.macworld.com/wp-content/uploads/2025/05/apple-music-sound-therapy.jpg?quality=50&strip=all&w=1024,2025-05-13T17:05:45Z,"Skip to contentType your search and hit enter
When you purchase through links in our articles, we may earn a small commission. This doesn't affect our editorial independence
.
May 15 is Global Acc… [+2368 chars]",,Macworld
