author,title,description,url,urlToImage,publishedAt,content,source.id,source.name
Kendall Waltz,Don’t Book Tickets for Mickey’s Not-So-Scary Halloween Party in 2025 Before You Read This,"Here's everything you should know before going to Mickey's Not-So-Scary Halloween Party in Disney World for 2025
The post Don’t Book Tickets for Mickey’s Not-So-Scary Halloween Party in 2025 Before You Read This first appeared on the disney food blog.",https://www.disneyfoodblog.com/2025/05/13/dont-book-tickets-for-mickeys-not-so-scary-halloween-party-in-2025-before-you-read-this/,https://www.disneyfoodblog.com/wp-content/uploads/2024/08/2024-wdw-mk-magic-kingdom-mnsshp-halloween-party-main-street-map-jackolantern-stack-01-1-700x558.jpg,2025-05-13T20:54:26Z,"The idea of wearing your favorite costume and running into Magic Kingdom to collect all the candy your heart desires is so tempting, but before you buy that Mickey’s Not-So-Scary Halloween Party, rea… [+5845 chars]",,disneyfoodblog.com
Alex Fisher,Oral allergy syndrome: Which fruits and vegetables to watch for,Eating certain fruits and vegetables during peak pollen season could mean a strange reaction for some allergy sufferers.,https://www.nbcchicago.com/news/health/eating-these-fruits-and-vegetables-during-allergy-season-could-cause-a-strange-reaction/3744679/,https://media.nbcchicago.com/2019/09/produce-instagram.jpeg?quality=85&strip=all&resize=1200%2C675,2025-05-13T20:54:21Z,"Eating certain fruits and vegetables during peak pollen season could mean a strange reaction for some allergy sufferers. 
It's an unexpected response called Oral Allergy Syndrome. 
So what is it, w… [+3641 chars]",,NBC Chicago
,Apple introduces new accessibility features,Including braille note taker.,https://www.itnews.com.au/news/apple-introduces-new-accessibility-features-617139?utm_source=feed&utm_medium=rss&utm_campaign=iTnews+Technology+feed,https://i.nextmedia.com.au/News/2025-05-13T133408Z_1_LYNXMPEL4C0O3_RTROPTP_4_APPLE-PRODUCTS-ACCESSIBILITY.JPG,2025-05-13T20:54:00Z,"Apple is bringing a host of new features later this year that are geared towards making its devices more accessible, including a braille note taker and expanded 'zoom' for its mixed-reality headsets,… [+1386 chars]",,iTnews
,Apple introduces new accessibility features,Including braille note taker.,https://www.itnews.com.au/news/apple-introduces-new-accessibility-features-617139?utm_source=feed&utm_medium=rss&utm_campaign=iTnews+,https://i.nextmedia.com.au/News/2025-05-13T133408Z_1_LYNXMPEL4C0O3_RTROPTP_4_APPLE-PRODUCTS-ACCESSIBILITY.JPG,2025-05-13T20:54:00Z,"Apple is bringing a host of new features later this year that are geared towards making its devices more accessible, including a braille note taker and expanded 'zoom' for its mixed-reality headsets,… [+1386 chars]",,iTnews
,Apple introduces new accessibility features,Including braille note taker.,https://www.itnews.com.au/news/apple-introduces-new-accessibility-features-617139?utm_source=feed&utm_medium=rss&utm_campaign=iTnews+Software+feed,https://i.nextmedia.com.au/News/2025-05-13T133408Z_1_LYNXMPEL4C0O3_RTROPTP_4_APPLE-PRODUCTS-ACCESSIBILITY.JPG,2025-05-13T20:54:00Z,"Apple is bringing a host of new features later this year that are geared towards making its devices more accessible, including a braille note taker and expanded 'zoom' for its mixed-reality headsets,… [+1386 chars]",,iTnews
,Apple introduces new accessibility features,Including braille note taker.,https://www.itnews.com.au/news/apple-introduces-new-accessibility-features-617139?utm_source=feed&utm_medium=rss&utm_campaign=iTnews+News+feed,https://i.nextmedia.com.au/News/2025-05-13T133408Z_1_LYNXMPEL4C0O3_RTROPTP_4_APPLE-PRODUCTS-ACCESSIBILITY.JPG,2025-05-13T20:54:00Z,"Apple is bringing a host of new features later this year that are geared towards making its devices more accessible, including a braille note taker and expanded 'zoom' for its mixed-reality headsets,… [+1386 chars]",,iTnews
Justin Kahn,Now even lower: Apple Find My-equipped mini FlashFinder keychain flashlight now $23 Prime shipped,"Update: The deal price on the Apple Find My-equipped FlashFinder has now dropped even lower to $22.99 Prime shipped. Details below in the original post. 



We are now tracking a notable chance to save on the Apple Find My-equipped FlashFinder from Footnote A…",http://9to5toys.com/2025/05/13/apple-find-my-mini-flashfinder-keychain-flashlight-2/,https://i0.wp.com/9to5toys.com/wp-content/uploads/sites/5/2025/01/FlashFinder-Apple-Find-My-Flashlight-03.jpg?resize=1200%2C628&ssl=1,2025-05-13T20:52:48Z,"Update: The deal price on the Apple Find My-equipped FlashFinder has now dropped even lower to $22.99 Prime shipped. Details below in the original post. 
We are now tracking a notable chance to save… [+2586 chars]",,9to5Toys
zerohedge.com,'Biggest Untold Story in Tech': Explosive Book Reveals How Apple Sold Out America To China,"'Biggest Untold Story in Tech': Explosive Book Reveals How Apple Sold Out America To China 
 
Financial Times journalist Patrick McGee has released a gripping new book that meticulously exposes Apple’s deeply troubling ties with China, revealing how these con…",https://biztoc.com/x/8a0a29a2d6036c9c,https://biztoc.com/cdn/8a0a29a2d6036c9c_s.webp,2025-05-13T20:40:54Z,"'Biggest Untold Story in Tech': Explosive Book Reveals How Apple Sold Out America To China 
Financial Times journalist Patrick McGee has released a gripping new book that meticulously exposes Apples… [+146 chars]",,Biztoc.com
Rajat Saini,FastVLM AI Model Shows Potential for Apple’s Smart Glasses,"Apple's development of a new AI model, FastVLM, points to a technology that could drive its anticipated smart glasses. Reports suggest Apple plans to release AI-enabled wearables, with smart glasses potentially launching around 2027. This new model offers a g…",https://www.macobserver.com/news/fastvlm-ai-model-shows-potential-for-apples-smart-glasses/,https://www.macobserver.com/wp-content/uploads/2025/05/apple-smart-glasses.jpg,2025-05-13T20:36:37Z,"Apple’s development of a new AI model, FastVLM, points to a technology that could drive its anticipated smart glasses. Reports suggest Apple plans to release AI-enabled wearables, with smart glasses … [+2448 chars]",,The Mac Observer
"Craig McCarthy, Carl Campanile","Mayor Adams takes page out of Trump’s playbook, launches task force to fight antisemitism",Hizzoner rolled out a new Office to Combat Antisemitism in City Hall on Tuesday ahead of his weekly off-topic presser with the aim of making sure no city funds flow to any group or organization that promotes Jew hate.,https://nypost.com/2025/05/13/us-news/mayor-adams-takes-page-out-of-trumps-playbook-launches-task-force-to-fight-antisemitism/,https://nypost.com/wp-content/uploads/sites/2/2025/05/adams-anti-semetic-task-force-comp.jpg?quality=75&strip=all&w=1024,2025-05-13T20:33:47Z,"Mayor Adams took a page from President Trumps playbook and announced the citys own antisemitism task force after years of local Jewish groups pushing for action.
Hizzoner rolled out a new Office to … [+3894 chars]",,New York Post
,"Samsung Galaxy G25 Anorexia Edition lacks a telephoto lens and has crappy battery life. Your turn, Apple [Obvious]","Samsung Galaxy G25 Anorexia Edition lacks a telephoto lens and has crappy battery life. Your turn, Apple",https://www.fark.com/comments/13669398/Samsung-Galaxy-G25-Anorexia-Edition-lacks-a-telephoto-lens-has-crappy-battery-life-Your-turn-Apple,https://usrimg-full.fark.net/s/sl/fark_slvD7EOjq7OzB3oFnj5ysZJ7NbQ.jpg?AWSAccessKeyId=JO3ELGV4BGLFW7Y3EZXN&Expires=1747627200&Signature=6PV34R6hkZid8HyX%2B89eQz8288w%3D,2025-05-13T20:33:05Z,"<li>Links are submitted by members of the Fark community.
</li><li>When community members submit a link, they also write a custom headline for the story.
</li><li>Other Farkers comment on the links… [+177 chars]",,Fark.com
Pixalate,"Pixalate’s April 2025 Top Grossing Mobile & CTV Apps in LATAM: ‘ViX’ No. 1 on Roku, Amazon Fire TV & Samsung Smart TV in Mexico; ‘Stumble Guys’ Leads in Brazil on Google Play Store","According to Pixalate's research, ‘SimCity’ on Google Play Store generated an estimated $226K in open programmatic ad revenue in Mexico, and ‘Vita Mahjong’ led on Apple App Store in Mexico with $161K in estimated open programmatic ad revenue According to Pixa…",https://www.globenewswire.com/news-release/2025/05/13/3080693/0/en/Pixalate-s-April-2025-Top-Grossing-Mobile-CTV-Apps-in-LATAM-ViX-No-1-on-Roku-Amazon-Fire-TV-Samsung-Smart-TV-in-Mexico-Stumble-Guys-Leads-in-Brazil-on-Google-Play-Store.html,https://ml.globenewswire.com/Resource/Download/0124c010-09d5-402d-839d-4ca1ac736a66,2025-05-13T20:33:00Z,"London, May 13, 2025 (GLOBE NEWSWIRE) -- Pixalate
, a leading global platform for ad fraud protection, privacy, and compliance analytics, today released the April 2025 LATAM Top Grossing Apps Report… [+3022 chars]",,GlobeNewswire
Cult of Mac Deals,Price drop: Apply for up to 150 jobs a day with just one click,"LazyApply saves you time by letting you apply for jobs with just a click -- hundreds of them. Get a lifetime sub now for just $59.97.
(via Cult of Mac - Apple news, rumors, reviews and how-tos)",https://www.cultofmac.com/deals/lazyapply-easy-way-to-apply-for-jobs,https://cdn.cultofmac.com/wp-content/uploads/2022/02/CoM-LazyApply.jpeg,2025-05-13T20:30:14Z,"Studies show it can take between 21 and 80 job applications to land a single offer. And that means getting your dream job can be a real numbers game. Thankfully, you can stack those numbers in your f… [+2498 chars]",,Cult of Mac
Leigh Beadon,Techdirt Podcast Episode 418: The Elonification Of Government,Support us on Patreon » We’ve written a lot about how understanding the playbook Elon Musk used at Twitter is key to understanding his current playbook with DOGE. The people who literally wrote the book on said playbook are New York Times journalists Ryan Mac…,https://www.techdirt.com/2025/05/13/techdirt-podcast-episode-418-the-elonification-of-government/,https://www.techdirt.com/wp-content/themes/techdirt/assets/images/td-rect-logo-white.png,2025-05-13T20:30:00Z,"from the we've-seen-this-before dept
We’ve written a lot about how understanding the playbook Elon Musk used at Twitter is key to understanding his current playbook with DOGE. The people who literal… [+614 chars]",,Techdirt
"Nick Gilbertson, Nick Gilbertson",U.S. Inks Massive $142 Billion Arms Deal with Saudi Arabia,"The United States and Saudi Arabia reached a $142 billion arms deal, President Donald Trump shared on Tuesday.
The post U.S. Inks Massive $142 Billion Arms Deal with Saudi Arabia appeared first on Breitbart.",https://www.breitbart.com/politics/2025/05/13/u-s-inks-massive-142-billion-arms-deal-with-saudi-arabia/,https://media.breitbart.com/media/2025/05/GettyImages-2214294758-2-640x335.jpg,2025-05-13T20:28:53Z,"The United States and Saudi Arabia reached a $142 billion arms deal, President Donald Trump shared on Tuesday.
Trump’s announcement came during his speech at the Saudi-U.S. Investment Forum in Riyad… [+1859 chars]",breitbart-news,Breitbart News
99pi,Fishing In The Night,"Shortwave radio opened a portal to the world—then became a weapon in a high-stakes war of propaganda and power.The Divided Dial is a podcast series about the history of radio from WNYC's On the Media and longtime 99PI contributor, Katie Thornton.Fishing in th…",https://99percentinvisible.org/episode/627-shortwave-feature/,https://99percentinvisible.org/wp-content/uploads/2025/04/divideddial.art_.s2.final_.3k_titles-1-728x728.jpg,2025-05-13T20:28:45Z,"The Divided Dial
 is a podcast series about the history of radio from WNYC’s On the Media and longtime 99PI contributor, Katie Thornton. In season 1, Katie explored the rise of right wing talk radio… [+475 chars]",,99percentinvisible.org
Mey Rude,Here's what to know about Siegfried & Roy before their upcoming series,Jude Law and Andrew Garfield were cast to play Siegfried and Roy in an upcoming TV show.,https://www.out.com/celebs/siegfried-and-roy,https://www.out.com/media-library/image.jpg?id=60207478&width=1200&height=600&coordinates=0%2C39%2C0%2C39,2025-05-13T20:28:32Z,"Things are about to get wild for Jude Law and Andrew Garfield, as the two actors have signed on to portray magicians Siegfried Fischbacher and Roy Horn, respectively, in a new Apple TV+ limited serie… [+5651 chars]",,Out.com
"Shreyas Sinha, Shreyas Sinha",Warren Buffett’s Best and Worst Investments Over His 55-Year Career,"From buying into Coca-Cola at the right moment to sitting out on tech stocks for decades, Buffett’s investment record reflects a mix of long-term successes and occasional missteps.",https://observer.com/2025/05/warren-buffetts-best-worst-investments/,https://observer.com/wp-content/uploads/sites/2/2025/05/GettyImages-492446712-1.jpg?quality=80,2025-05-13T20:27:47Z,"Warren Buffett speaks onstage during Fortune’s Most Powerful Women Summit – Day 2 at the Mandarin Oriental Hotel on October 13, 2015 in Washington, DC. Paul Morigi/Getty Images for Fortune/Time Inc
… [+6246 chars]",,Observer
Vlad,Samsung might kill the Galaxy S26+ in favor of the S26 Edge,"Samsung just unveiled the Galaxy S25 Edge a few hours ago, and we already have a rumor about its successor, as apparently there will definitely be one. According to sources in Korea, the Galaxy S26 Edge will launch alongside the Galaxy S26 and Galaxy S26 Ultr…",https://www.gsmarena.com/samsung_might_kill_the_galaxy_s26_in_favor_of_the_s26_edge-news-67755.php,https://fdn.gsmarena.com/imgroot/news/25/05/samsung-galaxy-s26-edge-rumor/-952x498w6/gsmarena_000.jpg,2025-05-13T20:27:02Z,"Samsung just unveiled the Galaxy S25 Edge a few hours ago, and we already have a rumor about its successor, as apparently there will definitely be one. According to sources in Korea, the Galaxy S26 E… [+1381 chars]",,GSMArena.com
Pixalate,"Pixalate’s April 2025 Top Grossing Mobile and CTV Apps in North America: ‘Happy Color’ Ranked No. 1 on Apple App Store in Canada; ‘Hulu’ No. 1 Across Roku, Amazon Fire TV, Samsung Smart TV, & Apple TV in U.S.","According to Pixalate's research, the app ‘Happy Colors’ in Canada generated an estimated $282K in open programmatic ad revenue on the Apple App Store; Hulu led on Apple TV with $295K in estimated open programmatic ad revenue in Canada According to Pixalate's…",https://www.globenewswire.com/news-release/2025/05/13/3080684/0/en/Pixalate-s-April-2025-Top-Grossing-Mobile-and-CTV-Apps-in-North-America-Happy-Color-Ranked-No-1-on-Apple-App-Store-in-Canada-Hulu-No-1-Across-Roku-Amazon-Fire-TV-Samsung-Smart-TV-A.html,https://ml.globenewswire.com/Resource/Download/0124c010-09d5-402d-839d-4ca1ac736a66,2025-05-13T20:27:00Z,"London, May 13, 2025 (GLOBE NEWSWIRE) -- Pixalate
, a leading global platform for ad fraud protection, privacy, and compliance analytics, today released the March 2025 North America Top Grossing App… [+3262 chars]",,GlobeNewswire
Pixalate,"Pixalate’s April 2025 Top Grossing Mobile Apps in APAC: ‘ToonBast’ Ranked No. 1 on Google Play Store in Japan; ‘OLX’ Led on Apple App Store in India; ‘Block Blast’ Ranked No. 1 on Apple App Store in Singapore, Australia","According to Pixalate's research, 'Weather Zone' ranked at the top on Google Play Store $71K in estimated open programmatic ad revenue in Australia; 'Craftsman' ($27K) was No. 1 on Google Play Store and Apple App Store in China According to Pixalate's researc…",https://www.globenewswire.com/news-release/2025/05/13/3080681/0/en/Pixalate-s-April-2025-Top-Grossing-Mobile-Apps-in-APAC-ToonBast-Ranked-No-1-on-Google-Play-Store-in-Japan-OLX-Led-on-Apple-App-Store-in-India-Block-Blast-Ranked-No-1-on-Apple-App-S.html,https://ml.globenewswire.com/Resource/Download/0124c010-09d5-402d-839d-4ca1ac736a66,2025-05-13T20:24:00Z,"London, May 13, 2025 (GLOBE NEWSWIRE) -- Pixalate
, the global market-leading ad fraud protection, privacy, and compliance analytics platform, today released the January 2025 APAC Top Grossing Mobil… [+2902 chars]",,GlobeNewswire
Pixalate,"Pixalate’s April 2025 Top Grossing Mobile & CTV Apps in EMEA: ‘Block Blast!’ Tops Apple App Store in UK, Germany; ‘SimCity’ Led on Google Play Store in UK, Spain, Germany","According to Pixalate's research, ‘Pro Des Mots’ led on Apple App Store in France, ‘Sudoku’ was No. 1 in Israel on Apple App Store, ‘Happy Color: Coloring Book’ was No. 1 on the Google Play Store in the Netherlands According to Pixalate's research, ‘Pro Des M…",https://www.globenewswire.com/news-release/2025/05/13/3080678/0/en/Pixalate-s-April-2025-Top-Grossing-Mobile-CTV-Apps-in-EMEA-Block-Blast-Tops-Apple-App-Store-in-UK-Germany-SimCity-Led-on-Google-Play-Store-in-UK-Spain-Germany.html,https://ml.globenewswire.com/Resource/Download/0124c010-09d5-402d-839d-4ca1ac736a66,2025-05-13T20:22:00Z,"London, May 13, 2025 (GLOBE NEWSWIRE) -- Pixalate
, a leading global platform for ad fraud protection, privacy, and compliance analytics, today released the April 2025 EMEA Top Grossing Apps Reports… [+3368 chars]",,GlobeNewswire
Ben Schoon,Pixel 9a teardown highlights a battery that’s tougher than ever to replace [Video],"Google’s Pixel 9a has been widely been praised as a solid “affordable” phone, but a new teardown criticizes it for a key component – a battery that’s nearly impossible to safely replace.



 more…",http://9to5google.com/2025/05/13/google-pixel-9a-battery-replace-teardown/,https://i0.wp.com/9to5google.com/wp-content/uploads/sites/4/2025/04/Pixel-9a-Rear-2-1.jpg?resize=1200%2C628&quality=82&strip=all&ssl=1,2025-05-13T20:20:00Z,"Google’s Pixel 9a has been widely been praised as a solid “affordable” phone, but a new teardown criticizes it for a key component a battery that’s nearly impossible to safely replace.
In a JerryRig… [+1709 chars]",,9to5google.com
Johanna Romero,"Google’s Find My Device is now Find Hub, and It’s getting smarter with UWB and satellite support","The rebranded Find Hub app is expanding beyond Android phones to support UWB tags, luggage tracking, and even offline satellite-based location sharing.",https://www.phonearena.com/news/googles-find-my-device-is-now-find-hub-and-its-getting-smarter-with-uwb-and-satellite-support_id170349,https://m-cdn.phonearena.com/images/article/170349-wide-two_1200/Googles-Find-My-Device-is-now-Find-Hub-and-Its-getting-smarter-with-UWB-and-satellite-support.jpg,2025-05-13T20:17:08Z,"The timing is also notable. With Apple reportedly preparing to expand its own Find My network to include satellite-based alerts and third-party accessories, Googles move could help level the playing … [+479 chars]",,PhoneArena
Lorenzo Marquez,Gabrielle Union in Prada at the Marie Claire x Moms First ‘Power Moms’ Celebration,"Well, it finally happened. Gabrielle Union stepped out in something that we think looks terrible on her. This day comes for everyone, it seems. The star stepped out in New York last week for the Marie Claire and Moms First-hosted celebration of the Inaugural …",https://tomandlorenzo.com/2025/05/gabrielle-union-in-prada-at-the-marie-claire-x-moms-first-power-moms-celebration/,https://tomandlorenzo.com/wp-content/uploads/2025/05/Gabrielle-Union-Marie-Claire-Moms-First-Power-Moms-Celebration-Red-arept-Fashion-Style-Prada-TLO-1.jpg,2025-05-13T20:15:46Z,"Archives: 
Select
 May 2025 
 April 2025 
 March 2025 
 February 2025 
 January 2025 
 December 2024 
 November 2024 
 October 2024 
 September 2024 
 August 2024 
 July 2024 
 June 2024… [+3827 chars]",,tomandlorenzo.com
barrons.com,"Nvidia Breaks $3T Market Cap, Overtakes Apple. Saudi Arabia Is Buying AI Chips",,https://biztoc.com/x/7d9bb3aeb59f82c7,https://biztoc.com/cdn/931/og.png,2025-05-13T20:07:44Z,"{ window.open(this.href, '_blank'); }, 200); return false;""&gt;Why is Microsoft laying off 3% of workforce? { window.open(this.href, '_blank'); }, 200); return false;""&gt;How will Trumps tariff pause… [+991 chars]",,Biztoc.com
Christian Zibreg,Apple warns that the old HomeKit architecture will stop working this fall,You will need to upgrade to Apple's latest HomeKit architecture by this fall to continue using your smart home appliances and automations without interruptions.,https://www.idownloadblog.com/2025/05/13/apple-upgrade-homekit-architecture-fall-reminder/,https://media.idownloadblog.com/wp-content/uploads/2023/04/Apple-iOS-16.4-Home-app-Upgrade-Architecture-iPhone.jpg,2025-05-13T20:07:17Z,"You will need to upgrade to Apple’s latest HomeKit architecture by this fall to continue using smart home appliances and automations without interruptions.
You have a few months left to make a decis… [+2406 chars]",,Idownloadblog.com
msmash,Google Says Over 1 Billion RCS Messages sent in the US Daily,"An anonymous reader shares a report: During the Android Show leading up to Google I/O, Google on Tuesday offered a brief update on the adoption of the RCS (Rich Communication Services) protocol, an upgrade to SMS that offers high-resolution photos and videos,…",https://tech.slashdot.org/story/25/05/13/1835253/google-says-over-1-billion-rcs-messages-sent-in-the-us-daily,https://a.fsdn.com/sd/topics/topicgoogle_fb.gif,2025-05-13T18:35:00Z,"During the Android Show leading up to Google I/O, Google on Tuesday offered a brief update on the adoption of the RCS (Rich Communication Services) protocol, an upgrade to SMS that offers high-resolu… [+944 chars]",,Slashdot.org
Lily Hay Newman,Google's Advanced Protection for Vulnerable Users Comes to Android,A new extra-secure mode for Android 16 will let at-risk users lock their devices down.,https://www.wired.com/story/google-advanced-protection-vulnerable-users-lockdown-android-16/,"https://media.wired.com/photos/68236102e26eb5d77efa7115/191:100/w_1280,c_limit/GettyImages-2169510488.jpg",2025-05-13T18:33:06Z,"With the rise of mercenary spyware and other targeted threats, tech giants like Apple, Google, and Microsoft have spent the last few years trying to figure out how to protect the digital lives of the… [+4111 chars]",wired,Wired
Jack Purcher,Apple and Neurotechnology startup Synchron are collaborating on a Brain Computer and interface for those with disabilities,"Neuralink Corp. is an American neurotechnology company that has developed, as of 2024, implantable brain–computer interfaces (BCIs). It was founded by Elon Musk and a team of eight scientists and engineers.  We're now learning that Apple has their own plans t…",https://www.patentlyapple.com/2025/05/apple-and-neurotechnology-startup-synchron-are-collaborating-on-a-brain-computer-and-interface-for-those-with-disabilities.html,https://patentlyapple.typepad.com/.a/6a0120a5580826970c02c8d3d36f62200c-600wi,2025-05-13T18:31:53Z,"Neuralink Corp. is an American neurotechnology company that has developed, as of 2024, implantable braincomputer interfaces (BCIs). It was founded by Elon Musk and a team of eight scientists and engi… [+2300 chars]",,Patently Apple
ETtech,PayPal launches tap-to-pay for iPhone users in Germany,"PayPal has launched tap-to-pay for iPhone users in Germany, enabling contactless payments at Mastercard-enabled terminals. The rollout follows EU rules forcing Apple to open its NFC chip to third parties. The feature is iPhone-only and excludes Apple Watch su…",https://economictimes.indiatimes.com/tech/technology/paypal-launches-tap-to-pay-for-iphone-users-in-germany/articleshow/121145971.cms,"https://img.etimg.com/thumb/msid-121145978,width-1200,height-630,imgsize-18388,overlay-ettech/articleshow.jpg",2025-05-13T18:31:47Z,"PayPal has rolled out its new tap-to-pay feature for iPhone users in Germany, allowing contactless payments at physical store terminals that accept Mastercard.The launch follows a significant shift p… [+1096 chars]",the-times-of-india,The Times of India
Usman Qureshi,"Apple, Synchron Introduce Thought-Powered Control of Devices","Apple collaborates with Synchron to integrate brain-computer interface technology into its devices, enabling hands-free control via neural signals
The post Apple, Synchron Introduce Thought-Powered Control of Devices first appeared on iPhone in Canada Blog.",https://www.iphoneincanada.ca/2025/05/13/apple-synchron-hands-free-control-of-devices/,https://cdn.iphoneincanada.ca/wp-content/uploads/2017/09/iic-logo-1.svg,2025-05-13T18:30:39Z,"Apple has announced a collaboration with neurotechnology company Synchron to integrate brain-computer interface (BCI) technology natively into its devices, including the iPhone, iPad, and Apple Visio… [+1868 chars]",,iPhone in Canada
Steven Levy,Airbnb Is in Midlife Crisis Mode,CEO Brian Chesky is spending hundreds of millions to relaunch his travel company as an everything app. Fitness! Food! Microdermabrasion? A WIRED exclusive.,https://www.wired.com/story/airbnb-is-in-midlife-crisis-mode-reinvention-app-services/,"https://media.wired.com/photos/6822476247f5e6d08106fda0/191:100/w_1280,c_limit/WIRED_2025_05_07_Chesky_-109x.jpg",2025-05-13T18:30:00Z,"Chesky explains that historically, people used Airbnb only once or twice a year, so its design had to be exceptionally simple. Now the company is retooling for more frequent access. Open the app, and… [+3280 chars]",wired,Wired
