author,title,description,url,urlToImage,publishedAt,content,source.id,source.name
David Tao,Review: Mellwood Bottled-in-Bond and Derby Town Barrel Proof Bourbon,"Pursuit Spirits has been releasing a variety of American whiskeys under their own label for several years. Now, the podcasters-turned-bottlers are taking the brand in an additional direction with the revival of two vintage labels — and accordingly, some new w…",https://www.drinkhacker.com/2025/05/13/review-mellwood-bottled-in-bond-and-derby-town-barrel-proof-bourbon/,https://www.drinkhacker.com/wp-content/uploads/2025/05/IMG_0468.jpg,2025-05-13T23:56:18Z,"Pursuit Spirits has been releasing a variety of American whiskeys under their own label for several years. Now, the podcasters-turned-bottlers are taking the brand in an additional direction with the… [+3735 chars]",,Drinkhacker.com
Dr.Wajahat,"Apple MacBook Pro Laptop: M4, 14.2"" 3024x1964, 48GB RAM, 1TB SSD (Late 2024) $2300 + Free Store Pickup","*Available In-store Only.* In stock at all stores when posting this. 
 
*SPECS:* 
* Apple M4 Pro 14-Core Chip 
* 48GB Unified Memory 
* Apple M4 Pro Chip 20-Core GPU 
* 1TB SSD 
* 14.2"" Liquid...",https://slickdeals.net/f/18312460-apple-macbook-pro-14-m4-pro-48gb-ram-1tb-ssd-2299-99?utm_source=rss&utm_content=fp&utm_medium=RSS2,https://slickdeals.net/attachment/2/6/8/0/6/1/2/1/450x450/17569780.thumb,2025-05-13T23:56:03Z,"Holy crap, this is great. I paid ~$2,300 last June for an M3 Max 36GB/1TB 14"" MBP from MC. No regrets. Same $$ here for +12GB RAM.Interestingly, according to CPUBenchmark.net, M4 Pro 14c beats M3 Max… [+166 chars]",,Slickdeals.net
bringatrailer,2003 Ford Excursion Limited Power Stroke 4×4 at No Reserve,"This 2003 Ford Excursion Limited rides on a 4"" BDS suspension lift with Fox shocks and AirLift rear air springs over 20"" Method wheels and four-wheel PowerStop disc brakes. The truck is finished in Mineral Gray Metallic over Medium Parchment leather and is po…",https://bringatrailer.com/listing/2003-ford-excursion-105-2/,https://bringatrailer.com/wp-content/uploads/2025/05/2003_ford_excursion_dsc_0083-36143.jpeg,2025-05-13T23:49:07Z,This 2003 Ford Excursion Limited rides on a 4″ BDS suspension lift with Fox shocks and AirLift rear air springs over 20″ Method wheels and four-wheel PowerStop disc brakes. The truck is finished in M… [+2792 chars],,Bringatrailer.com
,"RCP Podcast: Trump Economy Too Good To Ignore? Hogg Out at DNC? Israel and Trump's Mideast Visit, CA Budget Collapse","Tuesday on the RealClearPolitics radio show -- weeknights at 6:00 p.m. on SiriusXM's POTUS Channel 124 and then on Apple, Spotify, and here on our website -- Tom Bevan, Carl Cannon, and Andrew Walworth discuss the president's trip to the Middle East, the late…",https://www.realclearpolitics.com/video/2025/05/13/rcp_podcast_media_wont_give_trump_a_win_on_tariffs_hogg_out_at_dnc.html,https://assets.realclear.com/images/68/686581_5_.jpg,2025-05-13T23:48:01Z,"Tuesday on the RealClearPolitics radio show -- weeknights at 6:00 p.m. on SiriusXM's POTUS Channel 124 and then on Apple, Spotify, and here on our website -- Tom Bevan, Carl Cannon, and Andrew Walwor… [+4259 chars]",,RealClearPolitics
bringatrailer,2024 INEOS Grenadier Fieldmaster Edition,"This 2024 INEOS Grenadier has a $12,365 specification with the Fieldmaster Edition package that featured leather upholstery, heated Recaro front seats, safari windows, a premium sound system, and locking differentials. Finished in Magic Mushroom over a black …",https://bringatrailer.com/listing/2024-ineos-grenadier-35/,https://bringatrailer.com/wp-content/uploads/2025/05/2024_ineos_grenadier_dsc06144-93835.jpg,2025-05-13T23:43:59Z,"This 2024 INEOS Grenadier has a $12,365 specification with the Fieldmaster Edition package that featured leather upholstery, heated Recaro front seats, safari windows, a premium sound system, and loc… [+2626 chars]",,Bringatrailer.com
ChrisWynn,Haway The Podcast | REACTION | Sunderland Off To Wembley After Ballard’s Last Minute Goal!,Chris and Bomber react to the most unbelievable night in the history of the Stadium of Light,https://rokerreport.sbnation.com/2025/5/14/24429722/haway-the-podcast-reaction-sunderland-off-to-wembley-after-ballards-last-minute-goal,https://cdn.vox-cdn.com/thumbor/mplkTA4YI15oS2WpqyhA8aJIUDE=/0x258:1080x823/fit-in/1200x630/cdn.vox-cdn.com/uploads/chorus_asset/file/25993376/Condensed.psd___2025_05_13T233318.241.png,2025-05-13T23:37:37Z,"Chris and Bomber react to the most unbelievable night in the history of the Stadium of Light What’s The Crack?
QUE SERA SERA! Sunderland are off to Wembley, and we did it in the most dramatic of fash… [+1041 chars]",,SB Nation
Brent Dirks,"Apple Music Sound Therapy Arrives to Help You Focus, Relax, or Sleep","Apple Music can help you to do much more than rock out.
The new Sound Therapy feature is an audio wellness collection to help you focus, relax, or sleep.
Instead of simple white noise or something else you’ve probably heard of, Sound Therapy blends brings tog…",https://appadvice.com/post/apple-music-sound-therapy-arrives-to-help-you-focus-relax-or-sleep/781891,https://handoff-cdn.appadvice.com/wp-content/appadvice-v2-media/2025/05/apple-music-sound-therapy-hero_big-jpg-large_48d532649ccdd4dde94fecbb0b230b6f.jpg,2025-05-13T23:36:25Z,"The new Sound Therapy feature is an audio wellness collection to help you focus, relax, or sleep.
Instead of simple white noise or something else youve probably heard of, Sound Therapy blends brings… [+506 chars]",,Appadvice.com
Laura Terrell,"Laura Terrell shares story of husband Shawn's 2 strokes, 'miraculous' surgery that saved his life","Laura Terrell shares story of husband Shawn's 2 strokes, 'miraculous' surgery that saved his lifekcci.com",https://www.kcci.com/article/kcci-anchor-laura-terrell-shares-husbands-story-of-recovery-after-two-strokes/64759043,"https://kubrick.htvapps.com/htv-prod-media.s3.amazonaws.com/images/family-picture-68239f01e080e.jpg?crop=1.00xw:0.729xh;0,0.152xh&resize=1200:*",2025-05-13T23:35:05Z,"DES MOINES, Iowa —KCCI Anchor Laura Terrell has shared hundreds of stories over the years, but this one is the most personal.
Laura's husband, Shawn, suffered two strokes in 2023. The second stroke … [+8119 chars]",,KCCI Des Moines
Amalya Dubrovsky,"Stock market today: Dow, S&P 500, Nasdaq futures stall as tariff uncertainty preys on minds","US stock futures held steady after a strong trading session on Wall Street, where the S&P 500 erased its losses for 2025.",https://finance.yahoo.com/news/live/stock-market-today-dow-sp-500-nasdaq-futures-stall-as-tariff-uncertainty-preys-on-minds-233114403.html,https://s.yimg.com/ny/api/res/1.2/odz2m07IGnw.2x5Qh9BBlA--/YXBwaWQ9aGlnaGxhbmRlcjt3PTEyMDA7aD04MDA-/https://s.yimg.com/os/creatr-uploaded-images/2025-05/1a14de60-2f80-11f0-affb-764fd336f9bf,2025-05-13T23:31:14Z,"US stock futures struggled for a footing on Wednesday after the S&amp;P 500 (^GSPC) erased its losses for 2025, as corporate outlooks underlined uncertainty around tariffs.
Futures on the broad benc… [+1807 chars]",,Yahoo Entertainment
Shomik Sen Bhattacharjee,Peter Lynch Once Lamented People Are 'Careful' When They Buy A Fridge But Will 'Drop Thousands' On A Stock Tip They Heard On A Bus,"Investing legend Peter Lynch warned investors that ""the sucker's going up is not a good reason"" to buy a stock, chastising traders who chase high-flyers...",https://finance.yahoo.com/news/peter-lynch-once-lamented-people-233056176.html,https://media.zenfs.com/en/benzinga_79/5dc43ea643a63cc0f66550f89d3e0e3d,2025-05-13T23:30:56Z,"Benzinga and Yahoo Finance LLC may earn commission or revenue on some items through the links below.
Investing legend Peter Lynch warned investors that ""the sucker's going up is not a good reason"" t… [+2314 chars]",,Yahoo Entertainment
Juli Clover,"Android 16 Getting Live Updates, Similar to iPhone's Live Activity","Google today previewed the [next-generation version of Android](https://blog.google/products/android/material-3-expressive-android-wearos-launch/), which has an updated design language that's more expressive, and a range of new features. One of the main new a…",https://www.macrumors.com/2025/05/13/android-16-live-activity-copy/,https://images.macrumors.com/t/YENMJGlBx9JovU6rO7AkFUPVZI4=/1600x/article-new/2025/05/android-live-updates.jpg,2025-05-13T23:22:00Z,"Google today previewed the [next-generation version of Android](https://blog.google/products/android/material-3-expressive-android-wearos-launch/), which has an updated design language that's more ex… [+1335 chars]",,MacRumors
news@appleinsider.com (Marko Zivkovic),Apple research reveals potential of future Apple Intelligence tools,"Apple has published two new research papers on its Machine Learning blog, detailing an AI model for improved photogrammetry and another that acts as a video-related personal assistant.Apple's latest AI models could lead to new Apple Vision Pro and Apple Intel…",https://appleinsider.com/articles/25/05/13/apple-research-reveals-potential-of-future-apple-intelligence-tools,https://photos5.appleinsider.com/gallery/63620-132275-62727-130166-VP-AI-xl-(1)-xl.jpg,2025-05-13T23:21:34Z,"Apple has published two new research papers on its Machine Learning blog, detailing an AI model for improved photogrammetry and another that acts as a video-related personal assistant.
The iPhone ma… [+4867 chars]",,AppleInsider
Julie Hyman,Can Apple contain its reliance on China while diversifying?,"As the news of the trade war truce between China and the US continues to reverberate across markets, China still remains a major supplier and developer for...",https://finance.yahoo.com/video/apple-contain-reliance-china-while-232000653.html,https://s.yimg.com/ny/api/res/1.2/2.dkGBFq7JlqnBBo3d84WQ--/YXBwaWQ9aGlnaGxhbmRlcjt3PTEyMDA7aD02NzY-/https://s.yimg.com/os/creatr-uploaded-images/2025-05/17f2e8b0-3044-11f0-beff-8dbba9ff3760,2025-05-13T23:20:00Z,"Apple stock rallying after the US and China agreed to reduce tariffs for 90 days. Our next guest closely follows the interconnection between Apple and China. Joining us now is Patrick McGee, San Fran… [+7015 chars]",,Yahoo Entertainment
"Rebecca Isaacs, Forbes Staff, 
 Rebecca Isaacs, Forbes Staff
 https://www.forbes.com/sites/forbes-personal-shopper/people/rebecca-isaacs/",Apple AirPods Pro Vs. Beats Studio Buds: Which Earbuds Are Best?,Stuck deciding between the Apple AirPods Pro 2 versus the Beats Studio Buds? I tested them both to find out which may be best for you.,https://www.forbes.com/sites/forbes-personal-shopper/article/apple-airpods-pro-versus-beats-studio-buds/,https://imageio.forbes.com/specials-images/imageserve/680011d7ab7a7910a4bb9759/0x0.jpg?format=jpg&height=900&width=1600&fit=bounds,2025-05-13T23:16:34Z,"When youre on team iPhone, choosing between the Apple AirPods Pro and the Beats Studio Buds can feel like a tough choice. Both Apple-owned earbuds pair seamlessly with an iPhone, iPad or MacBook, bot… [+12284 chars]",,Forbes
"Rebecca Isaacs, Forbes Staff, 
 Rebecca Isaacs, Forbes Staff
 https://www.forbes.com/sites/forbes-personal-shopper/people/rebecca-isaacs/",Google Pixel 9a Review: Built For Young Professionals,"After testing the Google Pixel 9a for over a month, I labelled it as a great device for young professionals. Here's why.",https://www.forbes.com/sites/forbes-personal-shopper/article/google-pixel-9a-review/,https://imageio.forbes.com/specials-images/imageserve/681e0d1ed8285bfd66470b51/0x0.jpg?format=jpg&height=900&width=1600&fit=bounds,2025-05-13T23:08:53Z,"When I first started my career in tech journalism, I needed a new phone, but I was broke as heck. I simply couldnt justify spending a thousand bucks on a flagship; I needed a balance of power and pri… [+10773 chars]",,Forbes
Marie O'Halloran,Banks obliged to retain ATMs under legislation passed by Seanad,Bill introduced after concerns that ATMs being removed following decline in cash usage,https://www.irishtimes.com/politics/2025/05/14/banks-obliged-to-retain-atms-under-legislation-passed-by-seanad/,https://www.irishtimes.com/resizer/v2/GH5IRZV7Q5HGVHHM2HPPX2I3OY.JPG?smart=true&auth=504c40db7ead31183404426e443ec5fb3f602974c56d3da0dac2f3298bf5a36f&width=1200&height=630,2025-05-13T23:07:28Z,"Legislation to oblige banks to provide ATMs in certain areas, guaranteeing access to cash infrastructure, particularly in rural areas, has been passed by the Seanad and now goes to the President for … [+2881 chars]",the-irish-times,The Irish Times
Sanuj Bhatia,Google teases a new Always-On Display with wallpapers and a refreshed lock screen UI,Your Pixel's lock screen and AOD could be getting a glow-up,https://www.androidpolice.com/google-teases-new-always-on-display-with-wallpapers/,https://static1.anpoimages.com/wordpress/wp-content/uploads/2024/10/google-pixel-9-lock-screen.jpg,2025-05-13T23:03:31Z,"Summary
<ul><li>
 Google Pixel AOD getting a fresh look with colored wallpaper and redesigned lock screen layout.
 </li><li>
 The new Material 3 Expressive design brings larger buttons, bold font… [+2204 chars]",,Android Police
Ryo,"【40%OFF！】eazpower 3in1 MagSafe充電スタンドが1,979円 - 安値世界一への挑戦",eazpower 3in1 MagSafe充電スタンド が Amazon...,https://web-price.info/blog/40offeazpower-3in1-magsafe1979.php,https://m.media-amazon.com/images/I/41fGQhf6YEL.jpg,2025-05-13T23:00:33Z,"eazpower 3in1 MagSafe充電スタンド が Amazon にてお買い得価格で販売されています。3,500円未満の商品なので、送料無料はAmazonプライム会員が対象です。

今ならさらに、割引クーポンコード「PVBSE4Y6」を適用することで40%OFFとお買い得。3,299円 → 1,979円となります。

セール期間は5/18まで。マーケットプレイス eazpower 取扱品… [+567 chars]",,Web-price.info
JAY WONG,GWM TANK 500 DEBUTS AT MALAYSIA AUTOSHOW,SERDANG: Great Wall Motor (GWM) Malaysia marks a major milestone with the official launch of its all-terrain luxury hybrid flagship — the GWM TANK 500 — at the Malaysia Autoshow 2025. Read full story,https://www.thestar.com.my/news/nation/2025/05/14/gwm-tank-500-debuts-at-malaysia-autoshow,https://apicms.thestar.com.my/uploads/images/2025/05/14/3313600.jpeg,2025-05-13T23:00:00Z,"SERDANG: Great Wall Motor (GWM) Malaysia marks a major milestone with the official launch of its all-terrain luxury hybrid flagship the GWM TANK 500 at the Malaysia Autoshow 2025.
Expanding the popu… [+3852 chars]",,The Star Online
DIGITIMES,Apple posts record first-quarter shipments in India as premium segment surges,"India's smartphone market shipped 32 million units in the first quarter of 2025, marking a 5.5% year-over-year decline, according to IDC. This is the second consecutive quarter of reduced shipments, driven by weak consumer demand and excess inventory from the…",https://www.digitimes.com/news/a20250513VL200/apple-smartphone-shipments-india-2025.html,https://img.digitimes.com/newsshow/20250513vl200_files/1_b.jpg,2025-05-13T22:53:49Z,"Save my User ID and Password
Some subscribers prefer to save their log-in information so they do not have to enter their User ID and Password each time they visit the site. To activate this function… [+307 chars]",,Digitimes
Chris Hauk,Universal Music and Apple Music Announce New ‘Sound Therapy’ Audio Wellness Collection,"Apple and Universal Music Group today jointly announced their new ""Sound Therapy"" collection of audio wellness playlists to help listeners focus, relax, and sleep better.Read More...",https://www.mactrast.com/2025/05/universal-music-and-apple-music-announce-new-sound-therapy-audio-wellness-collection/,https://www.mactrast.com/wp-content/uploads/2025/05/Apple-Music-Sound-Therapy.jpg,2025-05-13T22:51:47Z,"Apple and Universal Music Group today jointly announced their new “Sound Therapy” collection of audio wellness playlists, which consist of popular songs that have added sound waves or white noise to … [+1965 chars]",,Mactrast.com
Andy Greder,"Loons at Houston Dynamo: Keys to the match, storylines and a prediction","Minnesota United at Houston Dynamo When: 7:30 p.m. Wednesday Where: Shell Oil Stadium, Houston Stream: MLS Season Pass on Apple TV Radio: KSTP-AM 1500 Weather: 87 degrees, sunny, 16 mph north wind Betting line: MNUFC plus-175; draw plus-230; Houston plus-150 …",https://www.twincities.com/2025/05/13/loons-at-houston-dynamo-keys-to-the-match-storylines-and-a-prediction/,https://www.twincities.com/wp-content/uploads/2025/05/STP-L-jea-07-MN_UNITED_FILERS-0110.jpg?w=1024&h=839,2025-05-13T22:48:00Z,"To place an obituary, please include the information from the obituary checklist below in an email to obits@pioneerpress.com. There is no option to place them through our website.
Feel free to conta… [+4498 chars]",,TwinCities.com-Pioneer Press
Theresa Braine,Saudi Arabia greets Trump with fully outfitted mobile McDonald’s,"Part of Donald Trump’s royal welcome to the Saudi kingdom on Tuesday was a nod to his penchant for fast food, particularly McDonald’s.",https://www.bostonherald.com/2025/05/13/saudi-arabia-trump-mobile-mcdonalds/,https://www.bostonherald.com/wp-content/uploads/2018/11/Herald_BridgePhoto.jpg,2025-05-13T22:47:55Z,"Part of Donald Trumps royal welcome to the Saudi kingdom on Tuesday was a nod to his penchant for fast food, particularly McDonalds.
Amid the Arabian horses flanking his limo, a musical playlist tha… [+2200 chars]",,Boston Herald
Nate,40 Rare Pictures That Captured One-In-A-Million Moments,The post 40 Rare Pictures That Captured One-In-A-Million Moments appeared first on Pleated Jeans.,https://pleated-jeans.com/2025/05/13/rare-one-in-a-million-moments-pictures/,https://pleated-jeans.com/wp-content/uploads/2025/05/rare-one-in-a-million-images.jpg,2025-05-13T22:45:05Z,"Sometimes the universe just lines things up perfectly, and someone actually manages to snap a photo before it disappears. These one-in-a-million moments feel like visual glitches, happy accidents, or… [+3552 chars]",,Pleated-jeans.com
Katherine Donlevy,"Spectacular scene as Mexican tall ship docks in NYC, giving sneak peek of blockbuster Sail4th celebration of America’s 250th",Sea-nic views abounded onboard and off.,https://nypost.com/2025/05/13/us-news/mexican-tall-ship-docks-in-nyc-in-sneak-peek-of-2026s-sail4th-celebration-of-americas-250th/,https://nypost.com/wp-content/uploads/sites/2/2025/05/104412537.jpg?quality=75&strip=all&w=1024,2025-05-13T22:41:23Z,"Sea-nic views abounded onboard and off. 
A Mexican navy tall ship carrying 277 crewmembers ceremonially soared into lower Manhattan Tuesday giving New Yorkers a taste of what to expect at next year’… [+4665 chars]",,New York Post
goekdenizguelmez@gmail.com,mlx-lm-lora 0.2.0,Train LLMs on Apple silicon with MLX and the Hugging Face Hub,https://pypi.org/project/mlx-lm-lora/0.2.0/,,2025-05-13T22:35:54Z,"A required part of this site couldnt load. This may be due to a browser
 extension, network issues, or browser settings. Please check your
 connection, disable any ad blockers, or try using a diffe… [+12 chars]",,Pypi.org
Shira Ovide,Do you want a skinny smartphone with worse battery life?,"Samsung's new Galaxy S25 Edge is 5.8 millimeters thick, compared to the S25's 7.2.",https://www.washingtonpost.com/technology/2025/05/13/iphone-17-samsung-s25-edge-thin-phones-battery/,https://www.nzherald.co.nz/resizer/v2/3JZ4PA4C3JAJJOYULY2FCTEHFE.jpg?auth=76d8c9744374dfb380e29f37d031ea292ea11befee5afa1404eaf820bbc20b38&width=1200&height=675&quality=70&smart=true,2025-05-13T22:34:07Z,"Polling by YouGov has found that what people want most from their smartphones is better battery life. So why are Apple and Samsung pitching you skinnier but potentially battery-compromised phones?
I… [+3325 chars]",the-washington-post,The Washington Post
Chris Hauk,"Apple’s Upcoming iOS 19, iPadOS 19, macOS 16, watchOS 12, and visionOS 3 to Offer New Accessibility Features","Apple today offered a preview of powerful new accessibility features that will be coming to the iPhone, iPad, Mac, Apple Watch, and Apple Vision Pro.Read More...",https://www.mactrast.com/2025/05/apples-upcoming-ios-19-ipados-19-macos-16-watchos-12-and-visionos-3-to-offer-new-accessibility-features/,https://www.mactrast.com/wp-content/uploads/2025/05/Apple-accessibility-features-Magnifier-on-Mac.jpg,2025-05-13T22:33:21Z,"Apple today offered a preview of powerful new accessibility features that will be coming to the iPhone, iPad, Mac, Apple Watch, and Apple Vision Pro. The announcement comes two days ahead of Global A… [+2233 chars]",,Mactrast.com
goekdenizguelmez@gmail.com,mlx-lm-lora 0.1.9,Train LLMs on Apple silicon with MLX and the Hugging Face Hub,https://pypi.org/project/mlx-lm-lora/0.1.9/,,2025-05-13T22:30:47Z,"A required part of this site couldnt load. This may be due to a browser
 extension, network issues, or browser settings. Please check your
 connection, disable any ad blockers, or try using a diffe… [+12 chars]",,Pypi.org
Maxwell Zeff,Google tests replacing 'I'm Feeling Lucky' with 'AI Mode' | TechCrunch,"Google is testing a redesign of its homepage in which an experimental AI-powered search feature replaces its ""I'm Feeling Lucky"" button.",https://techcrunch.com/2025/05/13/google-tests-replacing-im-feeling-lucky-with-ai-mode/,"https://techcrunch.com/wp-content/uploads/2018/06/google-search-magnifying-glass.png?resize=1200,638",2025-05-13T22:29:05Z,"Google is testing a redesign of its Search homepage in which “AI Mode,” the experimental AI-powered search feature the company rolled out earlier in May, replaces its longstanding “I’m Feeling Lucky”… [+666 chars]",techcrunch,TechCrunch
goekdenizguelmez@gmail.com,mlx-lm-lora 0.1.8,Train LLMs on Apple silicon with MLX and the Hugging Face Hub,https://pypi.org/project/mlx-lm-lora/0.1.8/,,2025-05-13T22:25:24Z,"A required part of this site couldnt load. This may be due to a browser
 extension, network issues, or browser settings. Please check your
 connection, disable any ad blockers, or try using a diffe… [+12 chars]",,Pypi.org
Juli Clover,More Than 1 Billion RCS Messages Are Sent Daily on Android and iOS,"Over a billion RCS messages are sent on a daily basis in the United States, Google said today. ‌RCS‌, or Rich Communication Services, is a communication protocol that replaced the prior SMS and MMS messaging standards.





It was developed by the GSM Associa…",https://www.macrumors.com/2025/05/13/android-ios-rcs-messages-1-billion/,https://images.macrumors.com/t/YCfKC7CdSR7A9d-4aYe9jfsjkew=/2500x/article-new/2025/03/RCS-Feature-1.jpg,2025-05-13T22:23:30Z,"Over a billion RCS messages are sent on a daily basis in the United States, Google said today. ‌RCS‌, or Rich Communication Services, is a communication protocol that replaced the prior SMS and MMS m… [+1460 chars]",,MacRumors
Nicole Hunn,Gluten Free Bread Machine Bread,"This gluten free bread machine bread is made with gluten free flour, yeast, baking powder, milk, butter and eggs. Easy to make dairy free.",https://glutenfreeonashoestring.com/gluten-free-bread-machine-bread/,https://glutenfreeonashoestring.com/wp-content/uploads/2025/05/Gluten-free-bread-machine-recipe-1.jpg,2025-05-13T22:23:00Z,"This post may contain affiliate links. Please read our disclosure policy.
This gluten free bread machine recipe makes a flavorful, crusty loaf of bread that you can cut into tender, flexible slices.… [+12613 chars]",,Glutenfreeonashoestring.com
Team,6 Simple Ways to Fix the Error Establishing a Database Connection in WordPress,Troubleshooting WordPress? Learn 6 simple ways to fix the Error Establishing a Database Connection and get your site back online fast.,https://www.smashingapps.com/error-establishing-a-database-connection/,https://www.smashingapps.com/wp-content/uploads/2025/05/error-establishing-database-connection-with-potential-causes-e1747174568344.webp,2025-05-13T22:17:28Z,"Ever opened your WordPress site only to be met with a plain white screen and the dreaded message: Error establishing a database connection? If youre nodding your head, you’re not alone. This is one o… [+5838 chars]",,Smashingapps.com
goekdenizguelmez@gmail.com,mlx-lm-lora 0.1.7,Train LLMs on Apple silicon with MLX and the Hugging Face Hub,https://pypi.org/project/mlx-lm-lora/0.1.7/,,2025-05-13T22:17:24Z,"A required part of this site couldnt load. This may be due to a browser
 extension, network issues, or browser settings. Please check your
 connection, disable any ad blockers, or try using a diffe… [+12 chars]",,Pypi.org
Umar Shakir,Apple TV’s wireless audio sync now works with Dolby Atmos,Apple is pushing a new software update for Apple TV today that includes a useful feature for home theater setups: the ability to automatically calibrate the synchronization of Dolby Atmos surround sound audio with your speakers. The new tvOS 18.5 update enhan…,https://www.theverge.com/news/666418/apple-tv-4k-dolby-atmos-wireless-audio-sync-tvos-update,https://platform.theverge.com/wp-content/uploads/sites/2/2025/02/appletv.webp?quality=90&strip=all&crop=11%2C24.777887306585%2C73.4%2C57.644337888587&w=1200,2025-05-13T22:15:21Z,Apple is pushing a new software update for Apple TV today that includes a useful feature for home theater setups: the ability to automatically calibrate the synchronization of Dolby Atmos surround so… [+768 chars],the-verge,The Verge
