author,title,description,url,urlToImage,publishedAt,content,source.id,source.name
Carly Levy,"Natalie Portman Says She Was ‘Really Lucky’ To Have Broken Into Hollywood So Young, But She Also Doesn’t Hold Back On The Dangers Of Child Stardom",True pearls of wisdom from Natalie Portman.,https://www.cinemablend.com/streaming-news/natalie-portman-lucky-broken-into-hollywood-so-young-doesnt-hold-back-dangers-child-stardom,https://cdn.mos.cms.futurecdn.net/a5RuqsDtc3h5YmAGYir3m9.jpg,2025-05-13T22:12:01Z,"Natalie Portman is an example of an actress who had so much personality at a young age
 shone through each of her roles. Her acting career started at the age of 12, starring as a vengeful girl in Th… [+3596 chars]",,CinemaBlend
Amid Amidi,The Future Of Cartoon Network Looks Very Bleak,A new piece in 'Bloomberg Businessweek' paints a grim picture for the future of the 24-hour cartoon channel.,https://www.cartoonbrew.com/business/the-future-of-cartoon-network-looks-very-bleak-247237.html,https://www.cartoonbrew.com/wp-content/uploads/2025/04/cartoonnetworkstudios_annecy.jpg,2025-05-13T22:08:13Z,"In the water is wet category of news, Bloomberg Businesweek has published a long article titled Cartoon Networks Last Gasp, documenting the declining fortunes of Cartoon Network. 
Weve been covering… [+2150 chars]",,Cartoon Brew
JoshWilding,Krysten Ritter Will Officially Return As Jessica Jones In DAREDEVIL: BORN AGAIN Season 2,"It's the news we've been waiting for, and Marvel Studios has confirmed that Krysten Ritter will return as Jessica Jones in Daredevil: Born Again season 2. Where does that leave Luke Cage and Iron Fist?",https://comicbookmovie.com/tv/marvel/daredevil/krysten-ritter-will-officially-return-as-jessica-jones-in-daredevil-born-again-season-2-a219531,https://comicbookmovie.com/images/articles/banners/krysten-ritter-will-officially-return-as-jessica-jones-in-daredevil-born-again-season-2-ab219531.jpg,2025-05-13T22:05:52Z,"It's been confirmed at the Disney Upfronts today that Krysten Ritter will reprise her role as Jessica Jones in Daredevil: Born Again season 2. This marks The Defenders star's official MCU debut. 
Ri… [+3078 chars]",,CBM (Comic Book Movie)
Thom Holwerda,Cracking the Dave & Buster’s anomaly,"Let’s dive into a peculiar bug in iOS. And by that I mean, let’s follow along as Guilherme Rambo dives into a peculiar bug in iOS. The bug is that, if you try to send an audio message using the Messages app to someone who’s also using the Messages app, and th…",https://www.osnews.com/story/142349/cracking-the-dave-busters-anomaly/,,2025-05-13T22:05:31Z,"Let’s dive into a peculiar bug in iOS. And by that I mean, let’s follow along as Guilherme Rambo dives into a peculiar bug in iOS.
The bug is that, if you try to send an audio message using the Mess… [+1335 chars]",,Osnews.com
"lance.ulanoff@futurenet.com (Lance Ulanoff) , Lance Ulanoff","I did the quarter stack test with Samsung Galaxy S25 Edge, iPhone 16 Pro, Galaxy S25 Ultra, and an iPhone 6s, and one came out on top",Thin is back in,https://www.techradar.com/phones/i-did-the-quarter-stack-test-with-samsung-galaxy-s25-edge-iphone-16-pro-galaxy-s25-ultra-and-an-iphone-6s-and-one-came-out-on-top,https://cdn.mos.cms.futurecdn.net/8kJic4Nst3mXSKgyjMqi6D.jpg,2025-05-13T22:05:26Z,The new Samsung Galaxy S25 Edge combines some of Samsung's best technology from its leading flagship phones and adds some new wrinkles to deliver an exciting new Android smartphone that is already wi… [+4151 chars],techradar,TechRadar
Armando Tinoco,Andy Cohen Addresses ‘Real Housewives Of New York City’ Cancellation Rumors: “We Are Between Seasons”,"Andy Cohen sets the record straight on The Real Housewives of New York City after rumors that Bravo had cancelled the reality series. The Watch What Happens Live host, also an executive producer on the Real Housewives franchise, took to his SiriusXM show to a…",http://deadline.com/2025/05/andy-cohen-real-housewives-of-new-york-city-cancellation-1236396252/,https://deadline.com/wp-content/uploads/2025/05/andy-cohen-rhony-bravo.jpg?w=1024,2025-05-13T22:02:46Z,"Andy Cohen sets the record straight on The Real Housewives of New York City after rumors that Bravo had cancelled the reality series.
The Watch What Happens Live host, also an executive producer on … [+1502 chars]",,Deadline
Atingley4,Beyoncé ‘Cowboy Carter’ Tour: It Isn’t Too Late to Snag (Relatively) Affordable Tickets Online,"If, like me, clips from Beyoncé’s electric Cowboy Carter performances are giving you major FOMO, you’re in luck. There are still (relatively) affordable tickets available for nearly all the dates left on her tour, which will take the Grammy-winning pop star t…",https://variety.com/2025/shopping/news/beyonce-cowboy-carter-tour-tickets-buy-online-1236396751/,https://variety.com/wp-content/uploads/2025/04/015_20250428_CCT_LA_Poole_WEB.jpg?w=1000&h=563&crop=1,2025-05-13T22:02:29Z,"If you purchase an independently reviewed product or service through a link on our website, Variety may receive an affiliate commission.
If, like me, clips from Beyoncé’s electric Cowboy Carter perf… [+3888 chars]",,Variety
Ro,Apple to leverage AI for its upcoming battery-saving feature,"According to sources close to Bloomberg, Apple is working on an AI-powered battery-saving feature for its upcoming iOS 19. The feature will work based on the user's usage habits and optimize things in the background to extend battery life.



The AI will lear…",https://www.gsmarena.com/apple_to_leverage_ai_for_its_upcoming_batterysaving_feature-news-67756.php,https://fdn.gsmarena.com/imgroot/news/25/03/foxconn-india-iphone-production-double/-952x498w6/gsmarena_000.jpg,2025-05-13T21:59:02Z,"According to sources close to Bloomberg, Apple is working on an AI-powered battery-saving feature for its upcoming iOS 19. The feature will work based on the user's usage habits and optimize things i… [+994 chars]",,GSMArena.com
Andrew J. Hawkins,Toyota confirms the all-electric compact C-HR is coming to the US,"Toyota confirmed today that the all-electric C-HR, previously only available in Europe, will arrive in the US next year. You might recall the C-HR as the gas-powered compact crossover sold in the US from 2018-2022. But now it has been resurrected as a battery…",https://www.theverge.com/news/666207/toyota-chr-electric-ev-us-photo-specs,https://platform.theverge.com/wp-content/uploads/sites/2/2025/05/Toyota_2026_C-HR_0001_V001.jpg?quality=90&strip=all&crop=0%2C23.821989528796%2C100%2C52.356020942408&w=1200,2025-05-13T21:58:04Z,"The compact crossover will get 290 miles of range and put out 338 horsepower. But dont call it a hot hatch.
The compact crossover will get 290 miles of range and put out 338 horsepower. But dont cal… [+2343 chars]",the-verge,The Verge
Marcus Mendes,PayPal starts rolling out direct tap-to-pay support for iPhone users in Europe,"Since the DMA took effect in Europe, Apple has been forced to loosen its grip by allowing third-party access to its platforms, devices, and operating systems.



One key example is the iPhone’s NFC chip, which was once locked to Apple Pay but is now required …",https://9to5mac.com/2025/05/13/paypal-iphone-nfc-support-rolling-out-in-europe/,https://i0.wp.com/9to5mac.com/wp-content/uploads/sites/6/2025/05/paypal-tap-to-pay.jpg?resize=1200%2C628&quality=82&strip=all&ssl=1,2025-05-13T21:57:57Z,"Since the DMA took effect in Europe, Apple has been forced to loosen its grip by allowing third-party access to its platforms, devices, and operating systems.
One key example is the iPhones NFC chip… [+1915 chars]",,9to5Mac
Andrew Moran,Record Tariff Revenue Boosts US Budget Surplus in April: Treasury,Receipts from U.S. levies are expected to slow after the latest trade developments.,https://www.theepochtimes.com/business/record-tariff-revenue-boosts-us-budget-surplus-in-april-treasury-5857160,https://img.theepochtimes.com/assets/uploads/2023/07/12/id5393684-LA-LB-PORT-Select_23_JF_10272021-700x420.jpg,2025-05-13T21:55:56Z,"Tariff revenues reached a record high in April and helped boost the federal budget surplus for the month, new Treasury Department data show.
According to the departments Monthly Treasury Statement, … [+4458 chars]",,Theepochtimes.com
flightfinderau,"United Airlines Return to New York: MEL fr $1307, BNE fr $1328, SYD fr $1332 (Jul-Nov 2025) @flightfinderau",Destination: New York Airline: United Airlines Valid Departure Dates: June to November 2024 Deal Expiry: Till Sold Out One stop flights to the Big Apple Wide variety of US Summer/Autumn …,https://www.ozbargain.com.au/node/905657,https://files.ozbargain.com.au/n/57/905657x.jpg?h=54313ed9,2025-05-13T21:52:36Z,"Destination: New YorkAirline: United AirlinesValid Departure Dates: June to November 2024Deal Expiry: Till Sold Out
<ul><li>One stop flights to the Big Apple</li><li>Wide variety of US Summer/Autumn… [+1195 chars]",,Ozbargain.com.au
marca.com,Tom Brady gets praised by rookie Giants quarterback as he disses the franchise,"The New York Giants can brag until the end of time that they are the only NFL franchise that beat Tom Brady on the Super Bowl twice, both with Eli Manning as their quarterback.
Tha",https://www.marca.com/en/nfl/new-york-giants/2025/05/13/6823b80eca474128668b45ad.html,https://phantom-marca.uecdn.es/f427e565387571fd69fe3dc9bd032baf/resize/1200/f/webp/assets/multimedia/imagenes/2025/05/13/17471708402152.jpg,2025-05-13T21:51:18Z,"The New York Giants can brag until the end of time that they are the only NFL franchise that beat Tom Brady on the Super Bowl twice, both with Eli Manning as their quarterback.
That does not mean th… [+2677 chars]",marca,Marca
Chris Hauk,PayPal NFC Contactless Payments Now Available to German iPhone Users,PayPal customers in Germany now have access to PayPal as a contactless payment alternative to Apple Pay.Read More...,https://www.mactrast.com/2025/05/paypal-contactless-payments-now-available-to-german-iphone-users-thanks-to-new-eu-rules/,https://www.mactrast.com/wp-content/uploads/2025/05/PayPal-Contactless-Payments.png,2025-05-13T21:50:09Z,"As promised earlier this month, PayPal has brought contactless iPhone payments to Germany. German site iPhone Ticker reports that PayPal customers in Germany say they now have access to PayPal as an … [+1189 chars]",,Mactrast.com
,Rexing Wireless Apple CarPlay & Android Auto Adapter for $55 + free shipping,"Save $45 off list price. Buy Now at Best Buy 
 Features
 <ul> <li>makes vehicles with factory-installed wired Apple CarPlay and Android Auto systems wireless</li> <li>steering wheel control integration</li> <li>Model: BBY-CPW-22</li> </ul>",https://www.dealnews.com/products/Rexing/Rexing-Wireless-Apple-Car-Play-Android-Auto-Adapter/489667.html,"https://c.dlnws.com/image/upload/f_auto,t_maximum,q_auto/cms/r7qlrshvteytnjidl0u2.jpg",2025-05-13T21:49:21Z,"moreThere are almost 500 items discounted, including blenders, coffee makers, microwaves, air fryers, and more. We've pictured this Breville Barista Express Espresso Machine w/ 15 bars pressure, Frot… [+162 chars]",,Dealnews.com
Matteo Wong,Silicon Valley Braces for Chaos,The center of the tech universe seems to believe that Trump’s tariff whiplash is nothing compared with what they see coming from AI.,https://www.theatlantic.com/technology/archive/2025/05/silicon-valley-reacts-to-trump/682799/,https://cdn.theatlantic.com/thumbor/wwwoAVy13Z8CyEWA6t_dnmayaKU=/0x43:2000x1085/1200x625/media/img/mt/2025/05/2025_5_7_Silicon_Valley_JA/original.jpg,2025-05-13T21:40:08Z,"On a Wednesday morning last month, I thought, just for a second, that AI was going to kill me. I had hailed a self-driving Waymo to bring me to a hacker house in Nob Hill, San Francisco. Just a few b… [+19613 chars]",,The Atlantic
Michael,"Implantable Brain-Computer Interfaces Are Here, And They Are A Giant Step Toward The Dystopian “Digital Prison” Society The Elite Have Planned For Us","Would having your brain connected to the Internet 24 hours a day be heaven, or would it be hell?  Today, a very large portion of the population is seemingly glued to their phones or their computers much of the time.  But soon implantable brain-computer interf…",http://theeconomiccollapseblog.com/implantable-brain-computer-interfaces-are-here-and-they-are-a-giant-step-toward-the-dystopian-digital-prison-society-the-elite-have-planned-for-us/,http://theeconomiccollapseblog.com/wp-content/uploads/2025/05/Snip20250513_51.png,2025-05-13T21:38:27Z,"Would having your brain connected to the Internet 24 hours a day be heaven, or would it be hell?  Today, a very large portion of the population is seemingly glued to their phones or their computers m… [+8165 chars]",,Theeconomiccollapseblog.com
Oliver Haslam,"Here’s How To Get Windows 11 For As Low As $14, Microsoft Office For $39 In 2025","Buying new Microsoft software is an expensive business, especially if you choose to buy it via Microsoft's own store. Thankfully, there are many better ways to do it, and you can get some incredible discounts if you know where to look.
The post Here’s How To …",https://www.redmondpie.com/heres-how-to-get-windows-11-for-as-low-as-14-microsoft-office-for-39-in-2025/,https://cdn.redmondpie.com/wp-content/uploads/2020/01/windows-10-ms-office-1200px.jpg,2025-05-13T21:32:25Z,"Buying new Microsoft software is an expensive business, especially if you choose to buy it via Microsoft’s own store. Thankfully, there are many better ways to do it, and you can get some incredible … [+1293 chars]",,redmondpie.com
Ellen Phiddian,Is Google search getting worse? Maybe what we want from it has changed,"Has the simple search become less useful in a world of low-information, SEO-optimised sites, and often faulty AI summaries? Are there better ways to navigate the web?",https://www.abc.net.au/news/science/2025-05-14/search-engine-quality-google-ai-bing-information-internet/105273824,https://live-production.wcms.abc-cdn.net.au/97ec7bfebe5f034e6f22ce1d8bd0f2d2?impolicy=wcms_watermark_news&cropH=2813&cropW=5000&xPos=0&yPos=240&width=862&height=485&imformat=generic,2025-05-13T21:30:00Z,"Ever punched a question into a browser and been served a bunch of poorly written, ad-filled websites which don't really give you an answer?
Or a summary generated by artificial intelligence (AI) tha… [+9231 chars]",abc-news-au,ABC News (AU)
Marcus Jones,A New Function of Emmys FYC Events? Getting Real About Bringing Production Back to Los Angeles,"Emmy voters have been extra responsive to FYC events for series that shot in Los Angeles, especially post-wildfires.",https://www.indiewire.com/awards/consider-this/emmys-fyc-events-benefit-los-angeles-productions-1235122969/,https://www.indiewire.com/wp-content/uploads/2025/05/GettyImages-2208797883.jpg?w=650,2025-05-13T21:30:00Z,"Far be it for us to start our look inside the lead-up to the 2025 Emmys on a depressing note, but much like how the Los Angeles wildfires were the elephant in the room during Oscar season, if a serie… [+4493 chars]",,IndieWire
NPR,Poland's plan to resist a Russian attack,"As a neighbor of Ukraine's and host to more than 2 million of its war refugees, Poland has seen, heard and felt what Russia is capable of, and it's now preparing for the worst. This year, Poland will spend nearly 5% of its GDP on defense, more than any other …",https://www.npr.org/2025/05/13/1250902339/poland-russia-attack-defense-ukraine,https://media.npr.org/assets/img/2025/05/13/gettyimages-2166890439_wide-72fa1b9528644061e74aeb89f3af14250e831f7b.jpg?s=1400&c=100&f=jpeg,2025-05-13T21:24:55Z,"A parade celebrating Poland's Armed Forces Day in 2024. The holiday commemorates the 1920 victory over Soviet Russia at the Battle of Warsaw in the Russo-Polish War.
Omar Marques/Getty Images
As a … [+739 chars]",,NPR
MacDailyNews,Samsung reveals slimmest smartphone ahead of Apple’s expected ultra-thin ‘iPhone 17 Air’,"Samsung Electronics made public on Tuesday its slimmest flagship model to date, the Galaxy S25 Edge, complete with enhanced AI features…
The post Samsung reveals slimmest smartphone ahead of Apple’s expected ultra-thin ‘iPhone 17 Air’ appeared first on MacDai…",https://macdailynews.com/2025/05/13/samsung-reveals-slimmest-smartphone-ahead-of-apples-expected-ultra-thin-iphone-17-air/,https://149359564.v2.pressablecdn.com/wp-content/uploads/2025/05/250513_samsung.png,2025-05-13T21:15:31Z,"Samsung Galaxy S25 Edge
Samsung Electronics made public on Tuesday its slimmest flagship model to date, the Galaxy S25 Edge, complete with enhanced artificial intelligence features, as it seeks to g… [+3236 chars]",,Macdailynews.com
Alan Friedman,"Apple wants certain users to navigate their iPhones, iPads, and Macs using mind-control",Apple is working with partners to make mind control of the iPhone a reality.,https://www.phonearena.com/news/apple-hopes-to-add-mind-control-navigation-for-disabled-users_id170341,https://m-cdn.phonearena.com/images/article/170341-wide-two_1200/Apple-wants-certain-users-to-navigate-their-iPhones-iPads-and-Macs-using-mind-control.jpg,2025-05-13T21:14:53Z,"A discussion is a place, where people can voice their opinion, no matter if it
 is positive, neutral or negative. However, when posting, one must stay true to the topic, and not just share some
 ra… [+760 chars]",,PhoneArena
news@appleinsider.com (Marko Zivkovic),PayPal's 'Tap To Pay' contactless payment feature is now available to iPhone users in Germany,"PayPal users in Germany say they can now complete contactless payments via iPhone, as Apple was forced to open up its NFC technology to third parties in the European Union.PayPal has made its contactless payment feature available to iPhone users in Germany.Be…",https://appleinsider.com/articles/25/05/13/paypals-tap-to-pay-contactless-payment-feature-is-now-available-to-iphone-users-in-germany,https://photos5.appleinsider.com/gallery/63619-132274-56270-114214-paypal-iphone-xl-xl.jpg,2025-05-13T21:14:27Z,"PayPal users in Germany say they can now complete contactless payments via iPhone, as Apple was forced to open up its NFC technology to third parties in the European Union.
Before the EU's Digital M… [+2212 chars]",,AppleInsider
Leigh Nordstrom,Leighton Meester Finds Joy in Variety,Leighton Meester on her character in Season Two of 'The Buccaneers' and working with husband Adam Brody in 'Nobody Wants This' Season Two.,http://wwd.com/eye/people/leighton-meester-good-cop-bad-cop-the-buccaneers-1237711488/,https://wwd.com/wp-content/uploads/2025/05/Leighton-Meester-WWD-2025-AD-002.jpg?w=1000&h=563&crop=1,2025-05-13T21:09:30Z,"A few months ago, an interview with Leighton Meester proclaimed that, at long last, the actress was “back.” Meester certainly has never seemed busier — she has no less than four TV shows to talk abou… [+4539 chars]",,WWD
Tyler Lee,iOS 19 will be a more stable update than past releases,"According to Bloomberg’s Mark Gurman, one of Apple’s focuses of iOS 19 is to make it a more stable release than past versions.",https://www.androidheadlines.com/2025/05/ios-19-will-be-a-more-stable-update-than-past-releases.html,https://www.androidheadlines.com/wp-content/uploads/2024/12/Apple-iOS-18-2-apple-intelligence-update-AH.jpg,2025-05-13T21:03:24Z,"Remember when Apple released iOS 17? What a hot mess it was? It was full of bugs and performance issues, despite Apples attempts to resolve them. While iOS 18 was a much better and stable update, App… [+1983 chars]",,Android Headlines
Seth Kurkowski,"9to5Mac Daily: May 13, 2025 – Apple’s new accessibility features","Listen to a recap of the top stories of the day from 9to5Mac. 9to5Mac Daily is available on iTunes and Apple’s Podcasts app, Stitcher, TuneIn, Google Play, or through our dedicated RSS feed for Overcast and other podcast players.



Sponsored by Backblaze: Ne…",https://9to5mac.com/2025/05/13/daily-may-13-2025/,https://i0.wp.com/9to5mac.com/wp-content/uploads/sites/6/2021/12/9to5Mac-Daily-art-lead.jpg?resize=1200%2C628&quality=82&strip=all&ssl=1,2025-05-13T21:02:02Z,"Listen to a recap of the top stories of the day from 9to5Mac. 9to5Mac Daily is available on iTunes and Apples Podcasts app, Stitcher, TuneIn, Google Play, or through our dedicated RSS feed for Overca… [+839 chars]",,9to5Mac
PYMNTS,"Could AI Agents Be Coming for Chrome, Safari, and How We Surf the Web?","Artificial intelligence (AI) could soon herald the biggest internet shake-up since dial-up gave way to WiFi. With Perplexity AI in talks to reach a $14 billion valuation as it seeks to launch its own browser, Comet, to compete with tech giants like Google, AI…",https://www.pymnts.com/artificial-intelligence-2/2025/could-ai-agents-be-coming-for-chrome-safari-and-how-we-surf-the-web/,https://www.pymnts.com/wp-content/uploads/2025/05/AI-agents-search-engines-web-browers.jpg,2025-05-13T21:01:21Z,"Highlights 
Several leading AI companies are developing next-generation AI systems and browser interfaces that challenge the dominance of Google-style web access by delivering direct, personalized a… [+5298 chars]",,pymnts.com
Lorenzo Marquez,YOUR FRIENDS & NEIGHBORS Star Olivia Munn on Late Night with Seth Meyers,"Your Friends and Neighbors star Olivia Munn did two style things that we tend to criticize for her appearance on Late Night, but we’re not going to criticize them this time. Let’s play the Home T Lo game and see if you can figure out what they are.   The firs…",https://tomandlorenzo.com/2025/05/your-friends-neighbors-star-olivia-munn-on-late-night-with-seth-meyers/,https://tomandlorenzo.com/wp-content/uploads/2025/05/Olivia-Munn-Your-Friends-Neighbors-Late-Night-Seth-Meyers-TV-Style-Fashion-TLO-1.jpg,2025-05-13T21:00:51Z,"Archives: 
Select
 May 2025 
 April 2025 
 March 2025 
 February 2025 
 January 2025 
 December 2024 
 November 2024 
 October 2024 
 September 2024 
 August 2024 
 July 2024 
 June 2024… [+3827 chars]",,tomandlorenzo.com
Uncrate,Everyday Carry: Cintrée,"Aspinal of London Travel Card Case / $145. 1970's Cartier Tank Cintrée Watch / $75,850. Loewe Acetate Sunglasses / $340. Vintage Bulgari 18k TG Gas Lighter / $5,500....",https://uncrate.com/everyday-carry-cintree/,https://uncrate.com/p/2025/05/EDC-cintree.jpg,2025-05-13T21:00:00Z,"Saving money is always a good thing. With T-Mobile's Experience Plans, families can switch and save 20% vs. the other big guys' plans. The Experience More plan offers unlimited premium data, Netflix … [+539 chars]",,Uncrate.com
,DailySteals - Refurbished Apple iPad Mini 4 64GB $83.99,Refurbished Apple iPad Mini 4 64GB,https://www.dealcatcher.com/deals/computers-office/tablets/refurbished-apple-ipad-mini-7372,,2025-05-13T21:00:00Z,<ul><li>The discounted price of $83.99 seems extremely low compared to the original price of $490 for a refurbished iPad Mini 4.</li><li>The iPad Mini 4 was released in 2015 and is no longer supporte… [+1021 chars],,Dealcatcher.com
Marcus Mendes,New Apple AI model generates 3D scenes from just three images,"Apple’s Machine Learning team, in collaboration with researchers from Nanjing University and The Hong Kong University of Science and Technology, has announced an interesting 3D AI model called Matrix3D.



This so-called Large Photogrammetry Model is able to …",https://9to5mac.com/2025/05/13/apple-study-3d-objects-from-images/,https://i0.wp.com/9to5mac.com/wp-content/uploads/sites/6/2024/08/apple-vision-pro-headset.jpg?resize=1200%2C628&quality=82&strip=all&ssl=1,2025-05-13T20:59:39Z,"Apples Machine Learning team, in collaboration with researchers from Nanjing University and The Hong Kong University of Science and Technology, has announced an interesting 3D AI model called Matrix3… [+1751 chars]",,9to5Mac
Ray Maker,Google Outlines New Wear OS 6 Features,"Today Google held their ‘Android Show’ event. Which is less in-person event, and more a pile of early announcements & a livestream. Either way, this is essentially a pregame to next week’s big Google I/O in-person developer-focused event, where the … Read Mor…",https://www.dcrainmaker.com/2025/05/google-outlines-new-wear-os-6-features.html,https://media.dcrainmaker.com/images/2025/05/AndroidWearOSUpdatesPregame-1.png,2025-05-13T20:57:36Z,"Today Google held their Android Show event. Which is less in-person event, and more a pile of early announcements &amp; a livestream. Either way, this is essentially a pregame to next weeks big Googl… [+4869 chars]",,DC Rainmaker
"philip.berne@futurenet.com (Philip Berne) , Philip Berne",Google just showed us the new look of Android 16 and it’s aimed directly at the iPhone’s biggest fans,Color in motion coming to Android soon,https://www.techradar.com/computing/software/google-just-showed-us-the-new-look-of-android-16-and-its-aimed-directly-at-the-iphones-biggest-fans,https://cdn.mos.cms.futurecdn.net/mJuYV4d7XEFfuXuFWWKshe.jpg,2025-05-13T20:56:13Z,"Google put on an Android Show
 today to offer a glimpse at its upcoming interface changes with Android 16, in addition to a slew of Gemini news. It didn’t show off any new devices running the new lo… [+8722 chars]",techradar,TechRadar
feedfeeder,Apple Announces New iOS 19 and macOS 16 Accessibility Features Ahead of WWDC - MacRumors,Apple Announces New iOS 19 and macOS 16 Accessibility Features Ahead of WWDCMacRumors Apple unveils powerful accessibility features coming later this yearApple Exclusive | Apple to Support Brain-Implant Control of Its DevicesWSJ Synchron announces BCI integra…,https://slashdot.org/firehose.pl?op=view&amp;id=177490283,,2025-05-13T20:54:34Z,The Fine Print: The following comments are owned by whoever posted them. We are not responsible for them in any way.,,Slashdot.org
