title,url,press,time,content
"반도체 ‘관세 폭탄’ 4월엔 터진다?...‘6만전자’ 개미 바람, 트럼프 압박에 흔들리나 [투자360]",https://n.news.naver.com/mnews/article/016/0002428730,헤럴드경제,2025-02-14 08:12:08,"[AFP][헤럴드경제=신동윤 기자] 도널드 트럼프 미국 대통령이 전세계 무역 파트너를 대상으로 ‘상호 관세’를 물리겠다고 발표하면서 글로벌 무역전쟁의 전장을 무한정 확장하는 모양새다. 특히, 트럼프식 상호 관세는 기존 개념과 달리 비관세 장벽과 환율, 역외세금 등까지 고려한 것으로 알려지면서 자유무역협정(FTA) 체결국임에도 불구하고 큰 폭의 대미(對美) 무역흑자를 기록하고 있으며 ‘환율 관찰 대상국’으로 재지정된 한국도 사정권에서 벗어날 수 없다는 분석이 지배적이다.특히, 한국의 대미 수출 품목 1,2위 자동차와 반도체의 경우 트럼프 행정부의 추과 관세 부과 품목에 오른 것으로 알려진 만큼, 해당 섹터뿐만 아니라 국내 증시를 대표하는 주요 종목들의 주가엔 하방 압력으로 작용할 수 있다는 우려가 나온다.14일 금융투자업계에 따르면 트럼프 대통령은 13일(현지시간) 서명한 ‘상호 교역과 관세’ 대통령 각서를 통해 행정부에 각 교역 상대국의 관세, 세금, 비관세 장벽, 환율 정책, 기타 미국 기업의 시장 진출을 막는 불공정한 관행 등을 조사해 그에 상응하는 상호관세를 부과하기 위한 계획을 수립하라고 지시했다.관세뿐만 아니라 미국 기업에 부담이 되고 미국 무역적자의 원인이라고 판단되는 상대국의 모든 정책과 규제 등을 문제 삼겠다는 것이다.트럼프 대통령의 이번 조처로 한국을 비롯해 미국에 제품을 수출하는 거의 모든 국가는 트럼프 대통령의 관세 사정권 안에 놓이게 됐다.특히 한국의 경우 작년에 역대 최대 규모의 대미 무역흑자를 기록한 데다가 미 재무부로부터 ‘환율 관찰 대상국’으로 재지정된 상태여서 이번 상호 관세 조처에서 예외가 되기는 어려워 보인다.미국 입장에서 한국은 자신들의 무역 파트너 중 무역적자액 ‘톱 10’ 안에 포함돼 있다. 한국은 중국, 멕시코, 베트남, 아일랜드, 독일, 대만, 일본 등에 이어 무역흑자 8위에 자리해 있으며, 작년 한국의 대미 무역 흑자액은 557억 달러(약 81조원)에 달한다.실제로 미국 고위 당국자는 사전 브리핑에서 “중국 공산당 같은 전략적 경쟁자이든 유럽연합(EU)이나 일본이나 한국 같은 동맹이든 상관 없이 모든 나라가 다른 방식으로 우리를 이용하고 있다”며 한국을 특정해서 언급했고, 검토 과정에서 (미국의) 무역적자가 가장 많고 문제가 가장 심각한 국가들을 먼저 들여다볼 방침이라고 말했다.여기에 트럼프 대통령이 앞으로 추가로 관세를 부과할 품목으로 예고한 자동차, 반도체의 경우 각각 한국의 대미 수출 품목 1, 2위에 올라 있어 추가 타격도 예상된다.트럼프 대통령의 각서 서명 때 배석한 하워드 러트닉 미 상무장관 지명자가 “관세 부과를 국가별로 다룰 것”이라며 “4월 1일까지 핸정부 내 연구를 거치겠다”고 설명한 만큼, 한 달 반가량의 대응 시간을 벌어둔 측면도 있다. 하지만, ‘관세 협박’에 피해가 예상되는 섹터의 종목 주가엔 부담으로 작용할 수밖에 없다는 평가가 나온다.당장 반도체 섹터의 경우 ‘상호 관세’ 문제에 앞서 반도체법(Chips Act)에 따라 미국내 투자 기업에 미국 정부가 지급하기로 한 보조금에 대해 트럼프 행정부가 재협상을 추진 중이며 관련 지출 일부를 연기할 가능성이 있다는 로이터 통신의 보도도 악재로 꼽힌다.로이터 소식통 중 한 명은 백악관이 반도체법 보조금을 받은 뒤 중국 등 다른 국가진출 계획을 발표한 기업들에 대해서도 불만을 표시하고 있다고 전했다.로이터는 보조금 수혜 기업 중 중국에 투자한 사례로 인텔, TSMC와 함께 삼성전자와 SK하이닉스를 꼽았다.이런 로이터 보도 내용대로라면 미국 정부로부터 반도체법 보조금을 받기로 하고 미국에 대규모 투자를 추진 중인 삼성전자와 SK하이닉스도 영향을 받을 가능성을 배제할 수 없다.삼성전자는 미 텍사스주 테일러에 총 370억달러(약 53조4000억원) 이상 투입되는 파운드리(반도체 위탁생산) 공장을 건설 중이며, 미 상무부에서 이를 지원하는 보조금 47억4500만달러(약 6조8000억원)를 받기로 계약한 바 있다.SK하이닉스는 인디애나주에 인공지능(AI) 메모리용 어드밴스드 패키징 생산 기지를 건설하기로 하고, 미 상무부는 여기에 최대 4억5800만달러(약 6600억원)의 보조금을 지급하기로 계약한 상태다.이 같은 보도가 현실화될 경우 최근 반등세를 보이고 있는 삼성전자, SK하이닉스 주가의 발목을 잡는 요인으로 작용할 가능성이 크다. 삼성전자와 SK하이닉스 주가는 이달 들어서만 전날 종가까지 각각 6.49%(5만2400→5만5800원), 4.67%(19만9200→20만8500원) 씩 오른 바 있다.특히, 삼성전자의 경우 최근 기관 수급이 개선된 점과 자사주 매입 등이 주가 상승세를 이끌고 있는 모양새다. 기관 투자자는 2월 들어 삼성전자 주식 1153억원어치를 순매수했다. 특히, ‘연기금 등’이 2813억원이나 삼성전자 주식을 사들였다. 자사주 매입으로 추정되는 기타법인의 순매수액도 2617억원에 달했다.삼성전자는 최근 출시한 갤럭시 S25 시리즈의 흥행 조짐과 레거시(범용) 반도체 회복 가능성 등이 주가에 호재로 작용하고 있다는 평가가 나온다. 2차 자사주 매입안이 나올 수 있다는 점도 투심을 부른 요인으로 분류된다.SK하이닉스는 ‘딥시크 쇼크’에서 벗어나고 있는 인공지능(AI) 반도체 ‘대장주’ 엔비디아 주가의 강세에 힘입어 ‘20만닉스(SK하이닉스 주가 20만원 대)’를 탄탄히 다지며 21만원 대를 향해 상승 중이다. 엔비디아의 최신 AI 칩 블랙웰이 본격적으로 기업 서버에 탑재됐다는 소식은 SK하이닉스엔 추가적인 호재로 꼽힌다. SK하이닉스는 현재 자사가 생산 중인 최신형 고대역폭메모리(HBM)를 사실상 엔비디아에 독점적으로 공급 중이다.한편, 미국 측의 상호 관세 검토가 진행될 4월 초까지 한미간 협상을 통해 리스크가 해소될 가능성도 현재로선 낮아보인다. 한국이 해당 시점까지 대통령 권한 대행 체제를 해소하기 어려울 것으로 예상되는 만큼, 양국 정상간의 소통을 통한 정치적 타결은 기대하기 어렵다는 관측 때문이다."
"“‘AI’ 날개 단 카카오, 하반기 실적·주가 반등할 일만 남았다”",https://n.news.naver.com/mnews/article/009/0005443661,매일경제,2025-02-14 08:11:07,"정신아 카카오 대표가 지난 4일 오전 서울 중구 더 플라자 호텔 서울에서 열린 기자간담회에서 발언하고 있다. [사진 출처 = 연합뉴스]한국투자증권은 14일 카카오에 대해 하반기부터 본격적인 실적 개선이 기대된다며 투자의견 매수, 목표주가 4만9000원을 유지했다.카카오는 2024년 4분기 영업이익이 전년동기대비 33.7% 감소한 1067억원으로 시장예상치(영업이익 1184억원)를 밑돌았다.지난해 카카오는 모든 사업부가 전년 동기 대비 역성장을 기록했으며 특히 게임과 미디어 사업부가 큰 폭의 실적 감소를 보였다. 4분기 톡비즈 매출액은 4.7% 소폭 늘어나는데 그친 5627억원, 광고 성장률은 13.9%로 3분기 대비 소폭 상승했지만 커머스가 5.5% 감소했다. 같은 기간 콘텐츠 매출액은 전년동기보다 12.6% 줄어든 9101억원에 미쳤다.4분기 전체 영업비용은 전년동기대비 0.8% 는 1조8500억원을 기록했다. 인건비를 비롯한 대부분의 비용에 대한 보수적인 집행 기조가 이어지고 있다고 한국투자증권은 분석했다.한국투자증권은 올해 카카오가 인공지능(AI)와 톡개편으로 실적 및 주가 반등을 꾀할 것이라고 내다봤다.최근 카카오는 실적 발표에서 카카오톡을 개편해 콘텐츠를 발견 및 탐색할 수 있는 영역을 출시하고, 해당 섹션에 이미지·동영상·숏폼 등 다양한 콘텐츠를 피드 형태로 제공할 것이라고 밝힌 바 있다. 한국투자증권은 해당 개편을 통해 광고 공간이 추가되고 해당 성과가 하반기부터 본격적으로 반영되며 카카오의 톡비즈 매출 성장으로 이어질 것이라고 평가했다.또 카카오는 올 상반기 통합 AI 브랜드 ‘카나나’를 시작으로 카카오톡의 커머스, 지도 등 주요 기능들에 AI 기능 서비스 ‘AI 메이트’를 추가하고 더 나아가 AI 기반의 새로운 서비스들을 추진할 방침이다.이에 한국투자증권은 카카오가 상반기까진 상대적으로 실적 및 주가에서 부진을 이어가겠지만, 하반기부터는 광고 지면 추가에 따른 실적 개선과 서비스 확대로 모멘텀까지 부각될 것이라고 관측했다.정호윤 한국투자증권 연구원은 “오픈소스 진영의 성능 향상과 전반적인 API 가격 하락 등 국내 인터넷 기업들이 AI를 활용하기에 좋은 환경이 조성되고 있으며, 카카오는 이를 활용해 가장 큰 성과를 거둘 수 있는 기업 중 하나”라고 말했다."
"넥슨게임즈, 4Q 어닝쇼크에 목표가↓…밸류에이션 매력 감소 -현대차",https://n.news.naver.com/mnews/article/018/0005943582,이데일리,2025-02-14 08:09:08,"[이데일리 신하연 기자] 현대차증권이 넥슨게임즈(225570)에 대해 지난해 4분기 어닝 쇼크를 반영해 목표주가를 기존 2만 4000원에서 1만 9000원으로 21% 하향 조정하고, 올해 영업이익 전망치 하향에 따라 밸류에이션 매력도 감소했다고 분석했다.김현용 현대차증권 연구원은 14일 “넥슨게임즈의 4분기 영업손실은 21억원으로 컨센서스 대폭 하향하며 어닝 쇼크를 기록했다”며 이같이 밝혔다.김 연구원은 “4분기 매출액은 전년 동기 대비 17.3% 증가한 483억원, 영업손실은 21억원으로 적자를 지속하면서 컨센서스를 대폭 하회했다”며 “매출액은 퍼스트 디센던트가 2번의 시즌 업데이트에도 동시접속자수 반등에 실패하며 매출이 급감한 탓에 전분기 대비 56% 감소했다”고 설명했다.또 “매출 급감에 따른 고정 인건비 부담으로 영업손실 전환했다”며 “다만, 손실 규모는 전년 동기 대비로는 크게 축소됐다”고 평가했다.그는 “퍼스트 디센던트의 4분기 평균 스팀 동접자수는 2만명 수준으로 3분기 8만 9000명에 비해 급격히 감소했다”며 “특히 12월 중순 시즌2 업데이트에도 3만명을 넘지 못했고, 현재는 1만명 초반대로 다시 하락한 상태”라고 짚었다.이어 “3분기 일평균 19억원 수준이던 총매출은 4분기 3~4억원 수준으로 급락한 것으로 추정된다”고 덧붙였다.한편 던전앤파이터 아라드도 연말 출시까지는 점진적으로 기대감이 커질 것으로 전망했다.김 연구원은 “올해 말 출시를 계획 중인 던전앤파이터 아라드는 PC·콘솔·모바일 등 모든 플랫폼을 지원하는 액션 RPG 신작으로 던전앤파이터 IP를 기반으로 한다”며 “글로벌 및 중국에서 확실한 흥행 이력을 보유한 IP인 만큼 던전앤파이터 아라드 출시로 또 한 번의 이익 레벨업을 기대한다”고 말했다.이어 “출시 일정을 고려하면 상반기내 신작 관련 추가 정보가 공개될 가능성이 높다”고 강조했다.현대차증권 제공."
"롯데정밀화학, 올해 하반기 회복 전망…유동성도 문제 없어-한국",https://n.news.naver.com/mnews/article/018/0005943581,이데일리,2025-02-14 08:08:12,"투자의견 ‘매수’, 목표가 6만 1000원으로 ‘하향’[이데일리 박순엽 기자] 한국투자증권은 14일 롯데정밀화학(004000)에 대해 변동성이 높은 화학 업종에서 하반기까지 꾸준히 투자할 수 있는 종목이라고 평가했다. 투자의견은 ‘매수’, 목표가는 6만 7000원에서 6만 1000원으로 8.96% ‘하향’했다. 전 거래일 종가는 4만 1050원이다.최고운 한국투자증권 연구원은 “올 상반기 정기보수에 따른 기회손실을 고려해도 연간 영업이익은 1000억원으로 전년 대비 두 배 증가할 전망”이라며 “중국 건설경기 회복에 더해 러시아-우크라이나 휴전 시에도 추가적인 수요 증가를 기대할 수 있다는 점에서 이익 턴어라운드 방향성은 분명하다”고 말했다.(표=한국투자증권)롯데정밀화학은 지난해 ECH의 대규모 적자로 케미칼 부문이 적자 전환한 상황에 그린소재 역시 산업용 수요 부진으로 기대에 못 미쳤다. 4분기엔 일회성 인건비가 추가되면서 영업이익이 컨센서스를 밑돌았다. 또 올해 2월부터는 대규모 정기보수가 예정돼 있어 실적 회복을 제한할 것으로 봤다.최 연구원은 “더딘 건설 경기와 산업용 수요 회복과 상반기 정기보수 영향을 반영해 올해 영업이익 추정치를 19% 하향 조정한다”면서 “1분기엔 스페셜티 차별성이 부각되기 어려워 목표주가 역시 6만 1000원으로 기존 대비 9% 낮춘다”고 설명했다.그러나 그동안 ECH 부문 손실이 스페셜티 경쟁력에 대한 재평가를 가로막아 왔는데, 글리세린 가격과 맞물려 ECH 스프레드가 반등하고 있다는 점에 주목했다. 경쟁관계인 중국의 ECH 생산설비들은 대부분 글리세린을 사용하는데, 최근 글리세린 가격이 빠르게 상승하면서 ECH 판가도 끌어올리고 있다는 얘기다.최 연구원은 “케미칼이 반등하면 스페셜티 경쟁력과 그린소재 성장성에 대해서도 재평가받을 것이라는 점에서 매수 의견을 유지한다”며 “단기 부침이 있어도 그린소재 영업마진은 10%대고, 하반기 식의약용 증설 모멘텀도 유효하다”고 말했다.그는 또 “많은 화학업체의 밸류에이션 하단이 무너지고 있지만, 롯데정밀화학은 영업적자를 걱정하지 않아도 되고 순현금구조에 유동성도 문제없어 다르다”며 “변동성 높은 화학 업종에서 하반기까지 꾸준히 투자할 수 있는 종목으로 추천한다”고 덧붙였다."
“관세 리스크 재부각…산업재 등 주가 약세 심화 가능성”,https://n.news.naver.com/mnews/article/018/0005943580,이데일리,2025-02-14 08:08:10,"DS투자증권 보고서[이데일리 김응태 기자] 도널드 트럼프 미국 대통령의 관세 위협으로 리스크가 재부각하면서 다음 주 글로벌 증시에서 산업재, 헬스케어 등 관세와 관련성이 높은 업종의 주가 부진이 심화할 것이란 전망이 나왔다. 아울러 내주 미국 연방준비제도(Fed·연준) 인사들의 발언이 이어지면서 물가 불안 영향이 커질 것이란 관측도 제기됐다.우지연 DS투자증권 연구원은 “미 상장사들의 실적 자료에서 ‘관세’ 언급 수가 가파르게 확대되는 양상을 보이고 있다. 특히 산업재(건설·기계), 헬스케어, 자유소비재(자동차 및 부품)등 업종에서 관련 발언 빈도 수가 높았다”며 “관세 리스크 재부각 시 관련 기업들의 주가 언더퍼폼(시장수익률 하회) 양상 심화할 가능성이 있다”고 분석했다.다음 주 글로벌 주식시장은 물가에 초첨이 맞춰질 것으로 봤다. 우 연구원은 “현재 미 증시의 핵심 화두는 물가로, 최근 트럼프 정부의 잇따른 관세 예고와 미국 소비자물가지수(CPI) 쇼크가 인플레이션의 부담을 높이며 연준 금리 인하 신중론을 강화하고 있다”며 “미국 기준금리 인하 경로에 대한 시장 기대가 크게 후퇴됐다”고 분석했다.이어 “최근 미국 무위험 지표금리(SOFR) 선물시장에 반영된 미국 연말 기대 기준금리 수준은 트럼프의 상호관세 언급 전 대비 14bp(1bp=0.01%포인트) 이상 상승했다”고 덧붙였다.다음 주 예정된 연준 인사들의 발언이 물가 리스크를 자극할 수 있다고 판단했다. 우 연구원은 “차주 예정된 연준 인사들의 발언과 1월 연방공개시장위원회(FOMC) 회의록 매파 강도에 따라 증시 변동성 확대될 전망”이라며 “오는 17일(현지시간) 로건 및 하커 연은 총재 및 보우만 이사, 18일 데일리 연은 총재, 20일 굴스비 및 무살렘 연은 총재의 발언이 예정돼 있다”고 말했다.그러면서 “최근 미 의회 청문회에서 제롬 파월 연준 의장은 금리 인하에 대한 신중한 입장을 재확인했으나 동시에 물가 과잉 대응에 대한 경계 필요성을 언급하며 아직 인플레이션에 중립적인 기조를 유지했다”며 “그러나 지난 12월 FOMC부터 연준 인사들 사이에서 물가에 대한 우려가 커지고 있다. 차주 이를 재확인하는 과정에서 증시 내 리스크 회피 양상이 확대될 공산이 크다”고 밝혔다."
"한온시스템, 유럽 2Q 전동화 규제 가능성...목표가 유지-현대차",https://n.news.naver.com/mnews/article/018/0005943578,이데일리,2025-02-14 08:07:08,"현대차증권[이데일리 김경은 기자] 현대차증권은 한온시스템(018880)에 지난해 4분기 실적이 예상을 크게 하회했지만, 투자의견 ‘매수’와 목표주가 6500원을 유지한다고 밝혔다.현대차증권 장문수 연구원은 14일 “글로벌 OEM의 유럽 등 주요시장 전동화 구조조정이 공급망에도 확산되면서 과잉 생산능력을 합리화하는 과정이 피인수 이후에도 지속할 것”이라며 “단기 실적 개선은 지연되나 2분기 유럽발 규제 강화로 전동화 성장은 가능할 것”이라고 전망했다.그는 “4분기 영업적자 988억원을 기록해 시장 예상을 크게 하회했다”며 “한국타이어앤테크놀로지 피인수 전 일회성 비용 608억원, 구조조정비용 652억원 등이 반영된 것이 주요 원인”이라고 설명했다.올해 실적은 매출액 10조원대, EBITDA(법인세이자감가상각비차감전영업이익) 마진 9% 초반, 영업이익률 2% 초반으로 전망했다.장 연구원은 “생산 거점 최적화와 초과 생산능력 합리화, 비용 구조 슬림화 등 손익 개선을 위한 대대적인 작업이 지속될 것”이라고 예상했다.다만 올 하반기부터는 실적 회복이 기대된다. 장 연구원은 “연내 관련 사업 합리화와 2025년 하반기 고객사 전동화 신규·기존 매출 증가로 이익은 회복되며 배당도 재개할 것”이라고 전망했다.그는 “시기적으로 사업 구조 합리화 종료와 효과가 가시화되는 구간, 올해 유럽 규제 강화로 전기차 볼륨이 증가와 신규 수주가 가시화되는 구간에서 주가 회복은 탄력적일 전망”이라고 내다봤다."
"“컴투스, ‘프로야구Rising’ 출시 앞두고 기대감 상승”[클릭 e종목]",https://n.news.naver.com/mnews/article/277/0005546471,아시아경제,2025-02-14 08:02:04,"대신증권은 14일 컴투스에 대해 일본 프로야구 모바일 게임 ‘프로야구Rising’의 출시를 앞두고 본격적으로 기대감이 올라가는 시기라고 분석했다.이지은 대신증권 연구원은 이날 보고서에서 ""회사는 2월 중순부터 프로야구Rising의 마케팅을 본격적으로 시작할 것""이라며 ""UA, TVC 마케팅 등을 진행할 예정""이라고 밝혔다. 지난해 10월30일 사전 예약이 시작되면서 마케팅이 빠르게 진행될 것으로 예상되었으나, 실제 마케팅 시기는 다소 늦춰졌다. 이에 대해 이 연구원은 ""이는 마케팅 효율성을 고려한 것으로 판단된다""며 ""프로야구Rising 신작 기대감은 변함없다""고 전했다.비수기에도 컴투스의 야구 게임은 견조한 트래픽과 실적을 기록했다. 지난해 4분기 컴투스의 매출은 1891억원으로 전년 동기 대비 18%, 전 분기 대비 9% 증가했다. 영업이익은 26억원으로 전년 동기 대비 흑자 전환, 전 분기 대비 81% 성장하며 시장 예상치를 상회하는 실적을 기록했다. 연구원은 ""4분기 게임 별도 매출은 1418억원으로 전년 동기 대비 16%, 전 분기 대비 6% 증가했고, 영업이익은 19억원으로 전년 동기 대비 26%, 전 분기 대비 72% 감소했다""고 분석했다.특히 대표 RPG 게임인 ‘서머너즈워: 천공의 아레나’를 비롯한 RPG 장르의 매출은 800억원 수준을 기록하며 전 분기와 유사한 흐름을 보였다. 그러나 신작 ‘스타시드: 아스니아’의 글로벌 출시 효과는 미미했던 것으로 평가됐다. 반면 야구 게임 라인업의 매출은 기존 추정치 534억 원을 9% 상회하는 성과를 보였다.이 연구원은 ""야구 포스트시즌에 오히려 트래픽이 상승하면서 견조한 실적을 기록했다""며 ""4분기 트래픽이 다음 해까지 유지되는 경향이 있어 2025년 야구 게임 매출 추정치를 기존 대비 12% 상향 조정했다""고 설명했다.한편 연결 자회사들의 경우 4분기 흑자 전환을 기록했다. 그는 ""게임 자회사 티키타카 스튜디오의 견조한 실적으로 분기 흑자 전환을 기록했다""고 분석했다. 다만 티키타카 스튜디오 게임의 자연 매출 감소를 고려해 2025년 전체 연결 자회사 영업이익은 보수적으로 적자 지속을 전망했다. 그는 ""손실 폭은 개선될 가능성이 있다""고 덧붙였다.비용 측면에서는 로열티 비용이 228억원으로 전 분기 대비 46% 증가했고 마케팅비는 174억원으로 전 분기 대비 24% 증가했다. 이는 퍼블리싱 신작 출시 영향으로 분석됐다. 2025년에는 야구 게임을 비롯한 다수의 신작이 출시되면서 마케팅비가 전년 대비 55% 증가할 것으로 예상된다.1분기 실적은 야구 신작 출시 효과 반영이 부족하고 마케팅 비용이 선집행되면서 전 분기 대비 영업이익 감소가 예상된다. 다만 2분기부터는 야구 신작 매출이 온기 반영되면서 큰 폭의 이익 성장이 전망된다. 그는 ""하반기에도 야구 성수기에 진입하고 다수의 신작이 출시되면서 분기 이익 성장세가 지속될 것으로 예상된다""며 ""야구 신작 출시 이후에도 주가는 긍정적인 흐름을 보일 것""이라고 평가했다. 대신증권은 컴투스를 중소형 게임주 중 최우선 추천 종목(Top-pick)으로 유지했다."
"넷마블, 역성장 사이클에 목표가↓…신작 모멘텀이 관건-메리츠",https://n.news.naver.com/mnews/article/018/0005943570,이데일리,2025-02-14 08:00:14,"[이데일리 이용성 기자] 메리츠증권은 14일 넷마블(251270)에 대해 올해 신잔 게임 모멘텀이 역성장 사이클의 고리를 끊을 수 있을지 관건이라고 밝혔다. 투자의견은 ‘매수’, 적정 주가는 5만 8000원에서 5만 2000원으로 하향했다. 전 거래일 종가는 4만 6750원이다.(사진=메리츠증권)이효진 메리츠증권 연구원에 따르면 넷마블의 4분기 연결기준 매출액은 6490억원으로 전년 동기 대비 2.5% 줄고, 영업이익은 352억원으호 흑자전환하며 시장 기대치를 상회했다. ‘마블 콘테스트 오브 챔피언스’, ‘마블 퓨처파이트’ 및 ‘해리포터’ 등 북미, 유럽 수요 게임의 성수기 효과가 환율과 함께 크게 작용했다.연말 이벤트 성과가 인식되었음을 고려했을 때 리얼타임 매출은 이보다 컸을 것으로 이 연구원은 추정했다. 다만, 외부 지적재산(IP)이며 2025년 지급수수료율 하락을 이끌었던 PC 자체 런처가 아닌 모바일 게임이라 지급수수료가 발생하며 매출은 570억원 상회했으나 이익은 86억원을 상회하는 데 그쳤다는 분석이다.가장 빠른 신작은 3월 20일 예정된 ‘RF 온라인’이다. 다만, 이보다는 2분기 이후 모바일 게임이 중요하다는 것이 이 연구원의 설명이다. 그는 “기대가 높은 왕좌의 게임은 클로즈 베타 테스트(CBT) 일정 고려 시 5~6월 출시를 예상하며 성공 여부가 2분기 이후 역성장 고리를 끊어줄지 결정할 전망”이라며 “아직은 ‘나혼렙’의 기저가 다소 높아 보인다”고 전했다.특히 게임 스타일 고려 시 ‘나혼렙’ 대비 트래픽을 키워 성과를 얻어야 할 것으로 이 연구원은 전했다. 이 연구원은 “외부 IP를 활용한 수익 창출은 동사의 장점이나 출시된 신작들의 빠른 안정화가 실적의 계단식 성장을 저해하고 있다”고 전했다."
