title,url,press,time,content
"""金 이겼다""…딥시크 혁명에 '인터넷ETF' 일주일 만에 15%↑",https://n.news.naver.com/mnews/article/421/0008063165,뉴스1,2025-02-08 10:55:08,"지난주 TIGER 인터넷TOP10 ETF 1위…RISE 플랫폼테마 13%대 상승""'저비용·고효율' 후발주자도 기회…B2B 더비즈온·B2C 네카오 주목""ⓒ News1 DB(서울=뉴스1) 박승희 기자 = 지난주 상장지수펀드(ETF) 시장에서 가장 높은 수익률을 기록한 상품은 네이버·카카오(네카오)를 포함한 한국 인터넷 산업 대표주들로 구성된 미래에셋증권의 ‘TIGER 인터넷TOP10’이 차지했다.중국의 생성형 인공지능(AI) 프로그램 ‘딥시크’(DeepSeek) 수혜로 관련 종목이 급등한 영향이다.8일 한국거래소에 따르면 한국 IT·소프트웨어와 플랫폼 등 인터넷 산업 대표 기업 10개 사에 분산 투자하는 TIGER 인터넷TOP10은 지난 3~7일 15.73% 올라 전체 ETF 상품 중 가장 가파른 상승률을 기록했다.이 ETF의 주요 구성 종목 중 △더존비즈온(27.91%) △네이버(25.53%) △카카오(22.55%)가 75% 이상을 차지하며 상승세를 견인했다. 그 외에도 △카페24 △SOOP △서진시스템 △엠로 △안랩 △디어유 △인텔리안테크 등이 포함됐다.'고효율 개발법 공개' 딥시크 낙수효과 기대…구성종목 10~20%대 급등TIGER 인터넷TOP10 상승은 지난달 말 저비용·고효율 AI 모델 개발로 세계를 뒤흔든 딥시크 등장 이후 인터넷 산업에 낙수효과가 기대되면서 주요 구성종목 주가가 상승했다.딥시크 V3는 오픈AI의 챗GPT o1과 큰 차이 없는 성능으로 주목을 받았다. 딥시크는 엔비디아의 저사양 GPU인 H800을 활용해 개발 비용이 557만 6000달러에 불과한 것으로 알려졌다. 미국 빅테크 기업이 수십억 달러에서 백억달러 이상을 투자받은 것을 고려하면 상당히 높은 효율성을 보여준 사례다.특히 보고서를 통해 개발의 효율성을 높일 방법을 공개하며 오픈소스 진영인 국내 인터넷 업종에 가능성을 안겨줬다. 정호윤 한국투자증권 연구원은 ""대규모 GPU 투자, 데이터 학습을 위해 거대 자본이 필수 불가결했떤 AI 개발의 패러다임이 변하고 있다""며 ""후발주자들에게도 다양한 기회가 열렸다""고 평가했다.이 영향으로 지난주 해당 ETF의 주요 종목들이 강세를 보였다. 더존비즈온은 24.75% 급승했으며 카카오는 16.04%, 네이버는 4.16% 올랐다. 구성 종목 10개 중 서진시스템과 안랩을 제외하고 모두 상승했다.로봇·방산·금 ETF 수익률 상회…""B2B 더존비즈온·B2C 네카오 유망""TIGER 인터넷TOP10 이외에도, 국내 플랫폼 비즈니스 중 경쟁 우위에 있다고 판단된 기업들에 투자하는 ETF인 'RISE 플랫폼테마'도 13.45% 상승했다. 이 상품 또한 네카오를 비롯한 인터넷 기업들을 포트폴리오에 다수 담고 있다.이들 ETF는 △RISE AI&로봇(10.13%) △SOL K방산(9.74%) △ACE KRX금현물(9.43%) 등 지난주 국내 증시에서 강세를 보인 로봇·방산주와 연일 최고점을 경신 중인 금 관련 상품보다 더 큰 상승 폭을 기록했다.업계에서는 딥시크의 등장이 인터넷 관련 종목에 지속적인 수혜를 줄 것으로 예상했다. 한화투자증권은 B2B 측면에선 더존비즈온이, 데이터셋을 보유한 B2C 플랫폼인 네이버와 카카오가 특히 유망하다고 분석했다.김소혜 한화투자증권 연구원은 “비용 효율적인 오픈소스 AI 모델들의 등장으로 기업 고객에게 보다 저렴한 비용으로 AI 서비스를 제공할 수 있는 B2B 기업이 가장 먼저 수혜를 입을 것”이라고 진단했다.이어 “국내 인터넷 기업들은 오픈소스 AI 모델을 적극 활용해 AI 에이전트 서비스를 사용자에게 제공하는 역할을 할 것”이라며 “생성형 AI 및 대화형 UI가 적용된 AI 서비스가 본격적으로 출시되면서, 국내 인터넷 기업들의 AI 사업이 본격적으로 시작될 것”이라고 전망했다."
각국 '금지령' 아랑곳 않고… 中서 쑥쑥 크는 '딥시크',https://n.news.naver.com/mnews/article/018/0005939074,이데일리,2025-02-08 10:48:09,"레노버, 자사 AI 어시스턴트와 딥시크 통합UB테크, 자사 로봇에 딥시크 활용 추진키로[이데일리 원다연 기자] 해외에서 잇단 접속차단 조치를 받고 있는 중국 생성형 인공지능(AI) 딥시크가 PC는 물론 로봇과 전기차까지 서비스 영역을 확장하고 있다고 홍콩 사우스차이나모닝포스트(SCMP)가 8일 전했다.(사진=로이터)보도에 따르면 중국 컴퓨터 제조업체 레노버는 최근 웨이보를 통해 자사 샤오톈 AI 어시스턴트와 딥시크 AI 모델을 통합했다고 밝혔다. 문장 독해와 코드 생성, 수학, 추론 등 기능을 강화하기 위해서다.레노버는 지난해 출시한 샤오톈 서비스를 태블릿과 스마트폰 등 다른 제품으로도 확대한다는 계획이다.또 중국 최대 휴머노이드 로봇 제조업체 UB테크는 자사 로봇에서 딥시크 AI 모델을 활용하는 방안을 추진하고 있다. 로봇이 복잡한 현실세계 환경에서 지시를 이해하도록 돕고 공장에서 작업을 수행하는 테스트가 진행되고 있다.중국 지리자동차는 딥시크의 RI 추론 모델을 자사가 개발한 신루이 AI 모델에 탑재하고 있다. 운전자의 요구를 이해하고 예측할 수 있도록 하기 위함이다. 이밖에 중국 게임사 넷이즈의 온라인 교육 자회사 유다오와 장쑤헝루이제약도 딥시크 도입에 나섰다.전문가들은 딥시크의 비용상 이점과 오픈소스라는 접근 방식이 업체들에 새로운 기회를 제공하고 있다고 분석했다."
“미국 반도체 사자”…딥시크 충격 진정세에 투자↑,https://n.news.naver.com/mnews/article/057/0001870657,MBN,2025-02-08 10:46:11,"""AI 하드웨어 투자 확대"" 기대…서학개미, 엔비디아·관련 ETF 한주간 1조 원 순매수트럼프도 ""AI, 사람들이 생각한 것보다 더 싸질 것""이라며 딥시크 긍정평가중국 인공지능(AI) 딥시크의 로그인 화면 / 사진=연합뉴스중국 고효율 AI(인공지능) '딥시크'의 시장 충격이 진정 국면으로 접어들면서 미국 반도체 분야로 국내 투자자금이 쏠리는 현상이 확대되고 있습니다.당초 딥시크는 고액 AI 하드웨어 투자에 대한 회의론을 촉발하며 엔비디아 등 주요 종목의 주가를 폭락시켰지만, 혼란이 잦아들면서 거꾸로 '딥시크 덕에 AI 칩 수요가 늘 것'이란 기대감이 커져 관련 투자 심리가 순풍을 받는 것으로 풀이됩니다.오늘(8일) 한국예탁결제원에 따르면 지난 한 주(1월30일∼2월6일) 국내 투자자가 가장 많이 사들인 외국 주식은 엔비디아와 '디렉시온 데일리 반도체 불 3X ETF(상장지수펀드)'로 순매수액이 각각 2억 9,700만 달러와 2억 6,000만 달러로 집계됐습니다.디렉시온 반도체 ETF는 미국 반도체 지수를 3배로 증폭해 추종하는 고위험 상품입니다.순매수액 3위는 전기차 기업 테슬라(2억 1,900만 달러), 4위는 엔비디아를 2배로 추종하는 펀드인 '그레나이트셰어즈 2.0X 롱 NVDA 데일리 ETF'(1억 7,200만 달러)였습니다.엔비디아, 디렉시온 ETF, 그레나이트셰어즈 ETF 등 미국 반도체 관련 3개 종목의 순매수액은 총 7억 3,000만 달러로 한화로는 1조 500억 원에 달합니다.엔비디아의 AI용 반도체인 H100 / 사진=연합뉴스딥시크는 불과 560만 달러(81억 원)의 개발비로 '챗GPT o1' 등에 필적하는 최상위 추론 AI의 성능을 구현했다는 사실이 알려지며 지난 달 말 전 세계 AI 업계와 증시에 큰 파장을 일으켰습니다. 이 비용은 미국 AI 기업들의 개발비와 비교하면 10분의 1에도 못 미쳐 'AI 개발에는 거액이 필요하다'는 통념을 완전히 뒤집은 것입니다.특히 AI 개발 비용의 대부분을 차지하던 그래픽처리장치(GPU)와 고성능 메모리 등 AI 하드웨어가 '과잉 투자' 상태가 아니냐는 우려가 증폭하면서 반도체 종목이 직격탄을 맞았습니다.엔비디아는 지난 달 27일 하루에만 주가가 17% 급락해 시가총액 846조 원이 사라졌고, 한국에서도 설 연휴가 끝난 직후인 같은 달 31일 SK하이닉스와 삼성전자 주가가 줄줄이 떨어지며 증시가 하락세를 맞이했습니다.그러나 혼란이 수습되면서 정반대의 전망이 빠르게 부상했습니다. 딥시크가 경제형 AI 보급을 대거 촉진하고 미국 등 타 AI 업계와의 연구개발(R&D) 경쟁을 촉발해 AI 하드웨어 수요가 더 커질 수 있다는 분석 때문입니다.도널드 트럼프 미국 대통령도 현지시간으로 7일 백악관에서 진행된 미일 정상회담에서 딥시크와 관련된 질문에 경제성을 언급하며 긍정적인 측면이 많을 거라는 답변을 내놓기도 했습니다. 그는 ""우리는 그(딥시크)로부터 혜택을 받을 것""이라며 ""우리가 말하고 있는 AI는 사람들이 실제 생각하는 것보다 훨씬 싸질 것이며 그것은 좋은 일""이라고 말했습니다.실제 딥시크 파문이 극심했던 지난달 24∼30일에도 국내 투자자들은 엔비디아를 3억 1,700만 달러(4,614억 원) 순매수 결제해 '반도체 낙관론'에 더 무게를 싣는 모습을 보였습니다.한동희 SK증권 연구원은 ""딥시크 개발진의 논문을 봐도 AI 성능 향상을 위해 높은 컴퓨팅 파워(전산 자원), 강력한 기반 모델, 거대 강화학습이 필요하다는 점이 부각되는 만큼 종전보다 '스케일링 법칙'(하드웨어 확대의 법칙)이 더 지속될 수 있을 것으로 본다""며 ""최근 메타와 알파벳 등 미국 거대 AI 기업이 밝힌 올해 자본지출(Capex) 전망치가 시장 예상을 웃돈 것도 AI 투자 명분을 강화하는 요인으로 해석한다""고 설명했습니다.김동원 KB증권 연구원도 ""딥시크와 같은 '가성비 AI'의 출현은 AI 생태계 확장으로 이어져 GPU 수요 기반이 동시에 확장될 수 있다""며 현 딥시크 국면이 오히려 반도체 주식을 저가 매수할 기회가 될 수 있다고 짚었습니다."
"트럼프, 바이든 정부 총기규제 정책 재검토 지시(종합)",https://n.news.naver.com/mnews/article/018/0005939072,이데일리,2025-02-08 10:41:09,"[이데일리 원다연 기자] 미국 도널드 트럼프 행정부가 7일(현지시간) 전임 바이든 행정부의 총기 규제 강화를 뒤집기 위한 절차에 착수했다.백악관에 따르면 트럼프 대통령은 이날 개인의 총기 보유 권리를 명시한 헌법 2조를 보호하기 위한 행정명령에 서명했다.행정명령은 법무부 장관에 모든 명령, 규제, 지침, 계획, 국제 협약, 기타 행정부 조치를 검토해 헌법 2조 침해 여부를 평가하고, 헌법 2조를 보호하기 위한 행동계획을 30일 내로 제출하라고 지시했다.구체적으로 전임 바이든 행정부 기간인 2021년 1월부터 2025년 1월까지 법무부와 주류·담배·총포 담당국(ATF) 등에서 시행한 모든 총기 관련 조치의 검토를 지시했다.행동계획에는 바이든 행정부에서 시행한 총기 규제를 완화·철폐하라는 내용이 담길 가능성이 커 보인다.트럼프 대통령은 “총기를 소지·휴대할 권리는 미국인이 보유한 다른 모든 권리를 유지하는 기반이 되기 때문에 침해해서는 안 된다”고 밝혔다.총기 폭력이 잦은 미국에서 총기 규제는 보수와 진보를 가르는 의제로 민주당은 규제 강화를 주장하지만, 공화당은 총기 폭력을 총격범의 정신 상태 등 개인 문제로 규정하고 규제에 반대해왔다.트럼프 대통령은 또 남아프리카공화국 정부의 토지 수용 정책을 “인종 차별적 토지 몰수”로 규정하고 남아공에 대한 원조 또는 지원을 중단하는 행정명령에 서명했다.트럼프 대통령은 백악관이 공개한 행정명령에서 “최근 남아공 정부는 소수 민족인 아프리카너스(Afrikaners·17세기 남아공에 이주한 네덜란드 정착민 집단)의 농업용 부동산을 수용할 수 있도록 하는 법을 제정했다”며 이 법을 “불균형적 폭력을 부추기는 증오적 수사법이자 정부 조치”라고 비난했다.그는 또 “남아공은 국제사법재판소(ICJ)에 하마스가 아닌 이스라엘을 집단학살 혐의로 고발하고, 이란과 상업·군사·핵 증진을 위한 관계를 활성화하는 등 미국 및 그 동맹국에 대한 공격적 입장을 취했다”고 지적했다.트럼프 대통령은 그러면서 미국의 모든 행정부처와 기관에 남아공에 대한 원조와 지원을 중단할 것을 지시했다.또한 남아공 아프리카너스 가운데 부당한 인종차별 피해자에 대한 미국 입국 및 정착을 돕는 조처를 시행하라고 국무부 장관과 국토안보부 장관에게 지시했다.트럼프 대통령은 지난 2일 남아공의 토지 수용 정책을 ‘특정 계층을 매우 나쁘게 대우하는 토지 몰수’라고 비판하며 남아공에 대한 지원 중단을 시사했다. 이에 남아공 시릴 라마포사 대통령은 지난 6일 연례 국정연설에서 트럼프 대통령의 조처를 “괴롭힘”이라고 규정, “겁먹지 않고 좌절하지 않을 것”이라고 반발한 바 있다.트럼프 대통령은 또한 백악관에 신앙 사무실(Faith Office)을 설립하는 행정명령에도 서명했다.(사진=로이터)"
"러 파병 북한군 1/3 사상…“구식 전술, 지원 부족 탓”",https://n.news.naver.com/mnews/article/018/0005939067,이데일리,2025-02-08 10:33:09,"[이데일리 원다연 기자] 러시아에 파병된 북한군의 3분의 1가량이 다치거나 전사한 것으로 알려진 가운데 전장에서 이들과 싸운 우크라이나군 장병들은 북한군 인명피해가 큰 이유로 구식 전술, 러시아 지원 부족 등을 꼽았다.북한군은 시대와 뒤떨어진 전술을 구사한 데다 러시아군의 지원은 없는 듯 보였고, 결과적으로 드론 등이 동원된 현대전에 취약성을 드러냈다는 것이다.영국 일간 더타임스는 러시아 접경지역인 수미와 우크라이나가 일부 영토를 점령한 러시아 쿠르스크주 등지에서 북한군과 싸웠던 공수여단의 낙하산 부대원들, 기계화 여단 장병들과 인터뷰한 내용을 7일(현지시간) 전했다.이들은 북한군에 러시아의 지원이 거의 혹은 전혀 없는 듯 보였다고 밝혔다. 또 12월 중순부터 한달간 매일 북한군의 공격을 견뎠지만, 그 이후로는 2주 이상 공격이 없었다고 말했다.이날 볼로디미르 젤렌스키 우크라이나 대통령은 쿠르스크 전선에서 사라졌던 북한군이 복귀했다고 밝혔다. 그는 연설에서 쿠르스크 작전지역에서 새로운 공격이 발생했다며 러시아군이 북한군 병력을 재배치했다고 말했다.우크라이나 제95공중강습여단의 안톤 소령은 더타임스에 북한군이 러시아의 지원을 받지 못한 것에 안도했다고 말했다. 그는 북한군이 대포와 공격 드론, 전차를 갖췄다면 강력한 전투력이 됐을 것이라고 했다.그는 또 전선에서 북한군 생포했던 상황을 설명했다. 덤불에 몸을 숨겼던 북한군은 반쯤 의식이 없는 상태로 무기도 탄약도 갖고 있지 않았다. 응급처치 후 정신을 차린 북한군은 자신이 포로로 잡혔다는 사실을 알고서 콘크리트 기둥에 머리를 찧으며 스스로 목숨을 끊으려 했다고 한다.병사가 그를 제압하고 스마트폰 번역 앱을 이용해 상황을 설명한 후, 국가안보국(SBU) 요원들이 그를 키이우로 이송했다. 또 다른 포로 생포 시도는 그가 방탄복 안에 수류탄을 터뜨려 자살을 시도하며 실패했다.우크라이나 제47기계화여단 대원들은 북한의 무자비한 공격은 러시아의 영토 탈환에 도움이 됐다고 평가했다. 북한군은 하루에 9번 공격을 하기도 했다. 공격은 특히 쿠르스크 서쪽에서 두드러졌고, 공격적이고 매우 빠르게 진군하는 특징이 있었다고 전했다.제47여단의 한 상사는 지난 10월의 전투 경험을 전했다. 수미주에서 러시아군이 전선을 뚫고 북한 보병들이 와서 영토를 점령하고 우크라이나군을 더 멀리 밀어냈다. 그러나 러시아군은 북한군에 추가 기갑장비를 지원하지 않았다. 미국산 장갑차로 무장한 우크라이나군은 이들을 다시 밀어내고 전선을 안정화하는 데 성공했다.젊고 고도의 훈련과 이념화된 동기까지 장착한 북한군에 비해, 전쟁 당사자인 러시아군와 우크라이나군은 3년간 이어진 전쟁으로 큰 피해를 본 데다 사기도 많이 떨어진 상태다.우크라이나 제80공중강습여단의 미콜라 스트리구노우 중대장은 “러시아군도 우리처럼 지쳐있다”며 “보통 러시아 돌격부대를 드론으로 타격하면 엄폐하고 후퇴하지만, 북한군은 계속 전진한다”고 설명했다.다른 평가도 나왔다. 같은 여단 소속 빌라예프 대위는 정찰 중 텐트로 보이는 물체들 사이로 북한군 병사들이 무리 지어 걸으며 이야기하는 보고 놀랐다고 했다. 분별력 있는 군인이라면 적을 마주한 상황에서 지면 위로 신체를 노출하지 않는다는 것이다.이 여단 낙하산 부대원들은 북한군이 미쳤거나 멍청한 게 아니라, 드론이 병력을 발견하고 그들을 한데 모아 한 번의 공격으로 제거하는 방식을 고려하지 못한 채 구식 전술을 사용한 것이라고 전했다. 북한군은 고전적인 보병 공격 대형으로 소대 단위로 이동했다. 빌랴예프 대위는 “어느 정도 시간이 지나자 그들은 이 전쟁이 들었던 것과 다르다는 것을 깨닫고 어딘가로 사라져버렸다”고 말했다.볼로디미르 젤렌스키 우크라이나 대통령은 지난 11일(현지시간) 우크라이나군이 러시아 서부 쿠르스크 지역에서 북한 군인 2명을 생포했다고 밝혔다. (사진=연합뉴스)"
오세훈 “민주당 ‘성장 전략’은 모순 가득…이재명 닮아”,https://n.news.naver.com/mnews/article/018/0005939065,이데일리,2025-02-08 10:24:09,"[이데일리 원다연 기자] 오세훈 서울시장은 8일 “더불어민주당의 ‘대한민국 성장 전략’은 모순으로 가득 차 있다”며 “이재명 대표와 닮았다는 생각을 지울 수가 없다”고 비판했다.오 시장은 이날 페이스북을 통해 “성장 전략이라기보다 온갖 좋아 보이는 것을 모아 놓은 정치적 구호에 가깝다”면서 이같이 밝혔다.그는 민주당의 성장 전략에 대해 “성장의 열쇠가 미국 빅테크 같은 기업이라고 말하면서 한국은 정부가 AI 국립 연구소를 설립하고 인재를 직접 유치해야 한다고 한다”며 “한미 FTA를 비롯한 FTA 모델을 비판하면서 글로벌 협력과 네트워크, 해외 투자 유치는 강조한다”고 지적했다.이어 “정부 주도의 경제 컨트롤타워도 강조한다. (그러나) 국가가 직접 연구소를 운영하며 산업을 통제하면서 동시에 기업 주도의 혁신 생태계를 만들 수는 없다”고 했다.오 시장은 또 “노동정책에서도 노동시장을 유연화하면서 동시에 고용 안정성을 강화하겠다고 한다”면서 “이 모두가 ‘차가운 불꽃’을 만들겠다는 말이나 다름없다”고 지적했다.그는 “성장은 기업과 기술 발전으로 가능하다. 누구든 성장론의 대열에 동참하는 것은 환영한다”며 “그러나 진심 없이, 뚜렷한 방향성 없이 ‘위장 성장론’을 외치는 것으로는 아무것도 이룰 수 없다”고 덧붙였다.오세훈 서울시장이 7일 서울 중구 서울시청에서 열린 ‘AI와의 동행을 위한 정례간부회의’에서 발언하고 있다. (사진=연합뉴스)"
인플레·상호관세 악재에 '털썩'…S&P 500 1%↓[뉴욕증시],https://n.news.naver.com/mnews/article/277/0005543442,아시아경제,2025-02-08 10:16:31,"3대 주가지수 1% 안팎 하락 마감기대 인플레이션 1%포인트 급등트럼프 상호 관세 부가 이슈도 부담뉴욕증시의 3대 주가지수가 1% 안팎으로 떨어지며 마감했다. 미국 소비자들의 기대 인플레이션이 이례적으로 급등한 데다 도널드 트럼프 미국 대통령이 다음 주 다수 국가에 상호 관세를 부과하겠다고 밝히면서 투자심리가 악화된 것이다.7일(미국 현지시간) 뉴욕증권거래소(NYSE)에서 다우존스30산업평균지수는 전장보다 444.23포인트(0.99%) 밀린 4만4303.40에 거래를 마감했다.스탠더드앤드푸어스(S&P)500지수는 전장보다 57.58포인트(0.95%) 떨어진 6025.99, 나스닥종합지수는 268.59포인트(1.36%) 급락한 1만9523.40에 장을 마쳤다.이날은 미국 소비자들의 1년 기대 인플레이션이 이례적으로 급등하면서 매도 매물이 쏟아졌다. 미시간대에 따르면 올해 2월 소비자심리지수 예비치는 67.8로 집계됐다. 이는 지난 1월 확정치 71.1에서 4.6% 감소했고 시장 예상치 71.1도 밑도는 수치다.시장이 특히 민감하게 반응한 부분은 1년 기대 인플레이션이다. 2월의 1년 기대 인플레이션은 4.3%로 전월의 3.3% 대비 1%포인트나 급등했다. 이는 2023년 11월 이후 최고치며 2개월 연속 큰 폭으로 상승한 결과다. 미시간대에 따르면 지난 14년간 1개월 사이에 1년 기대 인플레이션이 1%포인트 넘게 상승한 사례는 5번밖에 없는 것으로 전해진다.이 같은 지표가 발표되자 뉴욕증시의 3대 주가지수는 일제히 급락세로 돌아섰다. 나스닥 지수는 장 중 0.36%까지 오름폭을 늘리다 한 시간 만에 1%포인트 가까이 떨어졌다. 1년 기대 인플레이션의 이례적 상승으로 미국 국채금리가 급등하면서 주요 지수를 짓누른 것이다. 오후에 트럼프가 발표한 상호 관세 조치는 시장에 하방 압력을 더했다.트럼프는 이날 백악관에서 기자들과 만나 ""다음 주 월요일이나 화요일에 (상호 관세에 대해) 회의 후 발표할 계획""이라고 밝혔다.트럼프는 상호 무역이라고 말했지만, 맥락상 상호 관세를 의미하는 것으로 해석됐다. 이는 미국으로 들어오는 수입품에 대해 수출국이 미국산에 부과하는 관세율만큼 세금을 매기겠다는 것이다. 트럼프는 특히 자동차를 대상으로 관세를 고려 중이라며 그것은 매우 중요한 문제라고 강조했다.이 같은 소식에 거대기술 기업 위주로 투매가 나왔다. 애플은 2.40%, 마이크로소프트는 1.46% 떨어졌고 테슬라와 알파벳도 3%대 하락률을 기록했다. 상호 관세 부과 움직임에 전통 산업주와 우량주도 투심 악화를 겪었다. 다우지수를 구성하는 30개 종목 중 엔비디아와 비자, 코카콜라, 셰브론만 강보합을 보였을 뿐 나머지 종목은 모두 하락했다."
