title,url,press,time,content
아이에스티이 등 3개사 다음주 코스닥 입성[IPO챗],https://n.news.naver.com/mnews/article/001/0015199252,연합뉴스,2025-02-08 09:00:05,"아이에스티이 로고[아이에스티이 제공. 재판매 및 DB 금지](서울=연합뉴스) 김태균 기자 = 다음 주(10∼14일)에는 아이에스티이, 동방메디컬, 오름테라퓨틱 등 3개사가 코스닥 시장에 진출한다.오는 12일 상장하는 아이에스티이는 반도체 장비 기업이다.반도체 보관 장비인 풉(FOUP)의 커버와 바디를 분리 세정할 수 있는 기기를 개발해 2016년부터 SK하이닉스에 공급하고 있다.작년 기업공개(IPO) 시장의 위축으로 상장 작업을 연기했다가 올해 공모 물량을 줄여 다시 증시 진출을 추진했다.동방메디컬 로고13일 상장하는 동방메디컬은 1985년 한방침 제조사로 출발해 최근에는 필러, 봉합사 등 미용 의료기기 분야로 사업 범위를 넓혀왔다.국내 최초로 일회용 한방침과 일회용 부항컵을 개발했으며, 이 제품들의 지난해 국내 시장 점유율은 각각 54.55%, 61.31%였다.오름테라퓨틱[오름테라퓨틱 제공]오름테라퓨틱은 14일 상장한다. 차세대 항암제를 개발하는 업체로, 지난해 11월 상장 추진을 철회했다가 몸값을 낮춰 IPO 재도전에 나섰다.오름테라퓨틱의 핵심 기술은 '이중 정밀 표적 단백질 분해'로 표적으로 삼은 암세포만 정밀 타격할 수 있게 해준다.모티브링크, 엘케이켐, 위너스 등 3개사는 다음 주 일반 투자자 청약을 받는다. 모두 코스닥 상장이 예정된 곳들이다.모티브링크 CI[모티브링크 제공. 재판매 및 DB 금지]모티브링크는 11∼12일 청약을 진행한다. 이 회사는 하이브리드 및 전기차에 쓰이는 '전동화 전력변환' 시스템을 전문으로 하는 기업이다.이 시스템의 핵심 부품인 트랜스포머와 필터 등을 생산하며 시스템 설계·검증·양산 등 전 과정을 수행한다.13∼14일 청약을 받는 엘케이켐은 반도체 공정에 쓰이는 소재를 만든다. 특히 '원자층 증착 공정(ALD)' 분야가 전문인데, 이는 웨이퍼 위에 원자층 단위로 균일한 박막을 형성하는 작업으로 초미세 반도체 공정에서 필수로 쓰인다.주력 제품으로는 ALD에 쓰이는 고유전율막 형성 '하이(High)-k' 소재, 저유전율막 형성 '로우(Low)-k' 소재, 기타 정밀화학 소재 등이 있다.위너스스마트 배전 시스템 업체 위너스의 기업 로고 [위너스 제공]위너스도 13∼14일 청약이 예정되어 있다. 배선 시스템 전문 업체로 스위치, 콘센트, 멀티탭, 차단기 등을 만든다.에너지 하베스팅(외부 에너지를 전기로 바꿔 저장하는 작업) 등 신기술을 토대로 '자가발전 무전원 스위치' 등의 신성장 제품도 준비하고 있다.다음 주 수요조사를 하는 기업은 6개사이며, 모두 코스닥 상장을 추진하는 곳이다.대진첨단소재, 더즌, 심플랫폼은 11∼14일 수요조사가 예정되어 있다.대진첨단소재는 이차전지 공정에 쓰이는 소재를 만드는 곳이며, 상장 뒤 에너지저장장치(ESS) 공정용 제품 등으로 사업다각화를 할 계획이다.더즌 로고금융 서비스 업체 '더즌'의 로고 [회사 제공]더즌은 기업용 금융 VAN(Value Added Network) 사업을 한다. 이 서비스는 기업이 금융 거래를 할 때 이용 기관과 은행의 시스템을 중개하는 것이 골자다.심플랫폼은 사물인터넷(IoT) 기술을 토대로 설비 및 기기에서 수집한 데이터를 저장 및 분석하는 기업이다.이런 IoT 데이터를 토대로 예지 정비, 품질 검사, 생산 최적화, 공급망 최적화, 리소스 최적화 등 서비스를 제공한다.엠디바이스 로고[회사 제공]엠디바이스는 12∼14일 수요조사를 한다.이 회사는 솔리드스테이트드라이브(SSD)를 설계·제작한다. SSD는 하드디스크드라이브(HDD)보다 데이터 저장 속도가 훨씬 빠르고 내구성이 강해 여러 산업에서 수요가 꾸준히 늘고 있다.엘케이켐과 위너스는 10일 하루 수요조사가 예정되어 있다.다음은 다음 주 IPO 일정.상장▲ 아이에스티이, 12일, 공모가 1만1천400원▲ 동방메디컬, 13일, 공모가 1만500원▲ 오름테라퓨틱, 14일, 공모가 2만원일반 청약▲ 모티브링크, 11∼12일, 희망 공모가 5천100∼6천원▲ 엘케이켐, 13∼14일, 희망 공모가 1만8천∼2만1천원▲ 위너스, 13∼14일, 희망 공모가 7천500∼8천500원수요조사▲ 엘케이켐, 10일, 희망 공모가 1만8천∼2만1천원▲ 위너스, 10일, 희망 공모가 7천500∼8천500원▲ 대진첨단소재, 11∼14일, 희망 공모가 1만900∼1만3천원▲ 더즌, 11∼14일, 희망공모가 1만500∼1만2천500원▲ 심플랫폼, 11∼14일, 희망 공모가 1만3천∼1만5천원▲ 엠디바이스, 12∼14일, 희망 공모가 7천200∼8천350원tae@yna.co.kr"
주말에도 맹추위…전국 대부분 영하 10도 아래,https://n.news.naver.com/mnews/article/018/0005939032,이데일리,2025-02-08 08:59:08,"[이데일리 원다연 기자] 이번 주말에도 전국 대부분 지역이 영하 10도 아래로 떨어지며 강추위가 이어지겠다.8일 기상청에 따르면 중부지방과 전북 동부, 경상권 내륙에 한파특보가 발효된 가운데 이날 전국 대부분 지역의 아침 기온이 영하 10도 이하에 머물겠다.특히 중부내륙과 전북 동부, 경북 북부는 영하 15도에서 영하 20도까지 떨어지겠다. 바람도 강하게 불어 체감온도는 3~5도가량 더 낮겠다.9일까지 낮 기온도 전국 대부분 지역에서 0도 이하로 낮겠고, 바람도 강하게 불면서 체감온도는 더욱 낮아 매우 춥겠다.10일까지 아침 기온이 전국 대부분 지역에서 영하 10도 이하(중부내륙과 전북 동부, 경북북부은 영하 15도 이하)에 머물겠으니 건강 관리에 유의하는 게 좋다.8일 낮 최고기온은 -4~3도다.9일 아침 최저기온은 -15~-3도, 낮 최고기온은 2∼6도가 되겠다.대부분 해상에 풍랑특보가 발효된 가운데 10일 오전까지 바람이 30~70km/h(9~20m/s)로 매우 강하게 불고, 물결이 1.5~4.0m로 매우 높게 일겠으니, 항해나 조업하는 선박은 각별히 유의할 필요가 있다.9일까지 전라권 서부에 눈이, 제주도에는 비나 눈이 내리겠다. 전북 남부 내륙과 전남권 서부 내륙은 8일 오후에 대부분 눈이 그치겠으나, 전라 서해안은 9일 오전까지 이어지는 곳이 있겠다.8~9일 예상 적설량은 충남 서해안 1㎝ 내외, 전북 서해안·광주·전남 서부·울릉도·독도·제주도 3~8㎝, 전북 남부 내륙 1~5㎝ 등이다. 같은 기간 예상 강수량 충남 서해안 1㎜ 내외, 대전·충남내륙 1㎜ 미만, 전북 서해안·남부 내륙·광주·전남 서부·울릉도·독도 5㎜ 미만, 제주도 5~10㎜ 등이다.7일 서울광장 스케이트장에서 시민과 관광객들이 즐거운 시간을 보내고 있다. (사진=연합뉴스)"
"'파산 위기' 니콜라, 주가 41% 급락…44센트대 '처참'",https://n.news.naver.com/mnews/article/008/0005150439,머니투데이,2025-02-08 08:57:47,"수소트럭 제조사 니콜라가 파산 신청을 앞둔 것으로 알려지며 7일(현지 시각) 주가가 급락했다. /사진=야후 파이낸스 갈무리'제2의 테슬라'로 주목받던 수소 트럭 제조사 니콜라가 파산 신청을 앞둔 것으로 알려지며 주가가 44센트대까지 급락했다.7일(현지 시각) 뉴욕증시에서 니콜라는 주가가 41% 급락해 44센트대를 기록했다.이는 전날 월스트리트저널(WSJ)이 니콜라가 머지않아 법원에 파산보호를 신청할 예정이라고 보도했기 때문으로 풀이된다.WSJ에 따르면 니콜라는 로펌 필스버리의 자문을 받아 회사를 매각 또는 구조조정하는 방안을 모색 중이며 파산 보호 신청서를 제출할 예정이다.니콜라는 수소 트럭 기술을 앞세워 '제2의 테슬라'로 불리며 2020년 뉴욕 증시에 상장했다. 그러나 같은 해 9월 공매도 투자 기업 힌덴버그 리서치가 니콜라의 홍보 동영상 속 수소 트럭 주행 장면을 두고 ""실제 가동이 아닌 내리막길에서 아래로 굴러내려 가는 장면을 찍은 것""이라며 허위 기술임을 폭로했다.이후 니콜라 창립자 트레버 밀턴 전 CEO(최고경영자)는 2022년 사기 혐의로 징역 4년을 선고받았다. 지난해 3분기 기준 한때 2000달러를 기록했던 주가도 1달러 아래로 떨어진 바 있다."
끝나지 않은 美 관세 전쟁…방산·AI 소프트웨어 눈 여겨봐야[다음 주 증시 전망],https://n.news.naver.com/mnews/article/011/0004448192,서울경제,2025-02-08 08:57:08,"다음 주 코스피 2450~2580P 예상트럼프 대통령, 내주 관세 부과 예고""美 통상 정책 영향 적은 업종 추천""AI 여전히 긍정적···소프트웨어 주목7일 서울 중구 하나은행 본점 딜링룸 현황판에 코스피 지수와 원·달러 환율이 표시돼 있다. 이날 코스피 지수는 전 거래일보다 14.83포인트(0.58%) 내린 2521.92로 마감했다. 연합뉴스[서울경제]미국발 관세 전쟁 우려가 아직 완전히 해소되지 않은 가운데 시장 전문가들은 다음 주 미국 통상 정책 영향에서 상대적으로 자유로운 업종을 주목하라고 조언했다. 구체적으로는 정보통신(IT)·자동차·2차전지 업종보다는 방산·조선·바이오·엔터 등을 눈여겨보라고 설명했다. 최근 중국 ‘DeepSeek(딥시크)’ 이슈와 오픈AI 창립자 샘 올트먼과의 협력 소식이 전해지며 주가가 상승 중인 국내 인공지능(AI) 소프트웨어 관련주도 다음 주 좋은 흐름을 이어갈 가능성이 크다는 진단이다.8일 한국거래소에 따르면 지난주 한 주(3~7일) 코스피 지수는 지난달 31일 종가(2517.37포인트) 대비 0.18%(4.55포인트) 오른 2521.92에 거래를 마쳤다. 코스닥 지수는 31일 종가(728.29) 대비 14.61포인트(2.01%) 오른 742.90에 장을 마감했다.코스피와 코스닥 지수 모두 지난주 첫 거래일 도널드 트럼프 미국 대통령이 캐나다와 멕시코, 중국 등 교역국의 관세 부과 조치를 본격화하며 큰 폭으로 하락했다. 하지만 이후 트럼프 대통령이 캐나다와 멕시코의 관세 부과 조치를 한 달간 유예한다고 밝히자 국내 증시는 반등했다.지난주 국내 증시에서는 외국인 투자가들의 매도 행렬이 이어졌다. 외국인은 지난주 한 주 코스피 시장에서만 주식 현물 6122억 원어치를 팔아 치웠다. 외국인은 지난주 한 주간 주식 선물도 1682억 원어치 순매도했다. 기관 투자가 역시 코스피 시장에서 주식 현물 2648억 원어치를 팔아치웠다. 개인 투자자들이 홀로 주식 현물 3600억 원어치를 순매수하며 지수 추가 하락을 막았다.코스닥 시장에서는 반대 흐름이 나타났다. 외국인은 지난주 한 주 코스닥 시장에서 주식 현물과 선물 각각 3018억 원어치와 1851억 원어치를 순매수했다. 반면 개인과 기관은 각각 코스닥 주식 현물 1483억 원어치와 473억 원어치를 순매도한 것으로 집계됐다.시장 전문가들은 미국발 관세 전쟁 우려가 완전히 해소된 게 아니라며 다음 주 국내 증시는 박스권 흐름을 보일 가능성이 크다고 전망했다. 실제 트럼프 대통령은 7일(현지 시간) 백악관에서 진행된 이시바 시게루 일본 총리와의 미일 정상회담에서 다음 주 다수 국가에 대한 상호 관세 부과를 실시하겠다고 예고했다.미중 갈등 심화 우려도 남아있다. 나정환 NH투자증권 연구원은 “트럼프 대통령의 관세 부과가 유예되긴 했으나 아직 시진핑 중국 주석과의 트럼프 대통령 간 통화도 진행되지 않았다”며 “통화 이후 결과에 따라 주식 시장 방향성이 결정될 것”이라고 설명했다. NH투자증권은 그러면서 다음 주 코스피 지수가 2450~2580포인트 선에서 움직일 것으로 예상했다.시장 전문가들은 당분간 미국 통상 정책에 따른 불확실성이 계속될 것으로 내다보며 이에 무관한 기업에 투자할 것을 권고했다. 구체적으로는 최근 북대서양조약기구(NATO·나토) 회원국들에 대한 트럼프 대통령의 방위비 인상 압박으로 주가 상승세를 보이고 있는 방산과 트럼프 대표 수혜주로 분류되는 조선 업종을 꼽았다. 아울러 바이오와 엔터 업종도 눈 여겨보라고 조언했다. 신승진 삼성증권 연구원은 “이번 실적 시즌의 승자는 해외 매출 비중이 높고 미국 통상 우려와 무관한 기업들”이라고 강조했다.시장 전문가들은 아울러 AI 소프트웨어 투자 전망도 긍정적이라고 밝혔다. 최근 국내 AI 소프트웨어 관련주는 지난 달 트럼프 대통령의 ‘스타게이트 프로젝트’ 발표와 함께 최근 샘 올트먼 오픈AI 최고경영자(CEO) 방한으로 미국 거대 기술 기업(빅테크)과의 협력 기대가 커지며 주가가 오름세를 보이고 있다. 실제카카오(035720)주가는 지난주 한 주 동안 16.04% 상승했다. 신 연구원은 “중국 딥시크 추격을 뿌리치고 AI 기술 패권을 유지하기 위한 한·미·일 3자 동맹에 우리 기업들의 본격적인 협력이 나올 것으로 기대한다”고 밝혔다."
"""드디어 그가 돌아왔다""…네이버 개미들 '환호' 터진 이유 [종목+]",https://n.news.naver.com/mnews/article/015/0005091456,한국경제,2025-02-08 08:33:10,"작년 매출 10조 돌파…플랫폼사 첫 사례이해진의 컴백…직접 'AI 지휘봉' 쥔다사진=한경DB""해진이 형이 돌아왔다. 인공지능(AI)으로 '제2 창업' 보여주길."" (네이버 종목토론방에 한 누리꾼이 올린 글)공개석상에 나서길 꺼려 '은둔의 경영자'로도 불리는 이해진 네이버 창업자가 7년 만에 이사회 의장으로 돌아오자 개인 투자자들 기대 심리도 살아나고 있다. 그가 경영 전면에 나서면서 회사의 AI 사업에도 강한 드라이브가 걸릴 전망이어서다.9일 한국거래소에 따르면 직전 거래일인 7일 네이버는 6500원(2.8%) 내린 22만5500원에 장을 끝냈다. 이날은 약세 마감했지만 주가는 6일까지 5거래일 연속 올라 해당 기간 상승폭이 13.73%에 달한다.지난 5일에는 하루 사이 주가가 4.81%나 뛰었다. 이 창업자가 AI 등 미래 사업 강화를 위해 사내 이사로 복귀한다는 소식이 시장에 전해진 날이다. 이날 수급을 보면 개인만 1619억원 팔아치웠고 외국인과 기관은 각각 1065억원과 501억원 매수 우위였다.이어 7일 네이버는 '3월26일로 예정된 주주총회에 이 창업자의 사내이사 선임과 최수연 대표의 사내이사 재선임 안건을 상정하기로 전날 의결했다'고 공시했다. 이 창업자의 복귀가 공식화된 것이다.이 창업자는 2017년 의장 자리에서 내려온 뒤 해외 사업에 몰두해 왔다. 하지만 최근 챗GPT와 딥시크 등 글로벌 AI의 공세가 이어진 가운데 위기감을 느껴 '전면 등판'을 택한 것으로 풀이된다. 이 창업자는 앞서 지난해 서울에서 열린 'AI 서울 정상회의'에 나와 젠슨 황 엔비디아 최고경영자(CEO)와 만나는 등 AI 관련 적극 행보를 보인 바 있다.이 창업자는 특히 '소버린(주권) AI'를 강조해 왔다. 소버린 AI는 자주적으로 AI 서비스를 구축하는 역량을 뜻한다. 딥시크 출현 이후 오픈AI와 파트너십을 선언한 카카오와 같이 오픈소스로 공개된 AI 모델이나 외부 LLM을 활용하려는 곳들이 나오고 있지만, 네이버는 한국어와 한국 문화를 잘 이해하는 '현지화' 전략에 집중하려는 것으로 보인다.주주들은 이 창업자의 의장 복귀를 계기로 AI를 비롯한 주력 사업에 한층 화끈한 드라이브가 걸릴 것으로 기대하고 있다. 1999년 네이버를 창업한 그는 약 20년간 이사회 의장직을 지키며 '네이버 성공 신화'를 이끈 바 있다.사진=뉴스1실적도 기세가 좋다. 네이버는 지난해 연결 매출액이 전년 대비 11% 증가한 10조7377억원, 영업이익은 32.9% 늘어난 1조9793억원으로 잠정 집계됐다고 지난 7일 공시했다.지난해 연 매출 10조원을 넘어서며 일명 '10조 클럽'에 들어선 것이다. 국내 플랫폼사가 '매출 10조원'을 이룬 것은 이번이 첫 사례다.특히 챗GPT 열풍 이후 이용자들이 검색엔진에서 AI 검색으로 '대이동'하는 흐름 가운데에서도 호조를 보였다. 지난해 4분기 서치플랫폼 매출이 전년 동기 대비 14.7% 증가한 1조647억원을 기록하면서다.증권가는 네이버 주가가 꾸준히 힘을 받을 것이라고 예상했다. 매출 비중이 크고 수익성이 좋은 '검색광고'의 성장률이 2023년을 저점으로 상승세를 이어가는 데다, 이 창업주 복귀를 계기로 국내 독보적인 AI 서비스 플랫폼사로서 입지를 더 굳힐 것이란 분석이다.정호윤 한국투자증권 연구원은 ""2021년 한때 구글과 70%포인트가량의 격차가 났던 네이버의 국내 점유율은 이후로 꾸준히 늘면서 지난해 들어 모바일 쪽에선 구글을 앞질렀다""며 ""해외뿐 아니라 국내에서도 장기간 이어져 온 '구글의 독점'이 깨지고 있다""고 밝혔다. 그는 ""그간 네이버가 추진한 블로그·카페 등 자체 콘텐츠 강화, 지도(플레이스)를 중심으로 소비자 실제 수요를 채울 수 있는 검색 콘텐츠를 강화해 온 게 성과를 내고 있다""고 짚었다.우선 네이버는 자체 AI 모델 하이퍼클로바X 고도화에 집중하고 있다. 관건은 수익화와 수출 능력이다. 네이버 앱을 중심으로 한 검색·쇼핑·광고·커뮤니티, 클로바노트·치지직 등 서비스에 자체 개발한 AI 기술을 녹여 수익으로 연결하고, 중동·아세안 지역 등 자체 AI 모델을 못 가진 국가로 수출하는 구조다.이승훈 IBK투자증권 리서치본부장은 ""독보적인 AI 기술력이 미래 가치를 입증해 가고 있다""며 ""국내에선 관련 서비스 플랫폼사로 뚜렷한 입지를 다진 만큼, 이 창업자 복귀를 계기로 주가도 본격 AI 모멘텀을 받을 전망""이라고 내다봤다. 신은정 DB금융투자 연구원은 ""실적이 받쳐주니 주가는 계속 우상향할 것으로 보인다""며 ""회사와 주가가 안정적""이라고 말했다."
"""일주일 새 1조원어치 담았다""…서학개미, 지금이 기회 '줍줍'",https://n.news.naver.com/mnews/article/215/0001197776,한국경제TV,2025-02-08 08:31:37,"딥시크발 충격속 오히려 美 반도체주 '매집'중국의 고효율 AI(인공지능) 딥시크발 충격 속에서도 서학개미들은 AI 관련주 등을 대거 쓸어담은 것으로 나타났다.딥시크 덕에 AI칩 수요가 늘 것이란 기대감이 일면서 딥시크발 충격이 오히려 저가 매수 기회로 작용됐다는 분석이다.8일 한국예탁결제원에 따르면 지난 한 주(1월30일∼2월6일) 기준 국내 투자자가 가장 많이 사들인 외국 주식은 엔비디아와 '디렉시온 데일리 반도체 불 3X ETF(상장지수펀드)'로 집계됐다. 이들에 대한 순매수액은 각각 2억9700만달러와 2억6천만달러.디렉시온 반도체 ETF는 미국 반도체 지수를 3배로 증폭해 추종하는 고위험 상품이다.그 다음으로는 전기차 기업 테슬라(2억1천900만달러), 엔비디아를 2배로 추종하는 펀드인 '그레나이트셰어즈 2.0X 롱 NVDA 데일리 ETF'(1억7천200만달러)순으로 나타났다.엔비디아, 디렉시온 ETF, 그레나이트셰어즈 ETF 등 미국 반도체 관련 3개 종목의 순매수액은 총 7억3천만달러로 한화로는 1조500억원 규모다.딥시크의 등장으로 AI 개발 비용의 대부분을 차지하던 그래픽처리장치(GPU)와 고성능 메모리 등 AI 하드웨어가 '과잉 투자' 상태가 아니냐는 우려가 증폭되면서 관련 반도체종목의 주가가 직격탄을 맞은 충격 속에서도 이들 AI관련 반도체 기업들을 사들인 셈이다.실제, 엔비디아는 지난 달 27일 하루에만 주가가 17% 급락해 시가총액 846조원이 사라졌고, 한국에서도 설 연휴가 끝난 직후인 같은 달 31일 SK하이닉스와 삼성전자 주가가 줄줄이 떨어지며 증시가 하락세를 탔다.특히, 딥시크 파문이 극심했던 지난달 24∼30일에도 국내 투자자들은 엔비디아를 3억1천700만달러(4천614억원) 순매수 결제해 '반도체 낙관론'에 더 무게를 싣는 모습을 보였다.연합뉴스에 따르면, 한동희 SK증권 연구원은 ""딥시크 개발진의 논문을 봐도 AI 성능 향상을 위해 높은 컴퓨팅 파워(전산 자원), 강력한 기반 모델, 거대 강화학습이 필요하다는 점이 부각되는 만큼 종전보다 '스케일링 법칙'(하드웨어 확대의 법칙)이 더 지속될 수 있을 것으로 본다""며 ""최근 메타와 알파벳 등 미국 거대 AI 기업이 밝힌 올해 자본지출(Capex) 전망치가 시장 예상을 웃돈 것도 AI 투자 명분을 강화하는 요인으로 해석한다""고 설명했다.김동원 KB증권 연구원도 ""딥시크와 같은 '가성비 AI'의 출현은 AI 생태계 확장으로 이어져 GPU 수요 기반이 동시에 확장될 수 있다""며 현 딥시크 국면이 오히려 반도체 주식을 저가 매수할 기회가 될 수 있다고 분석했다."
"""딥시크 덕에 줍줍""…서학개미들, 1.5조 앞다퉈 사들인 종목",https://n.news.naver.com/mnews/article/015/0005091453,한국경제,2025-02-08 08:20:14,"'미국 반도체' 줍줍중국 고효율 AI(인공지능) '딥시크'의 시장 충격이 진정 국면으로 접어들면서 서학개미들이 미국 반도체 관련주를 담고 있다. '딥시크 덕에 인공지능(AI) 칩 수요가 늘 것'이란 기대감이 커지면서다.8일 한국예탁결제원에 따르면 지난 한 주(1월30일∼2월6일) 국내 투자자가 가장 많이 사들인 외국 주식은 엔비디아와 '디렉시온 데일리 반도체 불 3X ETF(상장지수펀드)'로 순매수액이 각각 2억9700만달러와 2억6000만달러로 집계됐다. 디렉시온 반도체 ETF는 미국 반도체 지수를 3배로 증폭해 추종하는 고위험 상품이다.순매수액 3위는 전기차 기업 테슬라(2억1900만달러), 4위는 엔비디아를 2배로 추종하는 펀드인 '그레나이트셰어즈 2.0X 롱 NVDA 데일리 ETF'(1억7200만달러)였다.엔비디아, 디렉시온 ETF, 그레나이트셰어즈 ETF 등 미국 반도체 관련 3개 종목의 순매수액은 총 7억3000만달러로 한화로는 1조500억원에 달한다.딥시크는 불과 560만달러(81억원)의 개발비로 '챗GPT o1' 등에 필적하는 최상위 추론 AI의 성능을 구현했다는 사실이 알려지며 지난 달 말 전 세계 AI 업계와 증시에 큰 충격파를 줬다.이 비용은 미국 AI 기업들의 개발비와 비교하면 10분의 1에도 못 미쳐 'AI 개발에는 거액이 필요하다'는 통념을 완전히 뒤집었다. AI 개발 비용의 대부분을 차지하던 그래픽처리장치(GPU)와 고성능 메모리 등 AI 하드웨어가 '과잉 투자' 상태가 아니냐는 우려가 증폭하면서 반도체 종목이 직격탄을 맞았다.그러나 혼란이 수습되면서 정반대의 전망이 빠르게 부상했다. 딥시크가 경제형 AI 보급을 대거 촉진하고 미국 등 타 AI 업계와의 연구개발(R&D) 경쟁을 촉발해 AI 하드웨어 수요가 더 커질 수 있다는 것이다. 딥시크 파문이 극심했던 지난달 24∼30일에도 국내 투자자들은 엔비디아를 3억1700만달러(4614억원) 순매수했다.한편 국내 증시 대기 자금인 투자자예탁금은 최근 한 주 사이 54조∼58조원대를 오르내렸다. 6일 기준 예탁금은 54조6733억원으로 집계됐다.빚을 내 투자하는 '빚투'는 지속적 증가세다. 금융투자협회에 따르면 신용거래융자 잔고는 6일 기준 16조7076억원으로, 1개월 전(15조7021억원)과 비교해 1조55억원 늘었다.여유자금을 묻어주는 대표 '파킹 상품'인 종합자산관리계좌(CMA) 잔고는 6일 88조1895억원으로 1주일 전(87조9925억원)보다 1천970억원 증가했다."
