title,url,press,time,content
‘美상호관세 불확실성 제거’에 코스피 상승 2590선 등락…개인·기관 쌍끌이[투자360],https://n.news.naver.com/mnews/article/016/0002428864,헤럴드경제,2025-02-14 10:03:12,"간밤 美증시 상호관세 발표에도 랠리…외인은 ‘팔자’제약주 동반 강세, 조선주는 하락“업종 순환매 속 저점 높일 것”14일 오전 서울 중구 하나은행 딜링룸 현황판에 코스피 지수 등이 표시되고 있다. 이날 코스피는 2580대에서 상승 출발했다. 오전 9시 2분 기준 코스피 지수는 전 거래일 대비 6.42포인트(0.25%) 오른 2589.59를 나타냈다. [연합][헤럴드경제=유동현 기자] 코스피가 간밤 미국의 상호 관세 계획이 발표되면서 불확실성이 제거되면서 14일 오전 2580대에서 상승 출발했다.이날 오전 9시 52분 기준 코스피 지수는 전 거래일 대비 3.71포인트(0.14%) 오른 2586.88를 나타냈다. 지수는 전장보다 5.03포인트(0.19%) 오른 2588.20으로 출발해 개장 직후 2,594.30까지 오르기도 했다.유가증권시장에서 개인이 1083억원, 기관이 374억원을 순매수하며 지수 상승을 견인 중이다. 외국인은 1535억원의 매도 우위다.이날 서울 외환시장에서 달러 대비 원화 환율은 전 거래일보다 6.0원 내린 1,441.5원으로 장을 시작했다.간밤 뉴욕증시는 도널드 트럼프 미국 대통령의 상호관세 부과 공식 발표를 불확실성 해소로 받아들이며 안도 랠리를 펼쳤다. 다우존스30산업평균지수와 스탠더드앤드푸어스(S&P)500지수가 각각 0.77%, 1.04% 올랐고 한국 증시와 연관성이 높은 나스닥 종합지수는 1.50% 올랐다.트럼프 대통령은 상호관세를 4월 1일까지 검토한 뒤 차등 부과한다고 밝혔는데 이는 우려 대비 양호한 것으로 해석됐다. 미국 1월 생산자물가지수(PPI)는 전월 대비 0.4% 올라 시장 전망치(0.3%)를 상회했으나 상승폭 둔화와 주요 세부 지표의 물가 하락에 물가 우려는 오히려 완화됐다.한지영 키움증권 연구원은 최근 코스피가 연일 상승한 데 따른 부담에 대해 “이제서야 작년 11월 트럼프 당선 직전 수준의 밸류에이션월 복원한 것이기에 그리 부담을 가질 필요는 없다”며 “업종간 상향 평준화하는 순환매 장세가 이어지며 저점을 계속 높여가는 흐름이 유지될 것”이라고 전망했다.삼성전자(1.08%), 삼성바이오로직스(1.02%), 셀트리온(0.17%), NAVER(1.36%) 등이 오르는 가운데 전날 급등했던 현대차(0.48%), 기아(0.42%)는 이날도 소폭의 상승세를 유지 중이다.HD현대중공업(-5.46%), HD한국조선해양(-3.17%), HD현대미포(-3.16%), 삼성중공업(-2.39%) 등은 차익실현이 이뤄지는 모습이다. 태영건설은 작년 흑자 전환 소식에 20% 넘게 급등 중이다.같은 시각 코스닥 지수는 전장 대비 4.61포인트(0.62%) 오른 753.89이다. 지수는 전 거래일 대비 2.80p(0.37%) 오른 752.08로 출발해 상승폭을 키우며 767.09로 장중 연고점을 새로 썼다.코스닥시장에서는 개인이 404억원, 기관이 42억원을 순매수하고 있다. 외국인은 221억원의 매도 우위다.알테오젠(3.91%), HLB(4.04%), 휴젤(6.95%), 리가켐바이오(2.17%), 삼천당제약(1.50%), 파마리서치(2.75%) 등 제약주가 동반 강세다. 레인보우로보틱스(7.51%)의 상승 폭도 크다.에코프로비엠(-2.14%), 에코프로(-0.97%), 엔켐[-1.09%) 등 이차전지주는 약세를 나타냈다."
증시 상승세에 ‘미래에셋 중국 투자 ETF’ 주목,https://n.news.naver.com/mnews/article/014/0005308358,파이낸셜뉴스,2025-02-14 10:02:14,"연초 이후 ‘Global X MSCI China ETF’ 1조원 이상 유입미래에셋자산운용 홍콩 현지 ETF 광고 이미지. 미래에셋자산운용 제공[파이낸셜뉴스] 미래에셋자산운용은 최근 중국 증시가 가파른 성장을 보이면서 국내외 상장된 미래에셋의 중국 투자 상장지수펀드(ETF) 매수세가 강화되고 있다고 14일 밝혔다.지난 13일 기준 홍콩에 상장된 ‘Global X MSCI China ETF’는 연초 이후 1조1700억원이 유입됐다. 약 2개월간 1조원 이상이 몰리며, 순자산 규모는 1조5000억원을 넘어섰다. 중국 본토 대형주 전반에 투자하는 ‘Global X MSCI China ETF’는 최근 1개월 16.25%, 6개월 25.58%, 1년 40.51% 등 우수한 수익률을 기록 중이다.국내 상장된 'TIGER 중국 투자 ETF'도 부진했던 주가가 반등세를 보이고 있다. 한국거래소에 따르면 중국 신성장 산업 대표 혁신기업인 항셍테크 기업에 투자하는 ‘TIGER 차이나항셍테크 ETF’는 13일 기준 1개월 수익률 22.93%를 기록했다. 항셍테크 기업들은 높은 매출 성장과 적극적인 연구개발(R&D) 투자를 바탕으로 빠르게 변화하는 중국 첨단산업 트렌드를 선도하고 있다. 같은 기간 ‘TIGER 차이나HSCEI ETF’ 16.22%, ‘TIGER 차이나전기차SOLACTIVE ETF’ 10.18%, ‘TIGER 차이나반도체FACTSET ETF’ 8.66% 등으로 안정적인 흐름을 이어가고 있다.최근 중국은 인공지능(AI) 모델인 딥시크와 휴머노이드 로봇 ‘G1’ 등을 선보이며 테크 분야에서 강한 경쟁력을 입증했다. 기술주 랠리에 힙입어 연초 이후 MSCI 차이나 지수는 9.4% 상승하며 반등을 이어가고 있다. 특히 1% 내외로 소폭 상승한 타 신흥국 증시와 대조적인 흐름을 보이면서 눈길을 끌고 있다.미래에셋자산운용은 경쟁력 있는 중국 시장에 선제적인 투자를 이어가고 있다. 2003년 국내 운용사 최초로 홍콩에 첫 해외법인을 설립하며 글로벌 시장에 진출했고, 이후 적극적인 현지 세일즈를 통해 전문성을 키워왔다. 2023년에는 국내 자산운용사 최초로 'ETF Connect'를 통해 중국 본토 ETF 시장에 진출하는 성과를 거두는 등 중국 시장에서의 유의미한 성과를 만들어가고 있다.미래에셋자산운용 혁신글로벌경영부문 대표 김영환 사장은 ""미래에셋자산운용은 한국을 넘어 미국, 중국 등 글로벌 시장에서 다양한 투자 기회를 모색하며 제공하는데 차별화된 역량을 보유하고 있다”며 “앞으로도 세계 각지의 새로운 기회를 발굴하는데 앞장서고 고객들의 장기적인 수익률을 제고를 위해 더욱 노력하겠다""고 말했다."
오름테라퓨틱 상장 첫날 40%대 강세 [증시이슈],https://n.news.naver.com/mnews/article/243/0000072728,이코노미스트,2025-02-14 10:01:10,"한국거래소 코스닥시장본부는 14일 오전9시 서울사옥 홍보관에서 항체 약물 집합체 플랫폼을 기반으로 항암제 중심의 신약개발 사업을 영위하는 오름테라퓨틱의 코스닥시장 상장기념식을 개최했다. [사진 한국거래소][이코노미스트 이승훈 기자] 바이오테크 기업 오름테라퓨틱이 코스닥 상장 첫날인 14일 장 초반 강세다.이날 오전 9시 49분 기준 오름테라퓨틱은 공모가(2만원) 대비 26.75%(5350원) 오른 2만5350원에 거래되고 있다. 장중 9950원(49.75%) 오른 2만9950원에 거래되기도 했다.오름테라퓨틱은 지난해 11월 상장 절차를 자진 철회했다가, 공모가를 낮춘 후 절차를 재개했다오름테라퓨틱은 지난달 17일부터 23일까지 진행한 기관투자자 대상 수요예측에서 16.93대 1의 경쟁률을 기록했다. 국내외 기관 371개사가 참여했다. 공모가는 희망 범위(2만4000원~3만원) 하단보다 약 16.7% 낮은 2만원으로 확정했다.2016년 설립된 오름테라퓨틱은 이중 정밀 표적 단백질 분해 기술을 통해 암 치료법을 개발하고 있다. 회사는 대전과 미국 보스턴에 각각 연구소를 두고 표적 단백질 분해제(TPD) 기반 신약 파이프라인을 개발 중이다. 2023년과 지난해 글로벌 제약사 브리스톨마이어스스큅(BMS)과 버텍스파마슈티컬스에 잇달아 기술을 수출하며 주목받았다.이승주 대표는 “TPD의 기능과 항체의 정밀성을 결합해 전 세계 환자를 위한 차별화된 치료제를 계속 개발할 것”이라며 “혈액암 치료제와 소세포폐암 치료제 등 파이프라인 3개에 대한 추가 기술수출을 통해 2026년 매출 930억원을 달성하는 게 목표”라고 말했다."
"코스피, 2,600선 회복 '타진'…개인·기관 매수세 확대",https://n.news.naver.com/mnews/article/215/0001198504,한국경제TV,2025-02-14 09:58:00,"코스피가 오름세다.관세를 둘러싼 우려 완화에 더해 개별종목을 중심으로 한 모멘텀 등이 맞물리면서 상승폭 확대를 시도 중이다. 다만 조선주 등을 중심으로 일부 차익실현 물량이 쏟아지고 있는 점 등은 지수의 하방압력을 작용하는 모습이다.14일 오전 10시2분 현재 코스피지수는 전거래일대비 10.59포인트(0.41%) 오른 2,593.76을 기록중이다.기관이 1,000억원, 개인이 140억원 가량 매수우위다.외국인은 1,200억원 순매도.시가총액 상위종목별로는 삼성전자(2.15%), 삼성바이오로직스(1.27%), 현대모비스(2.67%) 등이 강세다. 원전 관련주도 강세다.반면, HD현대중공업(-6.83%),한화오션(-2.19%) 등은 차익실현 물량이 쏟아지면서 약세다.같은 시각 현재 코스닥지수는 전거래일대비 4.98포인트(0.66%) 오른 754.26을 기록중이다."
"트럼프, 자동차 관세 부과 재확인…2차전지주 약세[핫종목]",https://n.news.naver.com/mnews/article/421/0008076290,뉴스1,2025-02-14 09:56:59,"에코프로비엠 3%대 하락도널드 트럼프 미국 대통령이 13일(현지시간) 워싱턴 D.C. 백악관 집무실에서 상호관세 부과에 대한 행정명령에 서명하고 있다. 2025.2.14. ⓒ 로이터=뉴스1 ⓒ News1 이창규 기자(서울=뉴스1) 박현영 블록체인전문기자 = 도널드 트럼프 미국 대통령이 자동차에 대한 관세 부과를 재확인하면서 2차전지주가 약세다.앞서 미국의 상호관세 부과 대상에서 자동차가 제외될 수 있다는 전망에 2차전지주들이 상승 흐름을 탔지만, 13일(현지시간) 트럼프 대통령은 ""자동차 관세도 곧 발표하게 될 것""이라며 관세 부과 계획을 재확인했다.14일 오전 9시 47분 LG에너지솔루션(373220)은 전거래일 대비 1.54%(5500원) 떨어진 35만2500원을 기록하고 있다. 또 포스코홀딩스(005490)는 전거래일 대비 0.61%(1500원) 하락한 24만5000원이다.2차전지 대장주인 에코프로비엠(247540)은 전거래일 대비 3.13%(4100원) 하락한 12만7000원에, 에코프로(086520)는 전거래일 대비 1.62%(1000원) 내린 6만900원에 거래되고 있다.트럼프 대통령은 예고한대로 13일(현지시간) 상호 관세 조치를 발표했다. 4월 1일까지 국가별 검토를 거쳐 차등 부과한다고 밝히며 협상의 여지는 남겼다.단, 자유무역협정(FTA)을 체결한 한국에도 비관세 장벽 등을 문제삼아 상호관세를 부과할 수 있다는 우려가 나온다. 또 트럼프 대통령은 자동차, 의약품에 대한 관세도 예고한대로 곧 발표할 것이며, 비슷한 시기에 부과할 예정이라고 밝혔다."
"한미약품그룹 장남 임종윤, 북경한미 동사장 선임",https://n.news.naver.com/mnews/article/015/0005094179,한국경제,2025-02-14 09:55:11,"최혁 기자한미약품 창업주 장남인 임종윤 코리그룹 회장이 북경한미약품유한공사 동사장으로 선임됐다.14일 코리그룹에 따르면 북경한미는 최근 동사회를 개최하고 임종윤 회장을 동사장으로, 북경한미약품의 권용남 경영지원부 고급총감 및 서영 연구개발센터 책임자와 이선로 코리 이태리 대표를 신규 동사로 각각 임명하고 등기작업을 완료했다.1년 넘게 끌고 온 한미약품의 경영권 분쟁의 종료와 함께 임종윤 동사장이 북경한미약품을 맡게 된 것이다. 앞서 2005년부터 북경한미 동사장을 맡았을 당시 임 동사장은 회사의 이익률을 20% 이상으로 끌어 올린 경험이 있다. 20개에 달하는 의약품 임상 개발 및 허가를 완료하고 의약품 허가 품목당 평균 5~7년이 소요되는 중국에서 정장 소화제인 마미아이 등 시장 넘버원 제품 4개를 만들어내면서다.임 동사장과 함께 북경한미 동사회에 진입한 권용남 총감은 2006년 한미헬스케어를 시작으로 2008년부터 현재까지 북경한미 재무와 구매 등 내부살림을 책임져오고 있다.서영 책임자는 1989년 중국 의학과학원 연구원을 거쳐 북경한미와 룬메이킹에서 연구 개발부터 현재 베이징코리과학기술 연구개발센터 책임자를 맡고 있다.이선로 코리 이태리 대표는 지난 1999년 한미약품 영업부에 입사해 북경한미 기획부와 경영기획실 실장을 역임했다.북경한미는 1996년 한미약품과 중국 국경기업인 화륜자죽약업이 함께 설립했다."
"씨아이에스, 전기차 캐즘에도 사상 최대 실적…영업익 52% 증가",https://n.news.naver.com/mnews/article/011/0004450517,서울경제,2025-02-14 09:55:09,"하이브리드 코터 출시 등기술혁신으로 우위 점해김동진 씨아이에스 대표. 사진제공=씨아이에스[서울경제]2차전지 장비 업체씨아이에스(222080)가 전기차 캐즘(일시적 수요 정체) 와중에도 지난해 사상 최대 실적을 경신했다.14일 씨아이에스에 따르면 이 회사의 2024년 매출액과 영업이익은 5085억 원, 593억 원으로 전년 대비 각각 64%, 52% 증가했다. 매출액과 영업이익 모두 창사 이래 최대 실적에 해당하는 수치다.이 같은 호실적은 신개념 전극 공정 장비 개발과 차세대 배터리 소재 기술 확보를 통해 갖춘 경쟁력과 시장 대응력이 주효했다는 평가다. 씨아이에스는 신개념 전극공정 장비인 '하이브리드 건조 코터'를 출시하며 기술 혁신을 이어가고 있다. 해당 장비에는 레이저 건조 기술을 접목해 생산 속도를 기존 대비 두 배로 높이고 소비 전력을 절반 가까이 절감할 수 있는 획기적인 기술이 탑재됐다.차세대 배터리 기술인 전고체 배터리 소재 및 장비 시장에도 적극 진출하고 있다. 최근 일본과 유럽의 유명 자동차 제조사 및 북미 에너지 기업과 전고체 배터리 관련 비밀유지계약(NDA)을 체결하며 글로벌 시장에서 기술력을 인정받았다. 아울러 고체전해질 대량 양산을 위한 시범생산 라인을 구축하고 연속식 생산 시스템을 도입해 차세대 배터리 시장 선점을 위한 사업 역량을 강화하고 있다.지난해 12월에는 디스플레이 및 반도체 검사·측정장비 전문기업 에스엔유프리시젼과의 합병을 완료하며 사업 다각화에 나섰다. 이를 통해 디스플레이, 반도체 등 다양한 분야로 사업 영역을 확장하고 기존 사업과의 시너지를 극대화할 계획이다. 특히 피합병회사의 정밀측정 기술을 코터, 캘린더 등 2차전지 전극 장비에 접목해 성능 고도화를 추진하고 있으며 반도체·디스플레이향 증착기 사업을 확대하겠다는 구상이다.김동진 씨아이에스 대표는 ""씨아이에스는 글로벌 2차전지 장비 시장을 선도하고 있지만, 이에 만족하지 않고 신개념 장비 개발과 차세대 전지 기술 확보를 통해 차별화된 경쟁 우위를 선점하겠다""며 ""인수·합병 등을 통해 사업 포트폴리오를 다각화하고, 글로벌 경영 리스크에 대비해 다각화된 사업 전략과 안정적인 재무관리를 통해 지속 가능한 성장을 도모하겠다""고 밝혔다."
"치솟는 금값에 개미 우르르…한투운용 금 ETF, 순자산액 1조 돌파",https://n.news.naver.com/mnews/article/009/0005443722,매일경제,2025-02-14 09:52:08,"[사진 = 한국투자신탁운용]한국투자신탁운용은 ‘ACE KRX금현물 상장지수펀드(ETF)’의 순자산액이 1조원을 돌파했다고 14일 밝혔다.한국거래소에 따르면 ACE KRX금현물 ETF의 순자산액은 전날 종가 기준 1조42억원을 기록하며 1조원을 처음 돌파했다.이는 지난해 말(6228억원) 대비 61.24% 증가한 수치다.ACE KRX금현물 ETF는 한국투자신탁운용이 지난 2021년 국내 자산운용사 중 최초로 선보인 금 현물 투자형 ETF이다. 현재도 금 현물형에 투자하는 ETF 상품은 ACE KRX금현물 ETF가 유일하다.이 ETF의 순자산액 증가는 개인투자자 순매수 덕분으로 풀이된다. 개인투자자는 올 들어 1거래일도 빠지지 않고 ACE KRX금현물 ETF를 순매수했다. 지난 1월 2일 이후 누적된 개인투자자 순매수액은 1058억원에 달한다.특히 지난 12일에는 개인투자자 자금 120억원이 유입되며 국내 상장된 944개 ETF 중 개인순매수 1위를 차지했다. 이는 ACE KRX금현물 ETF가 상장 이후 기록한 일별 개인순매수 최대치다.도널드 트럼프 미국 대통령 취임 이후 국제 금 가격이 급등하면서 ACE KRX금현물 ETF의 성과도 우수하다. ACE KRX금현물 ETF는 올 들어 27.24%의 수익률을 기록했다.ACE KRX금현물 ETF의 수익률이 같은 기간 국제 금 가격 상승률(1트로이온스 기준, 11.53%)보다 높은 건 환노출형으로 설계돼 달러 상승에 따른 수혜도 함께 누리기 때문이다. ACE KRX금현물 ETF의 최근 1년과 3년 수익률은 각각 86.67%와 124.27%로 나타났다.남용수 한국투자신탁운용 ETF운용본부장은 “ACE KRX금현물 ETF는 퇴직연금 계좌에서도 투자 가능한 국내 유일 금 ETF”라며 “트럼프 정책에 따른 불확실성이나 미국 재정적자에 대한 우려로 주식시장 변동성이 심화할 수 있는 만큼 자산배분 차원에서 ACE KRX금현물 ETF를 투자하면 좋을 것”이라고 말했다."
트럼프發 관세 불확실성 완화…환율 5.5원 내린 1442원 출발,https://n.news.naver.com/mnews/article/421/0008076240,뉴스1,2025-02-14 09:42:32,"4월 1일까지 관세 부과 유예…나라별 협상 가능성도 열어놔러-우전쟁 종전 기대도 높아져…""단기 변동성엔 유의해야""도널드 트럼프 미국 대통령이 '상호관세'를 부과하는 대통령 각서에 서명한 가운데 14일 오전 서울 중구 하나은행 본점 딜링룸 전광판에 코스피 지수가 2,590 포인트를 나타내고 있다. 트럼프 대통령은 상대국의 관세는 물론 비관세 장벽을 두루 검토해 관세율을 도출할 것이라고 밝혔다. 2025.2.14/뉴스1 ⓒ News1 신웅수 기자(서울=뉴스1) 박동해 기자 = 도널드 트럼프 미국 대통령이 세계 각국에 대한 상호 관세 부과와 관련해 구체적인 시간표를 제시함에 따라 국제적 불확실성이 완화되고 달러화가 약세를 보였다. 이에 국내 외환시장에서도 달러·원 환율이 하락 출발했다.14일 하나은행에 따르면 이날 달러·원 환율은 종가 기준 전 거래일인 1447.5원 대비 5.5원 내린 1442.0원에 출발했다. 장 초반인 오전 9시 20분 기준 1442원대에서 거래 중이다.앞서 13일(현지시간) 미국의 생산자물가지수(PPI)가 전월보다 0.4% 상승하며 시장 기대치를 상회했지만, 직전 월보다 상승이 둔화되면서 달러가 순간적으로 상승하는 데 그쳤다.이후 트럼프 대통령이 '상호 무역 및 관세에 관한 각서'에 서명하고 관세 부과에 대한 실행 계획을 내놓으면서 달러는 약세를 보였다.백악관이 4월 1일까지 세계 각국과의 무역관계를 살펴보고 최종적으로 관세 수준을 결정하겠다고 밝힘에 따라 그동안 쌓여 있던 불확실성이 다소 해소됐기 때문이다.또 트럼프 정부가 관세와 관련해 두달간의 유예 기간을 두고 각국과의 협상 가능성을 열어둔 것도 긍정적 신호로 작용했다.더불어 이날 트럼프 대통령이 기자회견을 통해 우크라이나 전쟁에 대한 종전 의지를 다시 한번 밝히면서 종전에 대한 기대감이 더욱 높아졌다. 종전에 대한 기대는 유가 하락과 달러 약세로 이어졌다.민경원 우리은행 연구원은 ""트럼프는 상호 관세에 서명했으나 실행까지 약 두달 정도 유예 기간을 두면서 협상의 여지를 열어 두었다는 평가를 받는다""라며 ""달러·원은 우크라이나 전쟁 휴전 기대, 상호 관세 실행 유보에 따른 위험 선호 회복을 쫓아 하락이 예상된다""라고 말했다. 민 연구원은 이날 달러·원 환율이 최저 1433원대까지 내려갈 수 있다고 전망했다.위재현 NH선물 연구원은 ""미국의 관세 부과 연기 소식은 위험 선호 심리를 자극했다""며 ""여기에 더해 PPI가 인플레이션 재발 우려를 잠재우며 시장 내 위험 선호 심리가 크게 회복됐다""고 짚었다. 이에 위 연구원은 ""금일 달러·원은 회복된 위험 선호 흐름을 좇아 1440원 초반까지 하락을 시도할 전망""이라고 내다봤다.한편, 트럼프 정부의 관세 부과에 대해 아직 안심할 때가 아니며 긴장감을 늦춰선 안 된다는 분석도 있었다.이주원 대신증권 연구원은 ""환율의 경우 관세 관련 소식에 따른 변동성이 취임 직후보다는 다소 완만해진 모습""이라면서도 ""트럼프가 내세운 정책 시행을 위한 재정 확보 측면에서 관세를 강화할 가능성을 여전히 배제할 수 없다""고 경고했다.이 연구원은 ""실제로 관세를 부과해 단기적인 변동성이 다시 확대되지는 않을지 관련 소식은 계속해서 경계해야 할 것""이라고 덧붙였다."
"대진첨단소재 필리핀법인, 다국적 기업 ‘다이슨’ 성장 수혜",https://n.news.naver.com/mnews/article/277/0005546572,아시아경제,2025-02-14 09:38:33,"코스닥 상장을 추진하고 있는 대진첨단소재가 다국적 기업 다이슨의 필리핀 생산시설 확장에 따른 수혜를 받고 있다고 전했다.이차 전지 공정 내 화재 및 대전 방지 선도 기업 대진첨단소재(유성준 대표이사)가 필리핀 글로벌 제조사 다이슨(Dyson)으로부터 대규모 수주를 받았다고 14일 공식 밝혔다.대진첨단소재 회사 관계자는 “다이슨(Dyson)과 협력해 청소기 및 헤어미용기 부품 등 약 144만개를 수주받았다”며 “현재 필리핀 법인은 다이슨 외 글로벌 첨단 제조사들로부터 혁신적 생산역량과 품질경쟁력을 인정받아 수주가 급증하고 있다”고 전했다.대진첨단소재 필리핀법인은 FPIP(First Philippine Industrial Park)에 위치하며, 다이슨 공장과 차로 20분 거리에 있다. 이외에도 삼성전기와도 인접해 있어, 향후 대진첨단소재가 글로벌 IT 산업까지 사업을 확장할 무한한 가능성과 역할이 기대된다.실제로 대진첨단소재 필리핀법인은 PEZA(Philippine Economic Zone Authority)를 기반으로 다국적 제조사로부터 잇단 러브콜을 받고 있는 가운데 현재 델(Dell), 모토로라(Motorola), 다이슨(Dyson) 등 글로벌 기업을 주요 고객사로 두고 있다.특히 사출, 도장라인, 자체 금형 제작능력을 보유해 전자제품 및 자동차 부품사로부터 우수한 품질과 생산성을 인정받고 있다. 정밀 사출 및 고급 페인팅 기술을 바탕으로 모토로라의 무전기 사출 부품 및 후가공, 델(Dell)과 HP 노트북용 쿨링 모듈에 대한 레이저 커팅 및 페인트 작업을 수행하고 있다. 올해만 약 120만개의 물량을 수주하며 글로벌 시장에서 입지를 확대하고 있다.이번 대규모 수주를 체결한 다이슨은 싱가포르에 본사를 두고 있으며, 필리핀 바탕가스 산토 토마스 공장에 110억 페소(약 3000억원)를 투자해 첨단 기술 제조 센터를 건설해 2024년부터 본격 가동을 시작했다. 해당 공장은 AI 및 로봇공학 연구개발(R&D)에 집중하며 400명의 엔지니어를 채용하는 등 역대 최대 규모의 투자공장으로, 필리핀의 제조업 경쟁력을 입증시키고 있으며 설립 당시부터 진출해 있던 대진첨단소재는 최대 수혜기업으로 낙점받고 있다.유성준 대진첨단소재 대표이사는 “당사는 맞춤형 설계 역량, 양산공정 수직 체계, 글로벌 생산기지 등 3요소를 다 갖춘 회사로 글로벌 거점별 입지확대 및 제품고도화로 다국적 기업과의 협업을 강화해 입지를 확대해 나갈 것”이라며 “더 나아가 성공적인 코스닥 상장을 통해 북미 생산시설을 확장하고, CNT 도전재 시장에 본격 진출함으로써 한 단계 더 도약하고자 한다”고 전했다.한편 대진첨단소재의 총 공모주식 수는 300만주로, 희망 공모가 밴드는 1만900~1만3000원이며, 총 공모예정금액은 약 327억~390억원이다. 지난 11일부터 시작된 수요예측은 오는 17일까지 마무리될 예정이며 오는 20일부터 21일까지 청약을 거쳐, 다음달 6일 코스닥 시장에 입성할 예정이다. 상장주간사는 미래에셋증권이다."
