title,url,press,time,content
中 딥시크·美 관세전쟁도 영향없다…‘OO 비상사태’ 선언이 더 중요하다고? [홍키자의 빅테크],https://n.news.naver.com/mnews/article/009/0005440646,매일경제,2025-02-08 21:56:13,"중국의 인공지능(AI) 서비스 딥시크 충격에도, 트럼프 미국 대통령의 관세 전쟁 선언에도 굳건한 섹터가 있습니다.어떤 외풍에도 변하지 않는 단 하나의 유망 섹터, 바로 ‘에너지’ 섹터입니다.트럼프 대통령은 지난달 취임식에서 에너지 비상사태를 선포하고, 각종 행정명령에 서명했습니다. “에너지 가격 상승에 따른 인플레이션을 막기 위해 ‘국가 에너지 비상사태’를 선포하겠다”고 말했죠.취임식에서 취임사를 발표하는 트럼프 미국 대통령.미국 연방정부가 ‘에너지 비상사태’를 발동하기는 이번이 처음입니다.앞으로는 의회의 동의를 구하지 않고도 행정부가 주도해서 화석연료 중심의 각종 에너지 정책을 추진하겠다는 것입니다. 비정상적인 에너지 가격을 낮추고, 전 세계의 에너지 패권을 움켜쥐겠다는 선언입니다. 트럼프 1기 당시에도 탈퇴했던 파리 기후협정 재탈퇴 행정명령에도 다시 서명했습니다.취임 이후 열흘 동안 중국의 딥시크발 급등락이 반복된 불안정한 증시 상황에서도 에너지 기업의 주가는 오히려 올랐습니다. 오늘은 ‘에너지 비상사태’의 의미를 좀 더 파헤쳐보겠습니다.에너지는 곧 안보...‘국가 에너지 자립’에 사활스타게이트 프로젝트를 발표하는 트럼프 대통령 옆으로 손정의 소프트뱅크 회장(왼쪽부터), 래리 엘리슨 오라클 회장, 샘 올트먼 오픈AI 최고경영자가 서 있다.에너지 비상사태 선언의 핵심은 ‘국가 에너지 자립’입니다.에너지 자립을 하겠다는 이유가 있을 것 아니에요? 에너지 자립을 통해 결국 인공지능(AI) 개발 속도를 끌어올리고, 전 세계서 기술 패권을 확고히 하겠다는 것입니다. 에너지는 곧 AI라는 사실이 명확해진 것이죠.모두가 알고 있는 사실 다시 정리해보면요. 인공지능 구동을 위해선 속도가 빠른 반도체 칩이 필요하고, 그 반도체 칩은 데이터센터를 구축해야 하고, 그 데이터센터는 ‘전기 먹는 하마’다. 그래서 안정적인 전력 수급이 곧 인공지능의 성공과 실패를 좌우한다는 겁니다.지난해부터 투자 좀 한다는 사람들은 모두 들어봤던 이 논리를 미국의 새 대통령이 시대의 과업으로 천명했다고 보면 됩니다.트럼프 2기 취임 첫 주 발표된 핵심 정책들이 하나도 빼지 않고, 모두 AI 인프라의 핵심으로 꼽히는 전력 산업 투자를 확대하는 것입니다.DS투자증권은 “바이든 전 대통령의 AI 산업 규제 행정명령을 폐기하고, 국가 에너지 비상사태를 선포하고, 초대형 AI인프라 프로젝트인 ‘스타게이트’를 발표했습니다. 정부 임기 초반 정책 드라이브의 초점이 AI인프라 전력 사업에 있음을 시사한다”고 설명했습니다.최대 5000억 달러 우리 돈으로는 718조원을 투자할 것이라는 ‘스타게이트’ 프로젝트가 바로 인프라 프로젝트입니다. 텍사스주를 시작으로 미국 전역에 대규모 데이터센터를 짓는 것이죠.데이터센터가 구동하려면 전력 인프라도 바로 따라오는 것이고요. 텍사스주에 뉴욕 센트럴 파크 면적의 데이터센터를 짓는데 태양광 등 재생에너지와 대규모 배터리 시스템이 사용되는 식입니다.“AI 시대에 투자 많이 한다는 것이네” 정도로 이해해서는 안 됩니다.중국 AI 스타트업 딥시크 로고.에너지 투자 확대의 배경에 중국이라는 거대한 국가가 버티고 있기 때문이죠. 미·중 AI 전쟁에서 밀릴 수 있다는 위기감이 도사리고 있다고 봐야 합니다.미국은 중국에 엔비디아의 최첨단 칩 등 반도체가 수출되는 것을 제한하고, 각종 제재안으로 데이터와 프로그램 등 소프트웨어의 수출도 통제해왔습니다. 그런데도 결론은 어떤가요?엔비디아의 저사양 반도체 칩인 ‘H800’ 2048개로 지금의 챗GPT보다 추론과 검색 능력이 더 뛰어난 AI ‘딥시크 RI’를 만들어냈죠. 1957년 당시 소련이 세계 최초의 인공위성 스푸트니크 1호 발사에 성공해 미국인들에게 큰 충격을 준 것과 비견된다는 평가마저 나오는데요.딥시크 창업자 량원펑. <사진=cctv>사실 지난 인류의 5000여년의 역사에서 중국 이외의 국가가 패권을 쥔 적은 별로 없었죠.거의 중국이 전 세계 패권을 쥐고 있었으니까요. 오픈AI의 모델을 무단 이용했는지 여부 등은 차치하고, 미국의 제재를 뚫고 나온 기술 개발이라는 데 의의가 있을 겁니다.원전이 미래다...원전 에너지 ‘비상사태’ 선언의 핵심그중에서 원자력에너지, 원전 섹터가 가장 눈에 띕니다.이번 행정 명령의 핵심은 석유, 석탄, 천연가스 등의 강화도 있지만, 원자력에너지를 이들 화석연료와 동일한 수준으로 중요 에너지로 취급하겠다는게 더 큽니다. 원자력에 대한 중요성을 행정 명령으로 끌어올려 둔 겁니다.30년 만에 미국에서 완공된 원전 보글 3, 4호기. <사진=조지아 전력 홈페이지>원전 섹터는 이미 지난해 초부터 대선 결과와 상관없이 모멘텀이 확대될 핵심 섹터로 분류됐습니다. 원전 관련 정책 강화는 트럼프 1기 행정부에서부터 바이든 정부에 이르기까지 연속적으로 추진돼왔죠.바이든 행정부는 지난해 4분기 신규 원전 건설, 원전 재가동, 기존 시설 업그레이드 등을 통해 2023년 100.6기가와트(GW) 수준인 원전 발전 용량을 2050년까지 300GW 수준으로 만들겠다는 로드맵을 제시했습니다.원전은 이제 트럼프 2기 정부의 에너지 정책을 떠받들 중점 육성 섹터로 꼽힙니다. 크리스 라이트 미국 에너지부 장관도 지난달 지명 이후 취임 청문회에서 “상업용 원자력과 액화천연가스(LNG)를 포함한 에너지 생산을 확대하겠다”고 밝힌 바 있습니다.미국에서 원자력 발전 1위 운영사업자인 콘스텔레이션에너지(CEG)는 최근 한달새 주가가 21% 올라서며 트럼프 2기 원자력 정책 기대감을 반영해왔고, 미국의 독립발전사업자이자 콘스텔레이션에너지의 핵심 경쟁자인 비스트라에너지(VST)도 지난 6개월간 140% 상승하며 꾸준히 우상향했습니다.다만 미국이 지난 30년간 원전 인프라 확충을 등한시했다는 점에서 원자력발전소 등 사업을 영위하는 기업들의 장기 상승세는 좀 두고봐야합니다.콘스텔레이션에너지가 지난해 스리마일섬 원전 1호기의 상업용 가동을 2028년에 재개하겠다고 밝힌 것은 데이터센터에 원전이 중요하다는 것을 인식하는 하나의 이벤트로 봐야 한다는 것이죠.대신에 소형모듈 원전인 SMR 기업으로 눈을 돌리는 게 조금 더 현실적입니다. SMR은 건설 비용이 대형 원전의 5분의 1에 불과하고 건설 시간이 짧아 원자력발전소 신규 확보보다 훨씬 더 빨리 구동할 수 있습니다.이 때문에 아마존웹서비스(AWS)는 지난해 도미니언에너지 등 3곳과 소형 원자로 개발을 위한 계약을 체결했고, 구글도 원전 스타트업 카이로스파워에서 향후 가동할 SMR 에너지를 자신들이 쓰겠다고 구매 계약을 맺은 것입니다.美 에너지부의 전략 에너지 기업은...‘오클로’그중에서도 오클로에 대한 기대감이 큽니다. 오픈AI의 샘 올트먼, 원자력, 미국 에너지부 등 오클로가 관통하는 단어가 많기 때문입니다.샘 올트먼 오픈AI 최고경영자(CEO).이 회사는 지난해 5월 기업인수목적회사 스팩과 합병하는 방식으로 우회 상장해 거래를 시작했습니다. 2013년 매사추세츠공과대학(MIT) 출신인 제이콥 드윗과 캐롤라인 코클란이 설립했죠. 오클로는 대학 캠퍼스 등에 들어설 정도로 규모가 작은 ‘오로라(Aurora)’ SMR을 개발 중입니다.미 증권거래위원회(SEC)에 제출한 서류에서 오클로는 자사를 미국 원자력규제위원회에 설계·건설·운영 등을 모두 포함한 ’맞춤형 통합 자격 신청서(COLA)‘를 성공적으로 제출한 유일한 회사로 소개합니다.오픈AI의 아버지로 불리는 샘 올트먼도 2014년부터 오클로에 투자해 왔습니다. 현재는 오클로 이사회 의장을 맡고 있죠. 올트먼의 오클로 투자 이유는 바로 AI 때문입니다.올트먼은 CNBC와의 2023년 인터뷰에서 “향후 AI 사용은 계속 확장되고 엄청난 양의 에너지를 필요로 한다. 원자력 없이는 그 미래를 달성할 방법이 없고, 원자력은 현존하는 어떤 기술보다 효율적”이라고 밝힌 바 있습니다.오클로가 2027년까지 상용화하겠다고 발표한 15메가와트급 소형모듈형원자로(SMR) ‘오로라’.오클로는 2027년 가동을 목표로 미 아이다호주에 SMR 건설을 추진 중입니다.고순도 저농축 우라늄(HALEU)과 사용 후 핵연료를 모두 쓸 수 있는 연료 시설을 아이다호 국립연구소 내부에 건설해 미국 에너지부의 구 원자로에서 회수된 핵연료를 재처리해 활용할 예정입니다.하지만 여전히 실제 실적은 없습니다. 지난해 1~3분기 오클로의 누적 순손실만 6332만달러에 달합니다. 즉 빅테크들의 SMR 구애와 함께 트럼프 정부의 원전 섹터 중점 육성에 대한 기대감이 뒤섞여 주가 상승을 이뤄냈다고 봐도 되죠.다만, 오클로가 ‘에너지 비상사태’ 구호와 직접 연결되는 기업이라는 게 호재로 작용합니다. 즉, 이미 수년 전부터 미국 정부가 육성하고 있는 대표 원자력 기업이라는 얘기죠.오클로는 미국 에너지부로부터 꾸준히 투자를 받고 있습니다.2021년 에너지부로부터 200만 달러(약 27억원) 규모의 기술사업화 기금을 지원받았고, 2022년에는 에너지부의 첨단 원자료 상용화를 위한 4개 프로젝트 중 한 곳으로 선정돼 82억원 규모의 보조금을 받았죠.지난해 3월에는 원자력 혁신기술 촉진을 목표로 하는 에너지부의 ‘게인(GAIN)’ 프로그램에도 선정됐습니다.크리스 라이트 미국 에너지부 장관이 지난 1월 당시 자신의 장관 지명 청문회에서 발언하고 있다.이번에 임명된 미국 에너지부 장관이 오클로의 이사로 재직하고 있다는 점도 회사에는 호재입니다. 크리스 라이트 장관은 셰일가스 추출을 위한 수압 파쇄법인 프래킹 기업 리버티에너지의 설립자로, 리버티에너지는 오클로의 일부 지분을 보유했습니다.그는 자신의 인사청문회 현장에서도 오클로가 에너지부 산하 아이다호국립연구소에서 첫 SMR을 개발하고 있다고 밝히며 “이것은 미국의 미래 에너지원의 거대한 부분을 차지해야 한다”고 강조했습니다.월가에서의 오클로를 향한 시선도 다소 나뉩니다.웨드부시 애널리스트들은 AI 혁명 데이터센터 구축에 대한 신뢰가 높아짐에 따라 오클로 주식에 대한 목표가를 45달러로 상향 조정했지만, 시티는 오클로에 대한 ’중립‘ 입장을 재확인했죠.지난 7일(현지시간) 종가 기준 오클로는 55.49달러를 기록해 주가 낙관론자들의 편에 서 있습니다. 최근 한 달 동안 주가는 112%가 올랐습니다.오클로의 상승세는 미국의 에너지 전략과 맞닿아있습니다. 미국의 에너지 패권을 위한 도전 자체가 오클로의 상승 동력으로 작용할 것으로 보입니다.‘홍키자의 빅테크’는 테크, 플랫폼, 이코노미와 관련된 각종 이슈 뒷얘기를 파헤칩니다. 지금 홍성용 기자의 기자페이지를 ‘구독’하시면 깊이가 다른 콘텐츠를 만날 수 있습니다."
"""미리 토마토 뺄게요""…리스크 대비 '헤징 메뉴'가 뜬다",https://n.news.naver.com/mnews/article/057/0001870726,MBN,2025-02-08 20:16:10,"【 앵커멘트 】작년에 토마토가 제때 수급이 안 돼 유명 햄버거에 토마토가 일시적으로 빠진 적이 있었죠.이제는 식품업체들이 신메뉴를 출시할 때부터 이런 수급에 어려움을 겪을 수 있는 재료를 처음부터 빼고 출시하는 경우가 늘고 있습니다.다만 원래 맛에 익숙해진 고객들이 떠날 수 있어 대체 재료에 고심하고 있습니다.신용수 기자입니다.【 기자 】최근 유명 프랜차이즈 햄버거 업체가 내놓은 신제품입니다.고기 패티가 기존 제품보다 두껍고 채소 비중을 줄인 게 특징입니다.지난해 가을 수급 부족 사태로 곤혹을 치렀던 토마토는 아예 뺐습니다.▶ 인터뷰 : 맥도날드 직원- ""(신메뉴 토마토 들어가요?) 아니오.""또 다른 햄버거 업체도 토마토는 제외하고 고급 치즈 등을 추가한 신제품을 내놨습니다.소비자들에게 다양한 선택권을 줄 수 있다는 게 업체 측의 설명입니다.▶ 인터뷰 : 김나현 / 햄버거 업체 직원- ""소스와 원재료에 다양성을 둬서, 고객들의 선택지를 확대했습니다.""급격한 기후변화 등으로 수급이 불안정한 식자재를 미리 빼서 위험을 줄이는 겁니다.초고물가도 이런 현상을 부추겨, 카페에서는 원두값이 급상승한 커피 대신 이색 주스 등을 개발하기도 합니다.▶ 인터뷰(☎) : 김시월 / 건국대 소비자정보학과 교수- ""물가가 올라가고, 원재료가 올라가니까 가격 인상을 두려워하는 소비자들을 위해서 그런 현상이 나타나는 건 일시적이진 않을 것 같고요.""다만 가격을 내리거나 맛과 재료 모두 빼는 만큼 더해야 고객들의 이탈을 막을 수 있다는 지적입니다.MBN뉴스 신용수입니다.영상취재 : 전범수 기자영상편집 : 오혜진그래픽 : 양문혁"
"가상자산사업자 수 42개에서 31개로 '뚝'…""신고 요건 강화""",https://n.news.naver.com/mnews/article/277/0005543516,아시아경제,2025-02-08 19:35:35,"국내 가상자산사업자가 기존 42개에서 31개로 감소했다. 지난해 가상자산 이용자보호법 시행 등으로 신고 요건이 기존보다 까다로워지면서 갱신신고를 포기한 곳들이 늘어난 것으로 풀이된다.8일 금융정보분석원(FIU)에 따르면 지닥(피어테크), 프로비트(오션스) 등 10개 가상자산사업자가 신고 유효기간 만료로 사업자 지위를 상실했다.가상자산 거래소, 커스터디(수탁) 업체, 지갑 사업자 등 가상자산사업자들은 2021년 9월 개정 특정금융정보법(특금법)에 따라 최초 신고를 마쳤다. 이후 2021년 10월부터 2022년 2월까지 심사를 마치는 순서대로 신고를 수리받았다.갱신신고는 2021년 최초 신고 때보다 요건이 까다로워졌다. 지난해 이용자 보호법 시행으로 가상자산사업자들에 이상거래감지시스템 구축, 보험 가입 등 의무 사항이 추가됐기 때문이다.이번에 가상자산사업자 지위를 상실한 11곳 중 10곳은 원화 거래를 지원하지 않는 코인마켓 거래소(▲지닥 ▲프로비트 ▲후오비코리아 ▲플렛타익스체인지 ▲한빗코 ▲비트레이드 ▲코인엔코인 ▲캐셔레스트 ▲텐앤텐 ▲에이프로빗) 였다. 나머지 1곳은 가상자산 지갑사업자 마이키핀월렛이다."
"""BTS 언제 돌아오나 했는데"" 환호…개미들 신났다",https://n.news.naver.com/mnews/article/015/0005091507,한국경제,2025-02-08 18:04:11,"조정장서 미디어·엔터주 '승승장구'네카오·크래프톤 등 AI 사업 기대 긍정적하이브 등 엔터株 한달간 15% 상승BTS·블랙핑크 등 간판 아티스트 컴백 효과사진=게티이미지뱅크국내 증시가 탄핵 정국에 트럼프발(發) 관세 충격으로 흔들리는 상황 속 미디어·엔터테인먼트 업종이 두각을 나타내고 있다. 정보기술(IT) 대장주 네이버와 카카오는 AI 사업으로, 엔터주는 대표 아이돌 그룹의 활동 재개로 실적 개선에 대한 기대가 커지면서다. 이들 업종은 해외 매출 비중이 높아 고환율 수혜를 볼 것이란 분석도 나온다.8일 한국거래소에 따르면 KRX 미디어&엔터테인먼트 지수는 최근 한 달(7일 종가 기준)간 8.24% 오르며 KRX 지수 중 1위를 기록했다. 이는 코스피지수(1.34%)와 코스닥지수(3.47%) 상승률을 크게 웃도는 수준이다.현재 KRX 미디어&엔터테인먼트 지수 내 시가총액 상위 1~3위 종목은 네이버·카카오·크래프톤이다. 이들은 AI 사업에 대한 기대로 최근 한 달 동안에만 각각 8.15%, 13.67%, 10.53%씩 상승했다.중국 인공지능(AI) 스타트업 딥시크(DeepSeek)가 미국 빅테크(거대 기술기업) AI 모델(메타 라마)의 10분의 1 비용으로 챗GPT에 맞먹는 대규모언어모델(LLM)을 선보이자 국내에선 네이버와 카카오가 조명을 받았다. 미국이 주도하던 AI 시장에서 후발주자들이 함께 경쟁하는 사업 환경이 펼쳐질 것이란 기대에서다.네이버는 국내에서 AI에 가장 많이 투자한 기업이다. 한국형 AI 모델 개발에 적합한 방대한 데이터를 보유하고 있다는 평가를 받는다. 여기에 이해진 글로벌투자책임자(GIO)가 이사회 의장으로 복귀해 AI 사업을 진두지휘할 것이란 소식도 투자심리에 긍정적 영향을 미쳤다.카카오와 크래프톤 주가도 AI 사업에 대한 기대가 밀어올렸다. 챗GPT 개발사 오픈AI 창업자 샘 올트먼 최고경영자(CEO)가 지난 4일 정신아 카카오 대표와 김창한 크래프톤 대표를 만나 AI 협업 방안을 논의하기도 했다. 카카오는 오픈AI와 협업을 통해 일반 사용자 대상의 공동 제품·서비스 개발에 나선다. 카카오 서비스에 챗GPT를 탑재하는 것을 넘어 완전히 새로운 AI 상품과 서비스를 만들겠다는 구상이다.김소혜 한화투자증권 연구원은 ""AI 모델의 가격은 점차 낮아지고 있고, 이를 활용할 수 있는 측면에서의 수익 창출 기회는 이제 본격화할 것""이라며 ""그동안 생성형 AI를 효과적으로 활용하기 위해 막대한 연산 자원과 고성능 그래픽처리장치(GPU)가 필수적이었지만 이번 (딥시크) 이슈는 더 적은 투자로도 AI 모델을 운영할 수 있는 가능성을 열어줬다""고 분석했다.크래프톤은 AI 사업에 더해 신작 기대감이 반영되면서 줄곧 우상향이다. 증권가에선 크래프톤이 생성형 AI 도구를 활용해 유저 창작 콘텐츠(UGC) 생태계를 활성화할 것으로 전망한다. 특히 다음달 출시되는 신작 'inZOI'의 흥행 가능성을 높게 평가하고 있다.김지현 흥국증권 연구원은 ""200만장 판매 가능성 있는 지식재산권(IP)인 'inZOI'가 출시 예정임에도 크래프톤의 매출과 영업이익의 기존 규모가 절대적으로 크다는 점에서 실질적인 매출단의 기여는 적을 것""이라며 ""그러나 이번 'inZOI'의 발매로 크래프톤의 가장 큰 리스크였던 단일 IP에 대한 우려가 줄어들 것""이라고 전망했다.방탄소년단./사진=연합뉴스하이브(15.23%)·와이지엔터테인먼트(15.16%)·JYP엔터테인먼트(15.62%) 등 엔터주들도 상승 곡선을 그리고 있다. 각 기업의 간판 아이돌 그룹이 활동 재개에 나서면서 실적 성장에 대한 기대가 커지면서다. 하이브는 '완전체'로서의 방탄소년단(BTS) 컴백이 주가를 끌어올렸다. BTS가 올 하반기 활동을 재개하면서 내년까지 실적에 긍정적 영향을 줄 것이란 분석이다.와이지엔터는 올해 7인조 신인 걸그룹 베이비몬스터과 트레저 활동 확대에 더해 블랙핑크의 완전체 컴백으로 실적이 개선될 것이란 예상이다. JYP엔터도 올 상반기 스키즈와 하반기 트와이스 투어로 고연차 라인업이 실적을 받쳐주고, 저연차 라인업은 팬덤 스케일업을 보여줄 것이란 관측이 나온다.고환율 수혜 기대도 나온다. 엔터사들의 해외 콘서트 티켓과 앨범·굿즈(기획 제품) 판매 수익이 주로 달러로 결제되는 만큼, 매출의 원화 환산액이 커질 것으로 예상되면서다. 원·달러 환율은 지난해 말 비상계엄 발령으로 1480원을 넘어서며 약 16년 만에 최고치로 치솟았다. 현재까지도 트럼프 행정부의 관세 불확실성과 '딥시크 쇼크'로 확대된 위험 회피 심리에 원·달러 환율은 1440~1450원대를 나타내고 있다.지인해 신한투자증권 연구원은 ""문화 수출에는 관세장벽이 없다""며 ""해외 비중이 높은 산업 특성상 강달러 환경까지도 엔터 업종의 투자 매력도를 한층 끌어올리고 있어 올해 주도 섹터가 될 수 있을 것""이라고 내다봤다."
내일도 한파 지속…일부 지역 눈비,https://n.news.naver.com/mnews/article/018/0005939173,이데일리,2025-02-08 18:00:15,"[이데일리 원다연 기자] 9일도 한파가 계속되는 가운데 일부 지역에 눈비가 내리겠다.아침 최저기온은 -15~-3도, 낮 최고기온은 -2~6도로 예보됐다. 강원 철원과 화천은 -15도까지 떨어지겠다.전국이 대체로 맑겠으나 충청권과 전라권, 제주도는 흐리며 눈 또는 비가 오겠다. 충남 서해안은 새벽에, 전라 서해안은 오전까지 눈이 오는 곳이 있겠다.주말 이틀간 예상 적설량은 전북 서해안·광주·전남 서부 3~8㎝(많은 곳 서해안 10㎝ 이상), 전북 남부 내륙 1~5㎝, 제주도 3~8㎝(많은 곳 제주도 산지 10㎝ 이상)다. 예상 강수량은 전북 서해안·남부 내륙·광주·전남 서부 5㎜ 미만, 제주도 5~10㎜다.미세먼지 농도는 원활한 대기 확산으로 전 권역이 ‘좋음’~‘보통’ 수준을 보이겠다.바다 물결은 동해 앞바다에서 0.5~2.5m, 서해 앞바다에서 0.5~2.0m, 남해 앞바다에서 0.5~1.5m로 일겠다. 안쪽 먼바다(해안선에서 약 200㎞ 내의 먼바다) 파고는 동해 1.0~4.0m, 서해·남해 1.0~3.5m로 예상된다.극심한 한파에 폭설까지 이어진 7일 서울 강동구 119특수구조단 광나루수난구조대 소속 대원들이 쇄빙 작업을 하고 있다. (사진=연합뉴스)"
홍준표 “이 추운날 현직 대통령 터무니없는 혐의로 구금…尹 석방해야”,https://n.news.naver.com/mnews/article/018/0005939165,이데일리,2025-02-08 17:19:08,"[이데일리 원다연 기자] 홍준표 대구시장은 8일 “윤석열 대통령의 신병부터 석방되었으면 한다”고 밝혔다.홍 시장은 이날 페이스북을 통해 “탄핵 반대 집회에 참가해서 실상을 알리는 연설을 하고 싶은데 가면 무고연대에서 선거법 위반으로 또 고발 할테고, 윤 대통령 석방 국민 변호인단에도 공직자 가입은 안된다고 하고 결국 페북에 내 의견만 게재하는 것으로 만족할수 밖에 없다”며 이같이 썼다.홍 시장은 “윤 대통령의 신병부터 석방이 되었으면 한다”며 “이 추운 겨울날에 현직 대통령을 터무니 없는 혐의로 계속 구금 하는건 법 절차에도 맞지 않고 도리도 아니다”고 밝혔다. 이어 “법원의 각성을 촉구한다”고 덧붙였다.홍준표 대구시장이 15일 대구 군위군 효령면 한 채석장을 방문해 대구경북통합신공항 건설 사업 협조를 요청하고 있다. (사진=연합뉴스)"
